question_text,question_image,correct_answer,option_1_text,option_2_text,option_3_text,option_4_text,option_1_image,option_2_image,option_3_image,option_4_image,answer_explanation_text,answer_explanation_image
Which of the following is incorrect about Akbar&#39;s mansabdari system?,NA,A,It was for the military only.,Mansab meant a rank.,The ranks were divided into zat and sawar,It centralised the bureaucracy.,NA,NA,NA,NA,"Akbar introduced a new system for regulating imperial services which was called Mansabdari system. It was introduced in 1570 A.D. All the gazette imperial officers of the state were styled as Mansabdars. They were classified into (66) grades, from the rank of (10) to ten thousands (10,000) constituted. The (10) was the lowest rank and the ten thousand (10,000) was the highest. The Mansabdars belonged to both Civil and Military department.",NA
What was Zawabits?,NA,B,Agricultural taxes,State decrees or laws,Affairs concerning Hindus,None of these,NA,NA,NA,NA,The term <q> Zawabit</q> literally mean <q>State laws</q> in Persian language but it is used contextually as <q>Secular Decrees</q> issued by the Mughal state undersigned by the ruler.,NA
Which of the following is correct about the system of escheat under Akbar?,NA,C,The deceased noble&#39;s property was inherited by his son.,The deceased noble&#39;s property was given to his widow.,The deceased noble&#39;s property was taken away by the State.,None of these.,NA,NA,NA,NA,"The law of escheat (zabti), according to which when a Mansabdar died, all his property was confiscated by the king. The Mansabdari system, introduced by Akbar, was a unique feature of the administrative system of the Mughal empire.",NA
Which of the following is incorrect about the institution of Vakil under Akbar?,NA,A,Bairam Khan was the <q>limited</q> vakil.,Akbar transferred and appointed vakils,The institution of Diwan was created to curb the power of the vakil.,None of these.,NA,NA,NA,NA,"During era of Babur and Humayun, it had the powers of prime minister while during early era of Akbar, Vakil Bairam Khan acted as regent and ruled on the behalf of Emperor.",NA
Jehangir&#39;s greatest achievement was the signing of a peace treaty with Mewar in 1614. Which was not one of its clauses?,NA,A,Chittor fort was to be repaired.,Prince Karan got a mansab of 5000 zat/sawar at Jehangir&#39;s court.,"Rana Amar Singh was to supply 1,500 horses to the Mughals",All territories including Chittor were given to Rana Amar Singh,NA,NA,NA,NA,"A is the correct option. In the treaty, it was agreed that: <br/><br/>The ruler of Mewar, will not be bound to present himself in person at Mughal court, instead, a relative of the Rana would wait upon the Mughal Emperor and serve him. <br/>It was also agreed that the Ranas of Mewar would not enter matrimonial relations with the Mughals. <br/>Mewar would have to keep a contingent of 1500 horsemen in the Mughal service. <br/>Chittor and other Mughal occupied areas of Mewar would be returned to the Rana, but Chittor fort would never be repaired. The reason for this last condition was that the Chittor fort was a very powerful bastion and the mughals were wary of it being used in any future rebellion. <br/>The Rana would be given a Mughal rank of 5000 zat and 5000 sowar. <br/>The rulers of Dungarpur and Banswarra (who had become independent during Akbar&#39;s reign) would once again become vassals of Mewar and pay tribute to the Rana.",NA
Jehangir&#39;s faithful general Mahabat Khan revolted against him in 1626 A.D. because,NA,C,Mahabat Khan wanted to rule independently in Bengal and Bihar.,His son was executed by Jehangir.,Of Nur Jahan&#39;s intrigues.,All of the above.,NA,NA,NA,NA,"As a result of Nur Jahan&#39;s machinations against Jahangir, Mahabat Khan decided to take action, and so in 1626, he led an army of loyal Rajput soldiers to Punjab. He had also brought the wives and families of many of them, so that, if driven to extremity, they would fight to the last for the lives and honour of themselves and their families. Meanwhile, Jahangir and his retinue were preparing to head to Kabul, and were encamped on the banks of the River Jhelum. Mahabat Khan and his forces attacked the royal encampment, and successfully took the emperor hostage; Nur Jahan, however, managed to escape.",NA
Prince Khurram (Shahjahan) rebelled against Jehangir in 1623 A.D. because of,NA,B,The unfair treatment he got in the Deccan due to Jehangir.,The intrigues of Nur Jahan.,The excellent opportunity he had of declaring his independence in the Deccan.,The harmful influence of Mahabat Khan.,NA,NA,NA,NA,Prince Khurram feared that in his absence Nur Jahan would attempt to poison his father against him and convince Jahangir to name Shahryar the heir in his place. This fear brought Prince Khurram to rebel against his father rather than fight against the Persians.,NA
Jehangir was buried at Shahdara near,NA,A,Lahore,Agra,Delhi,Badakshan,NA,NA,NA,NA,"The Tomb of Jahangir is a 17th-century mausoleum built for the Mughal Emperor Jahangir. The mausoleum dates from 1637, and is located in Shahdara Bagh in Lahore, Punjab, Pakistan, along the banks of the Ravi River. The site is famous for its interiors that are extensively embellished with frescoes and marble, and its exterior that is richly decorated with pietra dura.",NA
Which of the following events occurred during Shahjahan&#39;s reign?,NA,D,Rebellion of Bundela Rajputs.,Death of Nur Jahan.,Suppression of the Portuguese in Bengal,All of the above.,NA,NA,NA,NA,"Option D is correct. All of the events listed occurred during Shahjahan&#39;s reign. The Rebellion of Bundela Rajputs took place in 1635, the death of Nur Jahan occurred in 1645, and the suppression of the Portuguese in Bengal happened in 1631.",NA
The immediate cause of Shahjahan&#39;s rebellion against Jehangir was,NA,C,That Shahjahan had become too powerful.,That Shahjahan had insulted Jehangir in the Mughal court cover the question of Deccan.,That Shahjahan refused to go to Qandhar which had been beseiged by the Persians,None of these.,NA,NA,NA,NA,"Option C is correct. The immediate cause of Shahjahan&#39;s rebellion against Jahangir was that Shahjahan refused to go to Qandhar, which had been besieged by the Persians. Shahjahan believed that Jahangir&#39;s orders were reckless and that he should not have to risk his life in such a risky campaign. This led to a rift between the two and eventually resulted in Shahjahan&#39;s rebellion against Jahangir.",NA
The credit for the defeat of Mahabat Khan during Jehangir&#39;s reign goes to,NA,A,Nur Jahan,Jehangir,Asaf Khan,Shahjahan,NA,NA,NA,NA,"A is the correct option. As a result of Nur Jahan&#39;s machinations against him, Mahabat Khan decided to take action, and so in 1626, he led an army of loyal Rajput soldiers to the Punjab. Mahabat Khan and his forces attacked the royal encampment, and successfully took the emperor hostage; Nur Jahan, however, managed to escape.",NA
The chain of Justice is associated with,NA,C,Nur Jahan,Akbar,Jehangir,Shahjahan,NA,NA,NA,NA,"C is the correct option. The unusual chain was according to some accounts made of gold, was eighty feet long, and had sixty bells attached to it, linking Agra Fort to a post by the nearby riverbank. It was known simply as the <q>chain of justice</q>, and forging it was one of Nuruddin Jahangir&#39;s first acts as leader of the Mughal Empire.",NA
"Which of the following statements are correct with regard to the Mughal expedition into Balkha and Badakhshan? <br/><br/>(i) There was the proclaimed desire on the part of the Mughal emperors to recover their ancestral lands <br/>(ii) Shahjahan wanted to punish Nazr Muhammad the ruler of Balkh and Badakhashan, who had an eye on Kabul <br/>(iii) Shahjahan wanted to enthrone Prince Dara Shukoh as an independent ruler of Balkh <br/>(iv) Shahjahan desired to assign Badakhshan in Jagir to prince Aurangzeb <br/>Select the answer from the options given below:",NA,C,"(i), (ii) and (iii) only",(i) and (iii) only,(i) and (ii) only,(ii) and (iii) only,NA,NA,NA,NA,"Answer: (i) and (ii) only <br/><br/>In 1646-1647, Mughal Emperor Shah Jahan launched a military expedition to conqueror Balkh and the neighbouring province of Badakhashan. This campaign was to be the first step in the expansion of Mughal rule into Central Asia, where the Ferghana valley lay.<br/>Ferghana valley was the homeland of the Babur, the first Mughal Emperor and the founder of the dynasty in India.<br/><br/>Following are the reasons why Emperor Shah Jahan undertook this campaign:-<br/>The first and foremost reason was the proclaimed desire on the part of the Mughal emperors to recover their ancestral lands. As direct descendants of Tamerlane, the Mughals of India considered Central Asia their true home and ancestral domain. <br/>In 1628, Nazr Mohammed launched a large-scale invasion of Mughal territory with the intention of capturing Kabul. Shahjahan wanted to punish Nar Muhammad the ruler of Balkh and Badakhashan, who had an eye on Kabul. <br/>Hence, Shah Jahan dispatched an army of 60,000 to Kabul, and then to Badakhshan and Balkh, with his son Murad Baksh as the commander-in-chief. Shahjahan never wanted to enthrone Prince Dara Shukoh as an independent ruler of Balkh. <br/>Shah Jahan appointed Prince Aurangzeb, then serving as the governor of Gujarat, to lead operations in Central Asia. But he never desired to assign Badakhshan in Jagir to prince Aurangzeb.<br/>Aurangzeb arrived in Kabul in April 1647 and set out for Balkh to reinforce the Mughal forward positions and expand the campaign. <br/>By the middle of 1647, both sides had suffered considerably from the back-and-forth fighting.  Shortly after Aurangzeb had returned to Balkh, negotiations were opened with Nadr Mohammed, the exiled ex-ruler of the territories occupied by the Mughals since 1645. <br/>A settlement was concluded by Nadr Mohammed&#39;s grandsons and Balkh was formally handed over to the grandsons, and the Mughals began the withdrawal to Kabul.",NA
Qandhar was lost again by the Mughals during the reign of,NA,A,Shahjahan,Aurangzeb,Bahadur Shah I,None of these,NA,NA,NA,NA,"During the reign of Shahjahan, the Mughals lost the city of Qandhar to the Persians. Shahjahan was the fifth Mughal Emperor and ruled from 1628 to 1658. During his reign, the Mughal Empire reached its peak and he was known for his architectural achievements, such as the Taj Mahal.",NA
Which is true about the Deccan policy of Shah Jahan?,NA,C,Ahmadnagar was lost.,Ahmadnagar was lost but Bijapur was annexed.,Ahmadnagar was annexed and Bijapur and Golkunda were defeated,Ahmadnagar was annexed and Bijapur and Golkunda could not be defeated,NA,NA,NA,NA,"When Babur attacked India there were six Muslim states, viz., Khandesh, Berar, Ahmadnagar, Bijapur, Golkunda and Bidar and one Hindu state, i.e., Vijayanagar in the South. According to Babur, the state of Vijayanagar was the strongest among them. However, Babur and Humayun could not pay any attention towards the South. <br/>By the time Akbar interfered in politics of the Deccan, the political situation had changed there. In January 1565 A.D., Ahmadnagar was annexed and Bijapur and Golkunda were defeated.",NA
The tomb of Jehangir was built at Shahdara during the reign of,NA,B,Jehangir,Shahjahan,Aurangzeb,Bahadur Shah I,NA,NA,NA,NA,"The tomb of Jahangir was built after the Mughal emperor&#39;s death in 1627 and completed in 1637, in the reign of his son and successor, Shah Jahan, when the Mughal Empire held sway over the entire Indian subcontinent and Lahore was an important urban center",NA
A war of succession was fought among the sons of Shahjahan in 1657-58 A.D. Who were they?,NA,C,"Kam Baksh, Murad, Dara, Aurangzeb","Aurangzeb, Dara, Shuja, Kam Baksh","Dara, Aurangzeb, Murad, Shuja","Dara, Kamran, Aurangzeb, Murad",NA,NA,NA,NA,"The sons of Shahjahan who fought in the war of succession in 1657-58 A.D. were Dara Shikoh, Shuja, Aurangzeb, and Murad. These four brothers were all contenders for the Mughal throne after Shahjahan&#39;s illness and eventual death in 1657. The war of succession lasted for over a year and ultimately resulted in Aurangzeb&#39;s victory and his ascension to the Mughal throne.",NA
Shahjahan&#39;s Central Asian policy was a failure because,NA,A,Qandhar was lost to the Mughals once and for all.,The Mughals had to vacate Balkh in 1647.,A lot of money had been spent.,None of these.,NA,NA,NA,NA,"Option A is correct. Shahjahan&#39;s Central Asian policy was a failure because Qandhar was lost to the Mughals once and for all. This was a significant blow to the Mughal Empire and contributed to the decline of Mughal power in the region. The Mughals also had to vacate Balkh in 1647 and a lot of money was spent on these campaigns, but these were not the primary reasons for the failure of Shahjahan&#39;s Central Asian policy.",NA
What was the main cause for the war of succession among the four sons of Shahjahan?,NA,A,The Mughals did not follow any definite law of succession,Shahjahan was more inclined towards Dara.,Aurangzeb was over ambitious,None of these.,NA,NA,NA,NA,Option A is correct. The main cause for the war of succession among the four sons of Shahjahan was that the Mughals did not follow any definite law of succession. Shahjahan had not named a successor and the four brothers all believed they had a valid claim to the throne. This led to a power struggle and ultimately resulted in the war of succession in 1657-58 A.D.,NA
Aurangzeb reimposed Jaziya in,NA,B,1675,1679,1681,1682,NA,NA,NA,NA,"Aurangzeb, the sixth emperor, re-introduced and levied jizya on non-Muslims in 2nd April, 1679. His goal was to promote Islam and weaken the Hindu religion.",NA
Aurangzeb appointed special officers called Muhtasibs. Their function was to see that,NA,A,The Muslims led their lives according to the Quranic law,The Hindus paid pilgrimage tax.,The non-Muslims did not carry arms.,All Hindu students were discharged from the Muslim <q>Maktabas</q> and <q>Madarsas</q>.,NA,NA,NA,NA,"Option A is correct. Aurangzeb appointed special officers called Muhtasibs, whose function was to see that the Muslims led their lives according to the Quranic law. The Muhtasibs were responsible for enforcing Islamic laws and customs, and they had the authority to punish those who violated these laws. The other options listed are incorrect.",NA
Aurangzeb discouraged painting because,NA,C,Many non-Muslims had earned proficiency in painting,It could weaken the senses of the people,It was against the sanctions of Islam,A lot of money that could be used for strengthening the Mughal army was spent on it.,NA,NA,NA,NA,"Option C is correct. Aurangzeb discouraged painting because he believed it was against the sanctions of Islam. Aurangzeb was a devout Muslim and believed that painting, along with other forms of art, was a form of idolatry and therefore prohibited according to Islamic law. The other options listed are incorrect.",NA
Aurangzeb discontinued the practice of inscribing Kalima on the coin because,NA,B,It was a practice borrowed from the Turks.,It would have been dishonoured by coming under the feet of the people,It hampered the smooth functioning of the escheat system.,None of these.,NA,NA,NA,NA,"The correct answer is option B. Aurangzeb discontinued the practice of inscribing Kalima on the coins because he believed that it would have been dishonoured by coming under the feet of the people. Aurangzeb was a devout Muslim and believed strongly in the Islamic faith. As part of his beliefs, he believed that it was wrong to have the Kalima (Islamic creed) inscribed on coins, as it would be dishonoured by coming under the feet of the people. He also believed that it would diminish the sanctity of the coins and the Islamic faith. He thus decided to discontinue the practice of inscribing the Kalima on coins, as he believed it would be disrespectful to the faith.",NA
Aurangzeb abolished the practice of <q>Jharokha darshan</q> (the practice whereby the common people came to the ruler wiith their problems) because,NA,B,It was needlessly popularised by Dara.,It was a Hindu practice.,It diminished the prestige and the authority of the emperor,None of these,NA,NA,NA,NA,"The correct answer is B: It was a Hindu practice. Aurangzeb abolished the practice of Jharokha darshan due to his belief that it was a form of idol worship and a non-Islamic practice. The practice of Jharokha darshan was started by Mughal emperor Akbar, Aurangzeb&#39;s great grandfather, as a Hindu tradition in which the emperor would daily address the public audience from a balcony known as a Jharokha. Aurangzeb believed that the practice of Jharokha darshan diminished the prestige and authority of the emperor and thus decided to abolish it. He also banned the practice of Tuladan, the practice of weighing the emperor in gold, which was also started by Akbar.",NA
Match the following <br/>Column I               Column II<br/>(a) Akbar              (I) 1627-1658 <br/>(b) Jahangir         (II) 1605-1627<br/>(c) Shah Jahan      (III) 1556-1605,NA,C,"(a)-(II),(b)-(III),(c)-(I)","(a)-(II),(b)-(I),(c)-(III)I]","(a)-(III),(b)-(II),(c)-(I)","(a)-(I),(b)-(II),(c)-(III)",NA,NA,NA,NA,"The correct answer is C, as all the years are correctly matched with the kings",NA
"There were some rebellions during Aurangzeb&#39;s reign including those of the Jats, the Satnamis, the Sikhs and so on. Which was possibly the most important cause for their outbreak?",NA,D,Aurangzeb&#39;s religious policy,Aurangzeb&#39;s Deccan policy,Aurangzeb&#39;s land revenue policy,The agrarian crisis,NA,NA,NA,NA,"There were instances where peasants refused to pay land revenue and such villages were designated as mawas and zor-talab. Initially the acts of defiance by the peasantry were mere isolated incidents perhaps due to varied level of distress, but later on in this struggle the peasants and zamindars usually joined hands. The zamindars could be chieftains or could be a person having rights over portion of a village, but they formed a distinct class enjoying common rights like commanding armed retainers and were the leader of caste group. Some of these zamindars&#39; like Shobha Singh&#39;s rebellion (1695-98) in Bengal had, in fact, shaken the empire and similarly in Coonch-Behar, Bhim Narayan was able to expel the Mughal troops and officials. These frequent rebellion produced agrarian crisis. The Jats of Agra region, the Satnamis, the Sikhs and many more rose in revolt during Aurangzeb's reign because of the Agrarian Crisis.",NA
Aurangzeb followed an aggressive policy towards the Rajputs because,NA,C,The Rajputs were slowly beginning to challenge the might of the Mughal empire,The Rajputs had come to occupy many high posts in the Mughal administration.,Aurangzeb did not want the Rajputs to hinder the Islamisation of India.,None of these,NA,NA,NA,NA,Aurangzeb followed an aggressive policy towards the Rajputs because Aurangzeb did not want the Rajputs to hinder the Islamisation of India.,NA
The dual rank of <q>Zat</q> and <q>Sawar</q> was for the first time mentioned in which of the following contemporary sources?,NA,B,Ain-i-Akbari,Akbar Namah,Iqbal Namah,Tabaqat-i-Akbari,NA,NA,NA,NA,"The correct answer is option (B), Akbar Namah. During later years of his reign, Akbar introduced the rank of <q>Zat</q> and <q>Sawar</q> in the Mansabdari system. Different views have been expressed regarding these terms. According to Blochmann, every mansabdar had to maintain as many soldiers as were indicated by his rank of Zat while the rank of Sawar indicated the number of horsemen among them. Irvin expressed the view that Zat indicated the actual number of cavalry under a mansabdar besides other soldiers while sawar was an additional honour.",NA
"In which language did Babur wrote his memoirs, called <q>Tuzuk-i-Baburi</q>?",NA,A,Turkish,Arabic,Mongol,Persian,NA,NA,NA,NA,"Tuzuk-i-Baburi (Baburanamah) is the autobiography of Zahiruddin Muhammad babur, the founder of the Mughal empire in India. Babur wrote it in Turkish language; Mughal imperial officer Abdur Rahim Khan Khan-i-Khanan, son of Bairam Khan Khan-i-Khanan, translated it into Persian.",NA
During the reign of which great Mughal was tobacco introduced in India?,NA,A,Akbar,Jahangir,Shahjahan,Aurangzeb,NA,NA,NA,NA,"Akbar (Abul-Fath Jalal ud-din Muhammad Akbar, 15 October 1542 - 1605) was the third Mughal Emperor. He was born in Umerkot, India. He was the son of Emperor Humayun. He became emperor at age 13. He is considered to be one of the greatest rulers of India. He was known as much for his inclusive leadership style as for his war mongering. He began a time of religious tolerance and appreciation for the arts. Akbar had great respect for the Rajputs. He realised that with their support, he could consolidate his empire. <br/><br/>Tobacco in India is introduced by Portuguese during the reign of Akbar. <br/><br/>Jahangir prohibited/banned the use of tobacco.",NA
"Who among the following murdered Abul Fazl, the official historian of Akbar, at the instigation of Prince Salim in 1602?",NA,C,Raja Todar Mal,Raja Bhagwan Das,Bir Singh Bundela,Mirza Ghiyas Beg,NA,NA,NA,NA,"Abul Fazl was assassinated while he was returning from the Deccan by Vir Singh Bundela (who later became the ruler of Orchha) between Sarai Vir and Antri (near Narwar) in a plot contrived by Akbar&#39;s eldest son Prince Salim (who later became the Emperor Jahangir) in 1602, because Abul Fazl was known to oppose the accession of Prince Salim to the throne. His severed head was sent to Salim at Allahabad. Abul Fazl was buried at Antri. Abul Fazl&#39;s son Shaikh Afzal Khan (29 December 1571 - 1613) was later appointed governor of Bihar in 1608 by Jahangir.",NA
"Which great Mughal is credited with prohibiting <q>Sati</q> unless the widow herself, of her own free will, persistently desired it?",NA,A,Akbar,Babur,Humayun,Jahangir,NA,NA,NA,NA,"Firstly, the sati system was banned by the Humayun emperor but strict laws were not implemented. Afterwards, the sati system was banned by Akbar with law enforcement.",NA
<q>Jagir</q> of the Mughals is equal to which of the following Sultanate period?,NA,B,Inam,Iqta,Waqf,Khalisa,NA,NA,NA,NA,"A jagir, also spelled as jageer, was a type of feudal land grant in the Indian subcontinent at the foundation of its Jagirdar (Zamindar) system. <br/>Iqta means land or land revenue assigned to an individual on certain conditions. The holders of these Iqtas were the trustful agents of the Sultan. There were two kinds of Iqtas viz. Large Iqtas and Small Iqtas.",NA
Who wrote the history of Aurangazeb&#39;s reign in total secrecy because of the emperor&#39;s oppositon to it?,NA,A,Khafi Khan : Mutakhab-ul-Labab,Aquil Khan Razi : Zafar Namah-i-Alamgiri,Muhammad Saqi : Masir-i-Alamgiri,None of the above,NA,NA,NA,NA,"The correct answer is option (A). During Aurangzeb&#39;s reign, Muntakhab-ul-Lubab was written by Khafi Khan, a historical writer. The book covers the history of Mughal period till the reign of Mughal emperor Aurangzeb.",NA
What is the correct sequence of the following battles?<br/><br/>I. Battlee of Haldighati<br/>II. Battle of Chausa<br/>III. Battle of Samel<br/>IV. Second Battle of the Panipat<br/>V. Battle of Bilgram,NA,B,"I, II, IV, III, V","II, V, III, IV, I","I, II, III, IV, V","II, V, IV, III, I",NA,NA,NA,NA,The correct answer is B as the correct sequence of the battles is B,NA
What is the correct chronology of the following events of Akbar&#39;s reign?<br/><br/>I. Abolition of Pilgrim tax<br/>II. Abolition of Jaziya<br/>III. Introduction of Dagh<br/>IV. Issue of Mahjar<br/>V. Proclamation of Tauhit-i-Ilahi,NA,A,"I, II, III, IV, V","II, III, IV, I, V","I, II, III, V, IV","IV, III, II, I, V",NA,NA,NA,NA,A is the correct chronology of the events of Akbar&#39;s reign.,NA
