question_text,question_image,correct_answer,option_1_text,option_2_text,option_3_text,option_4_text,option_1_image,option_2_image,option_3_image,option_4_image,answer_explanation_text,answer_explanation_image
Which of the following were French visitors to the Mughal empire all of whom were in India in 1666? <br/><br/>I. Tavernier <br/>II. Bernier <br/>III. Thevenot <br/>IV. Manucci,NA,A,"I, II, III","II, III, IV","I, III, IV","II, IV",NA,NA,NA,NA,"Explanation:<br/>In 1666, several French visitors came to the Mughal Empire in India. These visitors played significant roles in documenting and understanding various aspects of the Mughal Empire during that time.<br/><br/>I. Tavernier: Jean-Baptiste Tavernier was a French gem merchant and traveller who visited the Mughal empire multiple times between 1638 and 1668. He had a keen interest in the Indian subcontinent and its riches. Tavernier&#39;s travel accounts provide valuable insights into the Mughal court, its rulers, and the state of the empire during his visits.<br/><br/>II. Bernier: François Bernier was a French physician and traveller who arrived in India in 1658 and stayed for several years. He became acquainted with the Mughal court and its nobles, including Emperor Aurangzeb. Bernier&#39;s observations and writings provide important information about the Mughal society, culture, and administration.<br/><br/>III. Thevenot: Jean de Thevenot was a French traveller who visited the Mughal empire in the mid-17th century. He explored various regions of the empire, including Gujarat, Delhi, and Agra. Thevenot&#39;s travel writings give detailed descriptions of the places he visited and the people he encountered, shedding light on the Mughal society and its customs.<br/><br/>IV. Manucci: Niccolao Manucci was an Italian adventurer who served in the Mughal court and military. Although not French, he is included in the options because he interacted with and worked alongside French visitors during his time in India. Manucci&#39;s memoirs provide valuable insights into the Mughal court, its politics, and the lives of its nobles.<br/><br/>Conclusion: In 1666, the French visitors to the Mughal empire in India were Tavernier, Bernier, and Thevenot. Although Manucci was not French, he had significant interactions with the French visitors and his memoirs contribute to our understanding of the Mughal empire during that period.<br/><br/>Therefore, the correct answer is option 'A' - I, II, III.",NA
Mughal School of Painting is characterised by <br/><br/>I. Excellency in portrait-painting and colour composition. <br/>II. Miniature paintings <br/>III. Keen appreciation of nature <br/>IV. Secular and materialistic <br/>V. Courtly and aristocratic in content.,NA,D,"I, II, III","II, III, IV","I, III, IV, V","I, II, III, IV, V",NA,NA,NA,NA,"Characteristics of Mughal School of Painting:<br/>The Mughal School of Painting is known for several distinct characteristics that set it apart from other art traditions in India.<br/><br/>Here are the key features:<br/>Excellency in portrait-painting and colour composition: - Mughal painters excelled in depicting portraits with great detail and precision. - They were also known for their skillful use of color, creating vibrant and visually appealing compositions.<br/><br/>Miniature paintings: - The Mughal School of Painting is famous for its intricate and delicate miniature paintings, which often depicted scenes from court life, nature, and mythology.<br/><br/>Keen appreciation of nature: - Mughal artists had a deep appreciation for nature and often incorporated natural elements like plants, animals, and landscapes into their paintings.<br/><br/>Secular and materialistic: - Unlike some other art traditions in India, Mughal paintings were often secular in nature, focusing on themes related to courtly life, royalty, and material wealth.<br/><br/>Courtly and aristocratic in content: - Mughal paintings typically depicted scenes from the royal court, including portraits of emperors, courtiers, and other members of the aristocracy.<br/>Overall, the Mughal School of Painting is characterized by its focus on portraiture, mastery of color composition, miniaturization, appreciation of nature, secular and materialistic themes, and courtly aristocratic content. These characteristics make Mughal paintings unique and highly valued in the art world.",NA
Pick out the two Persian master-painters who came to India with Humayun and later served under Akbar from among the following: <br/><br/>I. Khwaja Abdus Samad <br/>II. Sayyid Ali Tabreji <br/>III. Farukh Beg <br/>IV. Tamshad,NA,A,"I, II","II, III","III, IV","I, IV",NA,NA,NA,NA,The Iranian painters were brought by Humayun were Mir Sayyid Ali and Abdus Samad. Both the painters were the founders of an independent branch of Persian art popularly known as the Mughal school of miniature painting. The two most notable works accomplished by them during the reign of Akbar was Tutinama and Hamza Nama.,NA
Which of the following describes the correct division of Akbar&#39;s empire in descending order?,NA,D,"Sarkar, Subah, Pargana","Pargana, Subah, Sarkar","Subah, Pargana, Sarkar","Subah, Sarkar, Pargana",NA,NA,NA,NA,"The answer is option (D) as the divisions were:<br/>Subah was the term for a province in the Mughal Empire. The word is derived from Arabic. The governor of a Subah was known as a subahdar (sometimes also referred to as a <q>Subah</q>), which later became Subedar to refer to an officer in the Indian Army. The subahs were established by Badshah (Emperor) Akbar during his administrative reforms of 1572 - 1580; initially, they numbered 12, but his conquests expanded the number of subahs to 15 by the end of his reign. Subahs were divided into Sarkars, or districts. Sarkars were further divided into Parganas or Mahals. His successors, most notably Aurangzeb, expanded the number of subahs further through their conquests. As the empire began to dissolve in the early 18th century, many subahs became effectively independent, or were conquered by the Marathas or the British.",NA
The Afghan ruler of Malwa who fought against Akbar from 1560 to 1562 A.D. was,NA,B,Asaf Khan,Baz Bahadur,Najibudaulah Khan,None of these,NA,NA,NA,NA,"The correct option is B.<br/> Khan was defeated and killed by a coalition of Baz Bahadur, Khandesh Sultanate, and Berar Sultanate, leading to Baz Bahadur regaining Malwa for a brief period in 1562 before renewed Mughal attacks.",NA
The Hadas remained high in Akbar&#39;s favour without any matrimonial ties with him. They belonged to,NA,A,Ranthambore,Udaipur,Jodhpur,Malwa,NA,NA,NA,NA,"A is the correct option. Akbar&#39;s marriage relations with rajpoot princes had forced him to initiate some liberal actions. No matrimonial relations were established with the Hadas of Ranthambore, yet they remained high in Akbar&#39;s favour without any matrimonial ties with him.",NA
Which one of the following was not a Mughal province in the Deccan during Akbar&#39;s reign?,NA,D,Berar,Khandesh,Ahmadnagar,Bidar,NA,NA,NA,NA,"The five Deccan Sultanates were Berar, Khandesh, Ahmadnagar, Bijapur and Golconda.",NA
Arrange chronologically: <br/><br/>I. Construction of Ibadat Khana <br/>II. Promulgation of Din-i-Ilahi <br/>III. Issuing of Mazharnama,NA,C,"I, II, III","III, I, II","I, III, II","II, III, I",NA,NA,NA,NA,"The Ibadat Khana (House of Worship) was a meeting house built in 1575 CE by the Mughal Emperor Akbar (r. 1556 - 1605) at Fatehpur Sikri. <br/>Akbar issued Mahzarnama (or Infallibility Decree) to take all the religious matters into his own hands in 1579 AD. This made him supreme in the religious matters. He issued Mahzarnama to curb the dominance of Ulema (Religion of God) or Divine Faith was a syncretic religion propounded by the Mughal emperor Akbar in 1582 AD, intending to merge some of the elements of the religions of his empire, and thereby reconcile the differences that divided his subjects. This inspired him to create the Din-i-Ilahi (Divine Religion) in 1582.",NA
