question_text,question_image,correct_answer,option_1_text,option_2_text,option_3_text,option_4_text,option_1_image,option_2_image,option_3_image,option_4_image,answer_explanation_text,answer_explanation_image
"During the period between 1973 to 2003, the production has increased most in the",NA,C,Primary sector,Secondary sector,Tertiary sector,All the three sectors,NA,NA,NA,NA,"The share of tertiary sector in employment (%) has also increased in last 30 years. In 1973, share was nearly 10 to 15% but it has increased from 20 to 22% in 2003. Though tertiary sector is not playing the role of providing employment over expectation, the primary sector continues to be the largest employer even in the year 2000.",NA
India according to the World Bank classification falls in the category of,NA,B,Low-income economies,Lower-middle income economies,Upper-middle income economies,High-income economies,NA,NA,NA,NA,"According to World Bank reports India has been classified under lower-middle income economy. According to  IBTimes, it has got the same tag along with countries like Lesotho, Zambia, Honduras, Ghana, Guatemala and Djibouti. All the other countries in the BRICS:- Brazil, Russia, China, South Africa - belong to upper-middle income group.",NA
What is meant by two-party system?,NA,C,Two parties run the government,Two members run a party,Two parties contest elections,None of these,NA,NA,NA,NA,"The correct option is C.<br/><br/>In politics, a two-party system is a party system in which two major political parties dominate the political landscape. At any point in time, one of the two parties typically holds a majority in the legislature and is usually referred to as the majority or governing party while the other is the minority or opposition party.",NA
NREGA 2005 guarantees work for how many days in a year,NA,A,100,120,150,90,NA,NA,NA,NA,"Notified on September 7, 2005, MGNREGA aims at enhancing livelihood security by providing at least one hundred days of guaranteed wage employment in a financial year to every rural household whose adult members volunteer to do unskilled manual work.",NA
Which one of the following is a public sector enterprise?,NA,C,TISCO,RIL,Indian Railway,WIPRO,NA,NA,NA,NA,"1. Railways are cheap and very convenient mode of transport for long distances.<br/>2. They help in transportation of finished goods or raw materials from one place to another. This helps in growth and development of our country.<br/>3. Railway forms  a link between major cities of our country and travelling time has been reduced.<br/>4. Railways are even capable of transporting bulky material like crude oil, coal etc  in large quantities.<br/>5. Railway facilitates quick movement of troops, police, defence equipment etc.",NA
Which was the largest producing sector in 1973?,NA,A,Primary sector,Secondary sector,Tertiary sector,Public sector,NA,NA,NA,NA,"It is involved with  agriculture and direct  use of natural resource. <br/>Examples : Farming,  apiculture, cattle farming, etc.",NA
"On which of the following basis, the sectors are classified into public and private sector?",NA,C,Employment conditions,The nature of economic activity,Ownership of enterprises,Number of workers employed in an enterprise,NA,NA,NA,NA,"The public sector includes all the public services and enterprises. Public services include public goods and services like roads, water supply, transport, health, military etc. Public enterprises are state-owned that are under public ownership. Private sector includes enterprises that are owned by private people with the aim to gain profit. These are not owned and run by state or government.",NA
"In which one of the following sectors, the production of a commodity is mostly through the natural processes?",NA,A,Primary,Secondary,Tertiary,Service sector,NA,NA,NA,NA,"Primary sector of the economy is the sector that produces products through a natural process. It involves activities such as mining, crop production and animal husbandry. It involves lots of human labor used in the production of preparing the raw material before it goes into other sectors such as manufacturing for it to turn into consumable commodity.",NA
National Rural Employment Guarantee Act was implemented in which one of the following years?,NA,B,2004,2005,2008,2009,NA,NA,NA,NA,"National Rural Employment Guarantee Act, 2005. National Rural Employment Guarantee Act 2005 (or, NREGA No 42, later renamed as the <q>Mahatma Gandhi National Rural Employment Guarantee Act</q>, MGNREGA), is an Indian labour law and social security measure that aims to guarantee the <q>right to work</q>.",NA
Public enterprises are owned by:,NA,B,Individual owners,Government,Both government and individual,None of the above,NA,NA,NA,NA,Public sector refers to government-owned organizations and government-provided services.,NA
The report <q>Global employment and social Outlook</q> is released by,NA,A,International Labour Organisation,World Bank,World Economic Forum,World Trade Organization,NA,NA,NA,NA,Global employment and social outlook is released by the International Labour Organisation.,NA
Consider the following statements about Internal Trade.<br/>1. It refers to the movement of goods and services across different geographical regions in the country.<br/>2 It includes self-employed and persons engaged in both wholesale and retail trade.<br/>Which of these statements is/are correct?,NA,C,1 Only,2 Only,Both 1 and 2,Neither 1 nor 2,NA,NA,NA,NA,"It refers to the movement of goods and services across different geographical regions in the country.<br/>It includes self-employed and persons engaged in both wholesale and retail trade. Presently internal trade is governed by a diversity of controls, multiple organizations and a plethora of orders.",NA
"Which of the following are correctly matched?<br/>1. SETU (Self Employment and Talent Utilization) programme - aimed at setting up world-class technology business incubators to promote start-up business in India coupled with Start-up-India, Make in India<br/>2. IMPRINT (Impacting Research Innovation and Technology) - Initiative by CSIR to develop a roadmap for research to solve major engineering and technology challenges in ten technology domains relevant to India<br/>Choose from the following options.",NA,A,1 Only,2 Only,Both 1 and 2,Neither 1 nor 2,NA,NA,NA,NA,"SETU (Self Employment and Talent Utilization) programme, aimed at setting up world-class technology business incubators to promote start-up business in India coupled with Start-up-India, Make in India.<br/><br/>IMPRINT (Impacting Research Innovation and Technology), a Pan- IIT and IISc joint initiative to develop a roadmap for research to solve major engineering and technology challenges in ten technology domains relevant to India.",NA
"Which of the following are correct about Atal innovation mission?<br/>1. This will be an innovation promotion platform involving academics, entrepreneurs, Band researchers and draw upon national and international experiences to foster a culture of innovation, R&D and scientific research in India.<br/>2. The World Bank and UNDP are collaborating with the Government of India to implement this initiative.<br/>Choose from the following options.",NA,A,1 Only,2 Only,Both 1 and 2,Neither 1 nor 2,NA,NA,NA,NA,"Correct Statement is 1 as Atal innovation mission will be an innovation promotion platform involving academics, entrepreneurs, Band researchers and draw upon national and international experiences to foster a culture of innovation, R&D and scientific research in India. <br/><br/>Statement 2 is wrong as The World Bank and UNDP are collaborating with the Government of India on Generation Unlimited, which includes partnership agreements with NITI Aayog, a think tank of the Government of India.<br/>Hence option 1 is correct.",NA
Which of the following statements are correct regarding the legal services sector in India?<br/>1. FDI is not permitted in this sector.<br/>2. Foreign service providers can be appointed as partners.<br/>3. Indian advocates are not permitted to enter into profit-sharing arrangements with persons other than Indian advocates.<br/>Choose from the following options.,NA,C,1 and 2 Only,2 and 3 Only,1 and 3 Only,All of them,NA,NA,NA,NA,"In this sector, FDI is not permitted and international law firms are not authorised to advertise and open offices in India.<br/><br/>Foreign service providers can neither be appointed as partners nor sign legal documents and represent clients.<br/><br/>The Bar Council is opposed to the entry of foreign lawyers/law firms in any manner.<br/><br/>Indian advocates are not permitted to enter into profit-sharing arrangements with persons other than Indian advocates.",NA
Education services comes under:,NA,C,Union List,State List,Concurrent List,Residue List,NA,NA,NA,NA,Education Services: These come under the Concurrent List with multiple controls and regulations by central and state governments and statutory bodies.,NA
Consider the following statements regarding the accountancy services sector.<br/>1. Accountancy professionals are allowed to operate either as a partnership firm or as a sole proprietorship firm.<br/>2. FDI is not allowed in this sector but foreign service providers are allowed to undertake a statutory audit of Companies.<br/>Which of these statements is/are correct?,NA,C,1 and 2 Only,2 Only,1 Only,All of them,NA,NA,NA,NA,Foreign service providers are not allowed to undertake a statutory audit of companies as per the provisions of the laws in India.<br/>There are also domestic regulations like the prohibition on the use of individual logos for partnership and single proprietorship accounting firms.<br/>These regulations need to be relaxed and streamlined to facilitate tie-ups and penetrate foreign markets given the potential for exporting these services by the outsourcing model.,NA
"Consider the following statements regarding Port services in India.<br/>1. Indian ports are not world-class ports and lack the necessary draft<br/>2. As a result, third-generation ships are not able to enter the harbour and goods have to be offloaded outside in smaller ships, adding to costs<br/>Which of these statements is/are correct?",NA,C,1 Only,2 Only,Both 1 and 2,Neither 1 nor 2,NA,NA,NA,NA,"Indian ports are not world-class ports and lack the necessary draft. As a result, third generation ships&#39; are not able to enter the harbour and goods have to be offloaded outside in smaller ships, adding to costs.<br/><br/>If India can develop world-class airport infrastructure and metros, there is every reason to attend the concerns of the port services.",NA
India is making bilateral negotiations with various countries. Which of the following are correctly matched regarding this?<br/>1. Dialogue is underway with the US as India US joint ministerial Commission.<br/>2. Dialogue is underway with Australia as India Australia trade policy forum.<br/>Choose from the following options.,NA,D,1 Only,2 Only,Both 1 and 2,Neither 1 nor 2,NA,NA,NA,NA,"India is also engaged in bilateral FTA negotiations including trade in services with Canada, Israel, Thailand, the EU, the EFTA (European Free Trade Association), Australia and New Zealand.<br/><br/>Dialogue is underway with the US under the India-US Trade Policy Forum (TPF), with Australia under the India Australia JMC (Joint Ministerial Commission), with China under India China working group on services and Brazil under the India Brazil trade monitoring mechanism.",NA
"Consider the following statements regarding the construction development sector.<br/>1. Due to the land acquisition policy, the number of court litigations are increasing.<br/>2. There are also restrictions on floor area ratio in many states.<br/>Which of these statements is/are incorrect?",NA,D,1 Only,2 Only,Both 1 and 2,Neither 1 nor 2,NA,NA,NA,NA,"In this sector, bottlenecks result from the continuation of restrictions under the Urban Land Ceiling and Regulation Act (ULCRA) in some states namely Andhra Pradesh, Assam, Bihar, and West Bengal, which have not yet repealed it and the confusion in the process required for clearance of buildings even after the repeal of ULCRA bypassing of the Urban Land (Ceiling and Regulations) Repeal Act 1999 by the other states.<br/><br/>There is also lack of clarity on the role of states as facilitators in the land acquisition policy resulting in increasing number of court litigations adding to the risk profile of builders/projects thereby restricting lenders from extending finance to such builders/ projects.<br/>There are also restrictions on floor area ratio (FAR) in many states; and other restrictions like the application of bye third-generation and its exemptions, e.g., increase in FAR which varies from project to project and is sometimes discriminatory. Obtaining environment clearance is another major hindrance.",NA
GDP of a country is based on,NA,B,Total value of good and services,Final value of goods and services,Initial value of goods and services,All of these,NA,NA,NA,NA,"GDP of a country is based on the final value of goods and services.<br/>Explanation:<br/>- GDP stands for Gross Domestic Product, which is a measure of the total value of goods and services produced within a country&#39;s borders during a specific period.<br/>- The final value of goods and services refers to the value of the products after all stages of production have been completed.<br/>- This means that the intermediate goods and services used in the production process are not included in the GDP calculation.<br/>- Only the value of the final goods and services that are consumed by households, businesses, government, and exported to other countries is considered in the GDP calculation.<br/>- The final value is determined by adding up the prices of all the final goods and services produced in the economy.<br/>- This includes both tangible goods (such as cars, clothes, and food) and intangible services (such as healthcare, education, and transportation).<br/>- The GDP calculation takes into account the market value of these goods and services, which is determined by the prices at which they are bought and sold in the market.<br/>- By focusing on the final value of goods and services, GDP provides a comprehensive measure of a country&#39;s economic output and is widely used to compare the economic performance of different countries.",NA
Assertion : Economic activities grouped into three categories are highly dependent.<br/>Reason : Primary and secondary activities cannot produce a good unless they are aided by the tertiary sector.,NA,A,Both A and R are true and R is the correct explanation of A,Both A and R are true but R is not the correct explanation of A.,A is correct but R is wrong.,A is wrong but R is correct.,NA,NA,NA,NA,"The Correct answer is A: Both A and R are true and R is the correct explanation of A<br/>- Explanation:<br/>- Economic activities are grouped into three categories: primary, secondary, and tertiary.<br/>- Primary activities involve the extraction of raw materials from nature, such as agriculture, mining, fishing, etc.<br/>- Secondary activities involve the processing and manufacturing of these raw materials into finished goods, such as factories and industries.<br/>- Tertiary activities involve the provision of services, such as transportation, banking, education, healthcare, etc.<br/>- The reason provided states that primary and secondary activities cannot produce a good unless they are aided by the tertiary sector.<br/>- This is true because the tertiary sector provides essential services that support and facilitate the production and distribution of goods.",NA
Choose the correct meaning of organised sector:,NA,A,It covers those enterprises where the terms of employment are regular.,It is outside the control of the government,Jobs are not regular.,It provides low salaries.,NA,NA,NA,NA,"Explanation:<br/>The organised sector refers to a segment of the economy where enterprises operate in a structured and regulated manner. Here are the key points to understand the meaning of the organised sector:<br/>1. Regular Terms of Employment: In the organised sector, the terms of employment for workers are regular. This means that employees have fixed working hours, employment contracts, and are entitled to benefits such as paid leave, social security, and other statutory protections.<br/>2. Government Regulation: The organised sector is subject to government regulations and oversight. The government sets rules and standards related to labor laws, wages, safety regulations, and other aspects to ensure fair and equitable working conditions for employees.<br/>3. Formal Economy: The organised sector is part of the formal economy, where activities are recorded, regulated, and contribute to the overall GDP of the country. It includes industries such as manufacturing, finance, IT services, healthcare, and organized retail.<br/>4. Job Stability: The organised sector provides relatively more job stability compared to the unorganised sector. Employees have a clear career progression, opportunities for skill development, and access to various employee benefits.<br/>In conclusion, the correct meaning of the organised sector is that it covers enterprises where the terms of employment are regular. It is characterized by government regulation, job stability, and adherence to labor laws and standards.",NA
Which of the following is True for GDP?,NA,C,It includes the value of final goods and services produced within a country.,It is measured for one year.,Both a & b are true.,Both a & b are false.,NA,NA,NA,NA,"Gross Domestic Product (GDP) is a key indicator used to measure the economic activity and performance of a country. It provides valuable information about the size and growth of an economy. In this case, option C is the correct answer as it states that both statements A and B are true.<br/><br/>Statement A is true because GDP includes the value of all final goods and services produced within a country. It does not include intermediate goods (goods used in the production process) to avoid double-counting.<br/><br/>Statement B is also true because GDP is typically measured for a specific time period, often one year. However, it is important to note that GDP can be measured quarterly or annually, depending on the requirements and availability of data.<br/><br/>Therefore, the correct answer is option C: Both statements A and B are true.",NA
Which of the following is included in tertiary sector?,NA,D,ATM booths,Call Centres,Internet Cafes,All of them,NA,NA,NA,NA,"The tertiary sector, also known as the service sector, is the part of the economy that provides services to consumers and businesses. It includes a wide range of industries that are involved in providing services rather than producing goods. The following are included in the tertiary sector:<br/>1.<u>ATM booths:</u> These are self-service machines that allow individuals to withdraw cash, check account balances, and perform other banking transactions.<br/>2.<u>Call centres:</u> Call centers are facilities where a large number of customer service representatives handle incoming calls from customers. They provide assistance, answer questions, and resolve issues for various businesses.<br/>3.<u>Internet cafe:</u> Internet cafes are establishments that provide customers with access to computers and the internet for a fee. They are often used by individuals who do not have access to a computer or internet connection at home.<br/><br/>Therefore, the correct answer is <b>D: All of them.</b><br/>The tertiary sector plays a crucial role in the economy as it contributes to job creation, income generation, and economic growth. It encompasses a wide range of services that cater to various needs and demands of individuals and businesses. From financial services to hospitality, healthcare to transportation, the tertiary sector covers a diverse range of industries that are essential for the functioning of modern society.",NA
"On which of the following basis, the sectors are classified into public and private sector?",NA,C,Employment conditions,The nature of economic activity,Ownership of enterprises,Number of workers employed in the enterprise,NA,NA,NA,NA,"Answer C: Ownership of Enterprises<br/>The sectors are classified into public and private sector based on the ownership of enterprises.<br/>- Public Sector: In the public sector, the ownership of enterprises is with the government or its agencies. These enterprises are established and operated by the government to provide essential goods and services to the public. The government has control over the management and decision-making process of these enterprises. Examples of public sector enterprises include government departments, public schools, public hospitals, and state-owned companies.<br/>- Private Sector: In the private sector, the ownership of enterprises is with individuals or groups of individuals who run the business for profit. These enterprises are owned and operated by private individuals or private companies. The government has limited or no control over the management and decision-making process of these enterprises. Examples of private sector enterprises include sole proprietorships, partnerships, and privately owned corporations.<br/><br/>Other Factors:<br/>- Employment Conditions: While employment conditions can vary between public and private sectors, it is not the primary basis for classification. Both sectors can offer different employment conditions based on factors such as labor laws, regulations, and the specific industry.<br/>- Nature of Economic Activity: Although the nature of economic activity can vary between public and private sectors, it is not the primary basis for classification. Both sectors can engage in various economic activities such as manufacturing, services, agriculture, and trade.<br/>- Number of Workers Employed: The number of workers employed in an enterprise is not the basis for classifying sectors into public and private. It is possible to find both public and private sector enterprises with a high or low number of workers.",NA
Information and Technology is a part of,NA,B,Primary sector,Tertiary sector,Secondary sector,All of these,NA,NA,NA,NA,"Information and Technology is a part of the tertiary sector.<br/>The tertiary sector, also known as the service sector, is the sector of the economy that provides services to consumers and other businesses. It includes activities such as retail, transportation, healthcare, education, and hospitality. Information and Technology is a crucial part of this sector as it involves the provision of various IT services and products.<br/><br/>Information and Technology is an integral part of the tertiary sector as it provides essential services, enables digital transformation, and enhances productivity and efficiency in various industries. Its role in the service sector is vital for economic growth and development.",NA
Which of the following is also known as disguised unemployment?,NA,A,Underemployment,Factory employment,Over employment,Unemployment,NA,NA,NA,NA,"When more than required numbers of people are engaged in productive activities, it is called underemployment. In this case, work done by a person is hidden and even if the person is removed from employment, the production will remain the same. Therefore, underemployment is also known as disguised unemployment.",NA
Hidden unemployment is also called,NA,B,Organised Sector,Disguised Unemployment,Tertiary Sector,Contractual Unemployment,NA,NA,NA,NA,"Hidden Unemployment (Disguised Unemployment)<br/>Hidden unemployment, also known as disguised unemployment, refers to a situation where individuals are employed in jobs that do not fully utilize their skills and capabilities, resulting in lower productivity levels. These individuals may be working part-time or in jobs that are below their qualifications, leading to a waste of human resources. It is characterized by the underutilization of labor resources within an economy.<br/>Characteristics of Hidden Unemployment:<br/>Hidden unemployment is characterized by several key features, including:<br/>1. Underutilization of Labor: In hidden unemployment, the labor force is not fully utilized, leading to a situation where there is excess labor supply relative to the demand for labor.<br/>2. Low Productivity: Individuals in hidden unemployment are often engaged in jobs that do not require their full skillset or educational qualifications, resulting in lower productivity levels.<br/>3. Lack of Job Satisfaction: Hidden unemployment can lead to job dissatisfaction as individuals may not be able to utilize their skills and abilities to their full potential.<br/>4. Reduced Economic Output: The underutilization of labor resources in hidden unemployment leads to a decrease in overall economic output and efficiency.",NA
