question_text,question_image,correct_answer,option_1_text,option_2_text,option_3_text,option_4_text,option_1_image,option_2_image,option_3_image,option_4_image,answer_explanation_text,answer_explanation_image
The Durand Commission (1893) was set up to,NA,C,Recommend changes in the proposed Universities Act,Bring reforms in Police administration in India on the lines suggested by Lord Curzon,Define the Durand Line between India and Afghanistan (now between Pakistan and Afghanistan),Increase the intake of the British army in India from contingents stationed abroad,NA,NA,NA,NA,"The Durand Line is the 2,430-kilometre international border between Pakistan and Afghanistan. It was established in 1896 between Sir Mortimer Durand, a British diplomat and civil servant of the British Raj, and Abdur Rahman Khan, the Afghan Amir, to fix the limit of their respective spheres of influence and improve diplomatic relations and trade. <br/>Afghanistan was considered by the British as an independent state, although the British controlled its foreign affairs and diplomatic relations. <br/>The Durand Line cuts through the Pashtun tribal areas and further south through the Balochistan region, politically dividing ethnic Pashtuns and the Baloch and other ethnic groups, who live on both sides of the border. <br/>It demarcates Khyber Pakhtunkhwa, Balochistan and Gilgit-Baltistan of northern and western Pakistan from Afghanistan&#39;s northeastern and southern provinces. <br/>From a geopolitical and geostrategic perspective, it has been described as one of the world's most dangerous borders.",NA
Consider the following statements. <br/>Younghusband&#39;s Mission to Tibet (1904)<br/>1. Led to a temporary invasion by British Indian forces under the auspices of the Tibet Frontier Commission<br/>2. Intended to establish diplomatic relations and resolve the dispute over the border between Tibet and Bhutan<br/>Q. Which of the above is/are correct?,NA,A,1 Only,2 Only,Both 1 and 2,None,NA,NA,NA,NA,"The British expedition to Tibet, also known as the British invasion of Tibet or the Younghusband expedition to Tibet began in December 1903 and lasted until September 1904.<br/><br/>The expedition was effectively a temporary invasion by British Indian forces under the Tibet Frontier Commission&#39;s auspices, whose purported mission was to establish diplomatic relations and resolve the dispute over the border between Tibet and Sikkim.<br/><br/>In the nineteenth century, the British conquered Burma and Sikkim, occupying Tibet&#39;s whole southern flank.<br/><br/>The Tibetan Ganden Phodrang regime, which was then under the Qing dynasty&#39;s administrative rule, remained the only Himalayan state free of British influence.<br/><br/>The expedition was intended to counter Russia&#39;s perceived ambitions in the East and was initiated largely by Lord Curzon, the British India government&#39;s head.<br/><br/>Curzon had long obsessed over Russia&#39;s advance into Central Asia and now feared a Russian invasion of British India.<br/><br/>In April 1903, the British received clear assurances from the Russian government that it had no interest in Tibet. <q>In spite, however, of the Russian assurances, Lord Curzon continued to press for the dispatch of a mission to Tibet</q>, a high level British political officer noted.",NA
"In the 1770s, the British embarked on a brutal policy of extermination, hunting the Paharis down and killing them. Regarding these Paharis, which of the following statements is correct?",NA,D,They were hill folks who lived around the Rajmahal hills.,They raided the plains where settlers lived during the years of scarcity,Only option (a) is correct.,Both (a) and (b) are correct.,NA,NA,NA,NA,"Paharis lived around the Rajmahal hills, subsisting on forest produce and practising shifting cultivation.<br/>With their base in the hills, the Paharis regularly raided the plains where settled agriculturalists lived. These raids were necessary for survival, particularly in years of scarcity.<br/>They were a way of asserting power over settled communities and means of negotiating political relations with outsiders. The zamindars on the plains had to often purchase peace by paying a regular tribute to the hill chiefs.<br/>Traders similarly gave a small amount to the hill folk to use the passes controlled by them.",NA
Which of the following could be the possible implications of the Battle of Plassey?<br/>1. It resulted in the victory of East India Company granting it greater powers to extract revenue and the consolidation of its presence in Bengal.<br/>2. It resulted in the East India Company gaining greater military might which allowed them to push other European colonial powers away from Bengal.<br/>Which of the above is/are correct?,NA,C,1 Only,2 Only,Both 1 and 2,None,NA,NA,NA,NA,"The Battle of Plassey was essentially due to the Bengal Nawab and the East India Company&#39;s conflicts.<br/>This is judged to be one of the pivotal battles for controlling the Indian subcontinent by colonial powers.<br/>The British now wielded enormous influence over the Nawab and consequently acquired significant concessions for previous losses and trade revenue.<br/>The British further used this revenue to increase their military might and push the other European colonial powers such as the Dutch and the French out of South Asia, thus expanding the British Empire.",NA
The reason(s) behind the Battle of Plassey between the Nawab of Bengal and the British was/were: <br/>1. That British denied stopping trade relations with India.<br/>2. That the Bengal nawab did not accept <q>subsidiary alliance</q> enforced by the British.<br/>3. East India Company had started interfering in the political matters of Bengal.<br/>4. The British did not pay appropriate revenue to the Bengal nawab.<br/>5. East India Company did not stop fortification in Bengal even after the Farman of Bengal Nawab.<br/>Choose the correct answer using the codes below.,NA,C,"1, 2 and 3 only",4 and 5 only,"3, 4 and 5 only",All of the above,NA,NA,NA,NA,"When Alivardi Khan died in 1756, Siraj ud-Daulah became the Nawab of Bengal. The Company was worried about his power and keen on a puppet ruler who would willingly give trade concessions and other privileges.<br/>So it tried, though without success, to help one of Siraj ud-Daulah&#39;s rivals become the Nawab.<br/>An infuriated Siraj ud-Daulah asked the Company to stop meddling in his dominion&#39;s political affairs, stop fortification, and pay the revenues.<br/>After negotiations failed, the Nawab marched with 30,000 soldiers to the English factory at Kasimbazar, captured the Company officials, locked the warehouse, disarmed all Englishmen and blockaded English ships.<br/>Then, he marched to Calcutta to establish control over the Company&#39;s fort there. On hearing the news of Calcutta&#39;s fall, Company officials in Madras sent forces under the command of Robert Clive, reinforced by naval fleets. Prolonged negotiations with the Nawab followed. Finally, in 1757, Robert Clive led the Company&#39;s army against Siraj ud-Daulah at Plassey.",NA
The Battle held at Plassey is often mentioned in India&#39;s colonial history. How did the place Plassey get its name from?,NA,A,Palash tree that grows there.,The water structures that surrounded large forts.,Highly fertile soil found there.,Series of battles fought at it.,NA,NA,NA,NA,"Battle of Plassey was fought between the Company, and Siraj Ud Daulah asked the Company to stop meddling in his dominion&#39;s political affairs, stop fortification, and pay the revenues.<br/>Plassey is an anglicised pronunciation of Palashi, and the place derived its name from the Palash tree known for its beautiful red flowers that yield gulal, the powder used in the festival of Holi.",NA
