question_text,question_image,correct_answer,option_1_text,option_2_text,option_3_text,option_4_text,option_1_image,option_2_image,option_3_image,option_4_image,answer_explanation_text,answer_explanation_image
Consider the following statements:<br/>1. Sudden storms and strong winds are the characteristics of equatorial low pressure area.<br/>2. Westerly jet streams are seen in northern hemisphere only.<br/>Which of the statements given above is/ are correct ?,NA,A,1 only,2 only,Both 1 and 2,Neither 1 nor 2,NA,NA,NA,NA,"The correct answer is option 1, which states that statement 1 is correct while statement 2 is incorrect. <br/>Let us analyze each statement separately:<br/>Statement 1: Sudden storms and strong winds are the characteristics of equatorial low pressure area.<br/>This statement is correct. The equatorial low pressure area, also known as the Intertropical Convergence Zone (ITCZ), is characterized by unstable conditions and intense convective activity. It is associated with thunderstorms, heavy rainfall, and strong winds.<br/><br/>Statement 2: Westerly jet streams are seen in the northern hemisphere only.<br/>This statement is incorrect. Jet streams are high-altitude, narrow air currents that move from west to east. While the westerly jet stream is most commonly found in the mid-latitudes of the northern hemisphere, it can also occur in the southern hemisphere. In fact, both hemispheres have jet streams, although their patterns may vary.<br/><br/>To summarize, statement 1 is true as sudden storms and strong winds are indeed characteristics of the equatorial low pressure area. However, statement 2 is false as westerly jet streams can be found in both the northern and southern hemispheres.",NA
Consider the following characteristics of a tropical cyclone :<br/>1. A warm sea temperature of > 26&deg;C <br/>2. High relative humidity of atmosphere at a height of > 700 m <br/>3. Atmospheric instability <br/>The above mentioned characteristics are associated with which one of the following cycles of its development?,NA,A,Formulation and initial stage,Modification stage,Full maturity,Decay,NA,NA,NA,NA,"The correct asnwer is Option 1: Formulation and initial stage<br/>The mentioned characteristics of a warm sea temperature (> 26&deg;C), high relative humidity (> 700m), and atmospheric instability are all associated with the formulation and initial stage of a tropical cyclone. During this stage, the warm sea temperature provides the energy source for the cyclone to develop. The high relative humidity at a height of > 700m indicates the presence of moist air which is necessary for the formation of clouds and precipitation. Atmospheric instability refers to the condition where warm, moist air rises rapidly, creating an unstable atmosphere that can fuel the development of the cyclone. Therefore, all these characteristics are essential for the formulation and initial stage of a tropical cyclone.",NA
Jet streams are usually found in the :,NA,C,Ozonosphere,Mesosphere,Tropopause,Ionosphere,NA,NA,NA,NA,"The correct answer is option 3: Tropopause.<br/>Jet streams are strong and narrow air currents that flow in the upper levels of the atmosphere. They are usually found in the Tropopause, which is the boundary between the troposphere and the stratosphere. The troposphere is the lowest layer of the atmosphere, where weather events occur, and the stratosphere is the layer above it.<br/><br/>Option 1, Ozonosphere, is incorrect. The ozonosphere is another name for the ozone layer, which is located in the stratosphere but not specifically associated with jet streams.<br/><br/>Option 2, Mesosphere, is also incorrect. The mesosphere is the layer above the stratosphere, and jet streams are not typically found in this region.<br/><br/>Option 4, Ionosphere, is incorrect as well. The ionosphere is a region in the upper atmosphere containing a high concentration of ions and is not the location where jet streams are commonly found.<br/><br/>In summary, the correct answer is option 3: Tropopause, as jet streams are usually found in the boundary between the troposphere and the stratosphere.",NA
The jet streams are,NA,C,Wind systems with a pronounced seasonal reverse at a direction.,Winds blowing from the subtropical high-pressure belts towards the subpolar low-pressure belts,Narrow meandering bands of swift winds that blow in the midlatitudes near the tropopause and encircle the globe,Winds blowing from the subpolar low-pressure belts towards the subtropical high-pressure belts.,NA,NA,NA,NA,"The correct answer is option 3: the jet streams are narrow meandering bands of swift winds which blow in the midlatitudes near the tropopause and encircle the globe.<br/><br/>Let us dissect each option to understand them better:<br/>Option 1 states that the jet streams are wind systems with a pronounced seasonal reverse at a direction. However, this is not accurate. The jet streams do have seasonal variations, but they do not reverse their direction.<br/><br/>Option 2 suggests that the jet streams are winds blowing from the subtropical high-pressure belts towards the subpolar low-pressure belts. While this is partially true, it does not fully describe the jet streams. They are not solely restricted to blowing between specific pressure belts.<br/><br/>Option 3, which is the correct answer, states that the jet streams are narrow meandering bands of swift winds that blow in the midlatitudes near the tropopause and encircle the globe. This option accurately describes the jet streams and their characteristics.<br/><br/>Option 4 incorrectly proposes that the jet streams are winds blowing from the subpolar low-pressure belts towards the subtropical high-pressure belts. This is not a correct representation of the direction of the jet streams.<br/><br/>Therefore, the correct answer is option 3.",NA
"Which one of the following statements with regard to Jet stream, an upper level tropospheric wave, is not correct?",NA,D,It is a narrow band of hig velocity wind.,It follows the wave path near the tropopause at elevations of 8 km to 15 km.,Jet streams are typically continous over long distances.,"In summer, the polar front jet achieves its maximum force.",NA,NA,NA,NA,"The correct answer is option 4. The statement that the polar front jet achieves its maximum force in summer is not correct.<br/>Let us analyze each option to understand why the other options are correct and why option 4 is incorrect:<br/><br/>Option 1: It is a narrow band of high-velocity wind. This statement is correct. Jet streams are characterized by their high speeds, often reaching more than 100 miles per hour.<br/><br/>Option 2: It follows the wave path near the tropopause at elevations of 8 km to 15 km. This statement is also correct. Jet streams are located in the upper troposphere, near the boundary between the troposphere and the stratosphere, known as the tropopause.<br/><br/>Option 3: Jet streams are typically continuous over long distances. This statement is correct. Jet streams can extend thousands of kilometers and span across continents, making them an important feature of global weather patterns.<br/><br/>Option 4: In summer, the polar front jet achieves its maximum force. This statement is incorrect. The polar front jet, which is one type of jet stream, actually tends to be stronger and more active during the winter months when temperature contrasts between the polar regions and the mid-latitudes are greater.",NA
During the Indian monsoon season,NA,B,the westerly jet stream alone exists in the Indian region,the easterly jet stream alone exists in the Indian region,both westerly and easterly jet streams exists in the Indian region,both westerly and easterly jet streams disappear,NA,NA,NA,NA,"During the Indian monsoon season, the correct answer is option 2 - the easterly jet stream alone exists in the Indian region.<br/><br/>Jet streams are narrow, fast-moving air currents in the upper atmosphere. In the Indian region, there are two main jet streams known as the westerly and easterly jet streams.<br/><br/>The westerly jet stream exists during the winter months, bringing cold air from the western regions towards the Indian subcontinent. However, during the monsoon season, the westerly jet stream weakens and moves towards the north, causing it to no longer exist in the Indian region.<br/><br/>On the other hand, the easterly jet stream becomes dominant during the monsoon season. It brings warm and moist air from the Bay of Bengal and Arabian Sea towards the Indian subcontinent, resulting in heavy rainfall and the monsoon season.<br/><br/>Therefore, option 2 is correct as only the easterly jet stream exists in the Indian region during the monsoon season.",NA
Consider the following statements:<br/>1. Jet streams occur in the Northern Hemisphere only. <br/>2. Only some cyclones develop an eye.<br/>3. The temperature inside the eye of a cyclone is nearly 10 C lesser than that of the surroundings.<br/><br/>Which of the statements given above is/are correct:,NA,C,1 only,2 and 3 only,2 only,1 and 3 only,NA,NA,NA,NA,"The first statement is incorrect. Jet streams, narrow bands of strong wind in the upper levels of the atmosphere, occur in both the Northern and Southern Hemispheres of Earth. This is a common misconception because the Northern Hemisphere&#39;s jet stream is studied more frequently due to the presence of more landmasses and populations.<br/><br/>The second statement is correct. Not all cyclones develop a well-defined eye, which is a calm area at the center of the storm. The eye forms due to the rotation of the cyclone and the stronger the cyclone, the greater the likelihood of an eye forming.<br/><br/>The third statement is incorrect. In fact, the temperature inside the eye of a cyclone is higher than its surrounding areas, not lesser. This is because of subsiding or downward moving, warming air in the eye region.<br/><br/>Therefore, the correct answer is option 3, which states only the second statement is correct.",NA
What is the convergence of north east and south east trade winds near equator known as ?,NA,C,Doldrums,Jetstream,Inter tropical convergence zone,Upper air monsoon,NA,NA,NA,NA,"The convergence of the north east and south east trade winds near the equator is known as the inter-tropical convergence zone (ITCZ). This is the correct answer (Option 3).<br/><br/>Option 1: Doldrums refers to the calm, windless areas near the equator where the trade winds converge. While similar to the ITCZ, the ITCZ specifically refers to the area of convergence.<br/><br/>Option 2: Jet streams are high altitude air currents that flow in narrow bands within the atmosphere. They are not directly related to the convergence of trade winds near the equator.<br/><br/>Option 4: Upper air monsoons are seasonal wind patterns in the upper atmosphere that bring monsoon rains to different regions. They are not directly related to the convergence of trade winds near the equator.<br/><br/>In summary, the correct term for the convergence of the north east and south east trade winds near the equator is the inter-tropical convergence zone (ITCZ) (Option 3).",NA
