question_text,question_image,correct_answer,option_1_text,option_2_text,option_3_text,option_4_text,option_1_image,option_2_image,option_3_image,option_4_image,answer_explanation_text,answer_explanation_image
Cyclones are caused due to,NA,A,low pressure,high pressure,low temperature,high density,NA,NA,NA,NA,"Cyclones are caused due to low pressure. <br/>Low pressure systems, also known as cyclones, occur when the air pressure at the surface is lower than the surrounding air. This low pressure draws in surrounding air, causing it to rise and creating a vertical circulation. As the air rises, it cools and condenses, forming clouds and precipitation.<br/><br/>High pressure systems, on the other hand, are the opposite of cyclones. In high pressure systems, the air pressure at the surface is higher than the surrounding air, resulting in sinking air and clearer skies. High pressure systems are associated with calm weather conditions.<br/><br/>Low temperature and high density are not direct causes of cyclones. While low temperature and high density of air can contribute to changes in pressure, they are not the primary factors that cause the formation of cyclones.<br/><br/>In summary, cyclones are caused by low pressure systems, which lead to the rise of air and the formation of clouds and precipitation.",NA
The eye of the cyclone has :,NA,A,abnormally high temperature and lowest pressure,abnormally low temperature and pressure,clear sky and lowest temperature,dense cloud cover and low pressure,NA,NA,NA,NA,"In a cyclone, the <q>eye</q> refers to the center of the storm, which is typically characterized by calm weather conditions. <br/>Looking at the options provided:<br/>Option 1 suggests that the eye of the cyclone has an abnormally high temperature and the lowest pressure. This is indeed correct. The temperature in the eye of the cyclone is relatively higher compared to the surrounding areas, and the pressure is at its lowest point. This is because the air in the eye of the cyclone is descending and warming due to compression. The low pressure at the center allows for air to rise and form the outer bands of the storm.<br/><br/>Option 2 suggests that the eye of the cyclone has abnormally low temperature and pressure. This is not accurate, as the temperature in the eye is generally higher than the surrounding areas.<br/>Option 3 suggests that the eye of the cyclone has clear sky and the lowest temperature. This is also incorrect, as the eye of the cyclone is usually cloud-free, but the temperature is not necessarily the lowest.<br/>Option 4 suggests that the eye of the cyclone has dense cloud cover and low pressure. While the low pressure is true, the dense cloud cover is not present in the eye of the storm.",NA
"Which of the following statements is/are correct?<br/>1. Cyclone is a low pressure system. <br/>2. The wind movement is clockwise in the cyclone of northern hemisphere.<br/>Select the correct answer using the code, given below:",NA,A,1 only,2 only,Both 1 and 2,Neither 1 nor 2,NA,NA,NA,NA,"The correct answer is option 1, which states that only statement 1 is correct. <br/>Let us look at each statement to understand why.<br/>Statement 1: <q>Cyclone is a low-pressure system</q>. This statement is correct. Cyclones are characterized by an area of low atmospheric pressure, with air spiraling inward towards the center. This low pressure is caused by the upward motion of air and the convergence of wind towards the center of the cyclone.<br/><br/>Statement 2: <q>The wind movement is clockwise in the cyclone of the northern hemisphere</q>. This statement is incorrect. In the northern hemisphere, the wind movement in a cyclone is counterclockwise. This is due to the Coriolis effect, which is caused by the rotation of the Earth. The Coriolis effect deflects moving air to the right in the northern hemisphere, resulting in counterclockwise rotation around the center of the cyclone.<br/><br/>Therefore, statement 2 is incorrect. Only statement 1 is correct.",NA
Which of the following statements about Tornadoes are correct? Tornadoes usually spin <br/>1. anticlockwise in the northern hemisphere <br/>2. clockwise in the southern hemisphere <br/>3. clockwise in the northern hemisphere <br/>4. anticlockwise in the southern hemisphere<br/><br/>Select the correct answer using the code given below :,NA,B,1 and 3,1 and 2,2 and 4,2 and 3,NA,NA,NA,NA,"The correct answer is option 2: 1 and 2. <br/><br/>Let us break down each option to understand the statements about tornadoes:<br/>1. Tornadoes usually spin anticlockwise in the northern hemisphere: This statement is correct. In the northern hemisphere, tornadoes typically rotate counterclockwise due to the Coriolis effect. The Coriolis effect is caused by the rotation of the Earth and influences the motion of air masses, resulting in counterclockwise rotation.<br/><br/>2. Tornadoes usually spin clockwise in the southern hemisphere: This statement is incorrect. In the southern hemisphere, tornadoes typically rotate counterclockwise, similar to the northern hemisphere. This is because the Coriolis effect influences the rotation of tornadoes in both hemispheres.<br/><br/>3. This statement is not relevant to the question because it does not align with any of the given options.<br/><br/>4. This statement is not relevant to the question because it does not align with any of the given options.<br/><br/>Therefore, options 1 and 3 are incorrect, as the correct statements are that tornadoes usually spin anticlockwise in the northern hemisphere (1) and clockwise in the southern hemisphere (2).",NA
"Which of the following statements is/are correct?<br/>1. Cyclone is a low pressure system.<br/>2. The wind movement is clockwise in the cyclone of northern hemisphere.<br/>Select the correct answer using the code, given below:",NA,A,1 only,2 only,Both 1 and 2,Neither 1 nor 2,NA,NA,NA,NA,"The correct answer is option 1, which states that only statement 1 is correct. <br/><br/>Let us look at each statement to understand why.<br/>Statement 1: <q>Cyclone is a low-pressure system</q>. This statement is correct. Cyclones are characterized by an area of low atmospheric pressure, with air spiraling inward towards the center. This low pressure is caused by the upward motion of air and the convergence of wind towards the center of the cyclone.<br/>Statement 2: <q>The wind movement is clockwise in the cyclone of the northern hemisphere</q>. This statement is incorrect. In the northern hemisphere, the wind movement in a cyclone is counterclockwise. This is due to the Coriolis effect, which is caused by the rotation of the Earth. The Coriolis effect deflects moving air to the right in the northern hemisphere, resulting in counterclockwise rotation around the center of the cyclone.<br/><br/>Therefore, statement 2 is incorrect. Only statement 1 is correct.",NA
"Consider the following statements relating to cyclone, anti cyclone and trade wind :<br/>1. The wind direction is clockwise in the cyclone of northern hemisphere <br/>2. The planetary wind that blows from north-east to north-west is known as north-east trade wind <br/>3. The wind direction is anti clockwisc in the anticyclone of southern hemisphere <br/>4. Both westerlies and trade winds originate from sub-tropical highs <br/>Which of the statements given above is/are correct?",NA,A,3 and 4 only,"1, 3 and 4",4 only,"1, 2 and 3",NA,NA,NA,NA,"The correct answer is option 1, which states that statements 1, 3, and 4 are correct. <br/><br/>Let us analyze each statement to better understand why.<br/>Statement 1: The wind direction is clockwise in the cyclone of the northern hemisphere. This is true. In the northern hemisphere, cyclones rotate in a clockwise direction due to the Coriolis effect, which is caused by the rotation of the Earth.<br/><br/>Statement 2: The planetary wind that blows from northeast to northwest is known as the northeast trade wind. This statement is not mentioned in the options, so it is not considered as part of the correct answer.<br/><br/>Statement 3: The wind direction is counterclockwise in the anticyclone of the southern hemisphere. This is true. Similar to statement 1, anticyclones in the southern hemisphere rotate counterclockwise due to the Coriolis effect.<br/><br/>Statement 4: Both westerlies and trade winds originate from sub-tropical highs. This is true. The westerlies, which are prevailing winds from the west, and the trade winds, which blow from the northeast in the northern hemisphere and the southeast in the southern hemisphere, both originate from areas of high pressure known as sub-tropical highs.",NA
Which one among the following statements relating to an anticyclone is correct?,NA,A,Anticyclone is a wind system with a high pressure center,In an anticyclone the movement of wind is inward,The contribution of an anticyclone towards determining the weather of an area is quite significant.,The movement of wind is clockwise in an anticyclone in the Southern Hemisphere.,NA,NA,NA,NA,"Option 1 states that an anticyclone is a wind system with a high pressure center. This statement is correct. An anticyclone is a weather system characterized by high atmospheric pressure at its center. In an anticyclone, air descends from higher altitudes, causing the air pressure at the surface to increase. As a result, the movement of wind in an anticyclone is outward from the high-pressure center. This means that the wind blows in a clockwise direction in the Northern Hemisphere and counterclockwise in the Southern Hemisphere.<br/><br/>Option 2 states that in an anticyclone, the movement of wind is inward. This statement is incorrect as the movement of wind in an anticyclone is outward.<br/><br/>Option 3 states that the contribution of an anticyclone towards determining the weather of an area is quite significant. This statement is true. Anticyclones often bring fair weather conditions, with clear skies, light winds, and stable atmospheric conditions.<br/><br/>Option 4 states that the movement of wind is clockwise in an anticyclone in the Southern Hemisphere. This statement is correct. In the Southern Hemisphere, anticyclones are associated with clockwise wind circulation.",NA
Which one among the following statements relating to a cyclone is not correct?,NA,C,It is a wind circulation system with low pressure at the center,It brings about sudden changes in weather conditions in an area,Wind movement towards the low-pressure center of a cyclone is clockwise in the northern hemisphere.,It is known as a hurricane in the West Indies.,NA,NA,NA,NA,"Answer is C. Wind movement towards the low-pressure center of a cyclone is clockwise in the northern hemisphere<br/>Option 1 states that a cyclone is a wind circulation system with low pressure at the center. This statement is correct. Cyclones are characterized by a rotating, organized system of clouds and thunderstorms, with a center of low atmospheric pressure.<br/><br/>Option 2 states that a cyclone brings about sudden changes in weather conditions in an area. This statement is correct as well. Cyclones are often associated with heavy rainfall, strong winds, and can cause significant damage to infrastructure and agriculture.<br/><br/>Option 3 states that wind movement towards the low-pressure center of a cyclone is clockwise in the northern hemisphere. This statement is incorrect. In the northern hemisphere, the wind movement towards the center of a cyclone is actually counterclockwise. It is the opposite in the southern hemisphere, where the wind movement is clockwise.<br/><br/>Option 4 states that a cyclone is known as a hurricane in the West Indies. This statement is correct. Cyclones are known as hurricanes in the North Atlantic Ocean and the Northeast Pacific Ocean. In other regions, cyclones are known by different names, such as typhoons in the Northwest Pacific Ocean and tropical cyclones in the Indian Ocean.",NA
"When the wind blow from all sides to the central low in an anti-clockwise direction, then this phenomenon is known as",NA,C,anti-tropical cyclones of the southern hemisphere,temperate cyclones of the northern hemisphere,tropical cyclones of northern hemisphere,tropical cyclones of southern hemisphere,NA,NA,NA,NA,"The correct answer is Option C.<br/>Option 1 refers to anti-tropical cyclones of the southern hemisphere. This means that the wind blows from all sides to a central high-pressure area, rather than a central low. Therefore, option 1 is incorrect.<br/><br/>Option 2 refers to temperate cyclones of the northern hemisphere. While temperate cyclones do have low-pressure areas, the wind typically blows counterclockwise around them. In this phenomenon, the wind is blowing toward the central low-pressure area in an anti-clockwise direction. Therefore, option 2 is incorrect.<br/><br/>Option 3 states that when the wind blows from all sides to the central low in an anti-clockwise direction, it is known as tropical cyclones of the northern hemisphere. This option correctly describes the phenomenon mentioned in the question, as tropical cyclones typically have a central low-pressure area with wind circulating counterclockwise around it. Therefore, option 3 is the correct answer.<br/><br/>Option 4 refers to tropical cyclones of the southern hemisphere. Like option 3, this option also describes tropical cyclones, but it specifies the southern hemisphere instead of the northern hemisphere. Therefore, option 4 is incorrect.",NA
"Statement I : Anticyclone, which is a high pressure wind system, does not bring about significant change in weather condition.<br/>Statement II : The outward movement of wind from the high pressure center keeps limited scope for weather disturbance.",NA,A,Both the statements are individually true and statement II is the correct explanation of Statement I,Both the statements are individually true but statement II is not the correct explanation of Statement I,Statement I is true but statement II is false,Statement I is false but statement II is true,NA,NA,NA,NA,"The statement I states that an anticyclone, which is a high pressure wind system, does not bring about significant changes in weather conditions. This statement is true. Anticyclones are characterized by sinking air and the absence of clouds, making them stable weather systems. They are often associated with clear and calm weather.<br/><br/>The statement II explains that the outward movement of wind from the high pressure center of an anticyclone keeps limited scope for weather disturbance. This statement is also true. The high pressure center of an anticyclone causes the air to diverge and move away from the center. As a result, the air tends to sink and suppress vertical movement, leading to stable atmospheric conditions and limited opportunities for weather disturbances such as cloud formation or precipitation.<br/><br/>Therefore, both statements are true, and statement II is the correct explanation of statement I. The outward movement of wind and the absence of significant weather disturbances are linked to the characteristics of anticyclones, making the explanation accurate.",NA
"Consider the following statements.<br/>I. In a cyclone, the direction of wind flow is counter clockwise in the northern hemisphere. <br/>II. The tropical cyclone fades away when it reaches land because there is no large supply of warm moist air. <br/>Which of the statements given above is/are correct?",NA,C,1 only,2 only,Both 1 and 2,Neither 1 nor 2,NA,NA,NA,NA,"The correct answer is option 3: Both I and II.<br/><br/>Statement I states that in a cyclone, the direction of wind flow is counter-clockwise in the northern hemisphere. This statement is correct. In the northern hemisphere, cyclones have a low-pressure center, and the air flows inward toward the center. Due to the Coriolis effect, the wind gets deflected to the right, resulting in a counter-clockwise rotation.<br/><br/>Statement II states that tropical cyclones fade away when they reach land because there is no large supply of warm moist air. This statement is also correct. Tropical cyclones derive their energy from warm ocean waters, and when they move over land, they lose their source of warm, moist air. Without this source of energy, the cyclone weakens and eventually dissipates.<br/><br/>Therefore, both statements are correct. In a cyclone, the wind flows counter-clockwise in the northern hemisphere, and tropical cyclones fade away when they reach land due to the lack of warm moist air.",NA
Mid-latitude cyclones:,NA,D,usually move across North America rom east to west,are generally found only over the Ocean,generally bring clear skies and little precipitation,are formed in regions of strong temperature contrasts,NA,NA,NA,NA,"The correct answer is option 4: Mid-latitude cyclones are formed in regions of strong temperature contrasts.<br/>Option 1: This statement is incorrect. Mid-latitude cyclones typically move from west to east, not from east to west. They are often referred to as <q>west to east storms</q> due to their eastward movement across the mid-latitudes of the Earth.<br/><br/>Option 2: This statement is incorrect. Mid-latitude cyclones can form over both land and ocean. While they are more commonly associated with the ocean, they can also develop over land regions with strong temperature contrasts.<br/><br/>Option 3: This statement is incorrect. Mid-latitude cyclones are known for bringing unsettled weather conditions such as clouds, precipitation, and strong winds. They rarely bring clear skies and little precipitation.<br/><br/>Option 4: This statement is correct. Mid-latitude cyclones form along the boundaries between warm and cold air masses, where strong temperature contrasts occur. These temperature contrasts provide the necessary energy for the development and intensification of these cyclones.",NA
What is the general direction of cyclones formed in the Bay of Bengal ?,NA,A,East to West,West to East,West to South,North to South,NA,NA,NA,NA,"The general direction of cyclones formed in the Bay of Bengal is from east to west.<br/>Option 1: East to west - This option is correct. Cyclones in the Bay of Bengal generally move from east to west. This means that they form in the eastern part of the Bay and then move towards the western coast of India or towards the eastern coast of neighboring countries like Bangladesh and Myanmar.<br/><br/>Option 2: West to east - This option is incorrect. Cyclones in the Bay of Bengal do not generally move from west to east.<br/><br/>Option 3: West to south - This option is incorrect. Cyclones in the Bay of Bengal do not generally move from west to south.<br/><br/>Option 4: North to south - This option is incorrect. Cyclones in the Bay of Bengal do not generally move from north to south.<br/>In summary, the general direction of cyclones formed in the Bay of Bengal is from east to west.",NA
Which one of the following may be the true characteristic of cyclones?,NA,A,Temperate cyclones move from west to east with westerlies whereas tropical cyclones follow trade winds,The front side of cyclone is known as the <q>eye of the cyclone</q>,Cyclone possess a centre of high pressure surrounded by closed isobars,Hurricanes are well known tropical cyclones which develop over mid latitudes.,NA,NA,NA,NA,"The correct asnwer is A states that temperate cyclones move from west to east with westerlies, while tropical cyclones follow trade winds. Temperate cyclones are low-pressure systems that form in the mid-latitudes and are typically associated with fronts. These cyclones are driven by the prevailing westerly winds in the mid-latitudes and generally move from west to east. On the other hand, tropical cyclones are characterized by low-pressure systems that develop in tropical regions and are driven by the trade winds, which blow from east to west. Thus, option 1 is a true characteristic of cyclones.",NA
Assertion(A): Tropical cyclones do not develop very close to the Equator.<br/>Reason (R) : A weak coriolis effect retards the development of circular air motion.,NA,A,Both A and R are individually true and R is the correct explanation of A,Both A and R are individually correct true but R is not the correct explanation of A,A is true but R is false,A is false but R is true,NA,NA,NA,NA,"Option 1 states that both the assertion (A) and the reason (R) are true, and R is the correct explanation of A.<br/>The assertion states that tropical cyclones do not develop very close to the Equator. This is true because one of the key requirements for the formation of tropical cyclones is the Coriolis effect, which is created by the rotation of the Earth. This effect deflects the path of moving air masses, resulting in the development of circular air motion in cyclones. However, the Coriolis effect is weakest at the equator and increases towards the poles.<br/><br/>The reason given is that a weak Coriolis effect retards the development of circular air motion. This is also true because the Coriolis effect is directly related to the development of cyclones. When the Coriolis effect is weak, as it is near the Equator, it hinders the formation of the necessary circular air motion that is characteristic of tropical cyclones.<br/><br/>Therefore, option 1 accurately states that both the assertion and the reason are individually true, and the reason provides the correct explanation of the assertion.",NA
"Whenever a tropical cyclone moves to land, much of its severity is reduced. This is because <br/>1. its source of moisture is cut off <br/>2. the friction over land kills tropical cyclones <br/>Select the correct answer using the code given below:",NA,A,1 only,2 only,Both 1 and 2,Neither 1 nor 2,NA,NA,NA,NA,"The correct answer is option 1: 1 only. When a tropical cyclone moves to land, much of its severity is reduced because its source of moisture is cut off. Tropical cyclones derive their energy from warm ocean waters, which provide heat and moisture for their development and intensification. When a cyclone moves over land, it loses this source of moisture, causing it to weaken.<br/><br/>Option 2: The friction over land does not kill tropical cyclones. While friction can cause some weakening of the cyclone, it is not the primary factor in reducing their severity. The main reason for the weakening of tropical cyclones over land is the loss of their moisture source.<br/><br/>Therefore, the correct explanation is that when a tropical cyclone moves to land, much of its severity is reduced because its source of moisture is cut off.",NA
Which of the following statements is/are correct?<br/>1. The tropical cyclones of China Sea are called typhoons.<br/>2. The tropical cyclones of the West Indies are called tornadoes.<br/>3. The tropical cyclones of Australia are called willy - willies.<br/>4. Formation of an anticyclone results in stormy weather condition.<br/>Select the correct answer using the code given below.,NA,C,"1, 2, 3 and 4","1, 2 and 4 only",1 and 3 only,3 only,NA,NA,NA,NA,"The correct statement is option 3: 1 and 3 only.<br/><br/>Statement 1 is correct. The tropical cyclones that occur in the China Sea are called typhoons.<br/>Statement 2 is incorrect. The tropical cyclones that occur in the West Indies are not called tornadoes. Tornadoes are a different type of weather phenomenon characterized by a violently rotating column of air that is in contact with both the surface of the Earth and a cumulonimbus cloud or a cumulous cloud.<br/>Statement 3 is correct. The tropical cyclones that occur in Australia are called willy-willies. Willy-willies are small, localized whirlwinds that usually occur during the dry season in northern Australia.<br/>Statement 4 is incorrect. The formation of an anticyclone does not result in stormy weather conditions. An anticyclone is a weather phenomenon characterized by the circulation of winds around a high-pressure center. It typically brings calm and fair weather conditions.<br/><br/>Therefore, the correct answer is option 3: 1 and 3 only.",NA
Which one of the following pairs is not correctly matched?,NA,D,China Sea : Typhoons,Gulf of Mexico : Hurricanes,North West Australia : Willy Willies,Indian Ocean : Tornadoes,NA,NA,NA,NA,"In this question, we are asked to identify the incorrectly matched pair. Let us analyze each option to determine the correct answer.<br/><br/>Option 1: China Sea and Typhoons. This pair is correctly matched. The China Sea is prone to typhoons, which are tropical cyclones that are common in the western North Pacific Ocean.<br/><br/>Option 2: Gulf of Mexico and Hurricanes. This pair is correctly matched. The Gulf of Mexico is known for its susceptibility to hurricanes, which are intense tropical cyclones that form over warm ocean waters.<br/><br/>Option 3: North-West Australia and Willy Willies. This pair is correctly matched. Willy Willies are an Australian term for tropical cyclones or whirlwinds that occur in the north-western regions of Australia.<br/><br/>Option 4: Indian Ocean and Tornadoes. This pair is not correctly matched. Tornadoes are more commonly associated with regions such as the central United States, known as <q>Tornado Alley</q>. While tropical cyclones can form in the Indian Ocean, tornadoes are not typically associated with this region.<br/><br/>Therefore, the correct answer is option 4: Indian Ocean and Tornadoes.",NA
