question_text,question_image,correct_answer,option_1_text,option_2_text,option_3_text,option_4_text,option_1_image,option_2_image,option_3_image,option_4_image,answer_explanation_text,answer_explanation_image
<b>Consider the following statements about indifference curves:</b><br/><br/>1. Indifference curves are convex to the origin.<br/>2. Higher indifference curve represents higher level of satisfaction.<br/>3. Two indifference curves cut each other.<br/><b>Which of the statements given above is/are correct?</b>,NA,B,1 only,1 and 2,2 and 3,3 only,NA,NA,NA,NA,"<b>The correct answer is option 2, which states that both statements 1 and 2 are correct.</b><br/><br/>Let&#39;s analyze each statement to better understand them:<br/>Statement 1: Indifference curves are convex to the origin.<br/>Indifference curves are graphical representations of different combinations of two goods or services that provide the same level of utility or satisfaction to an individual. Convexity to the origin means that the indifference curve bends toward the origin, indicating that the individual prefers a combination with fewer goods or services. This is because the individual&#39;s marginal utility for each good generally decreases as they consume more of it.<br/>Statement 2: Higher indifference curve represents a higher level of satisfaction.<br/>Indifference curves are typically drawn with higher levels of satisfaction further away from the origin. This is because as an individual consumes more of both goods, their satisfaction increases. Therefore, a higher indifference curve represents a combination of goods that provides a higher level of satisfaction for the individual.<br/>Statement 3: Two indifference curves cut each other.<br/>This statement is incorrect. Indifference curves do not intersect or cut each other. Each indifference curve represents a specific level of satisfaction or utility, and higher indifference curves represent higher levels of satisfaction. ",NA
Which one of the following States of India is not covered by Food Forecasting Stations set up by the Central Water Commission?,NA,D,Rajasthan,Jammu and Kashmir,Tripura,Himachal Pradesh,NA,NA,NA,NA,"<b>The correct answer is option 4: Himachal Pradesh.</b><br/><br/> The Food Forecasting Stations (FFS) were established by the Central Water Commission to monitor and forecast the availability of water for agricultural purposes in different states of India. These stations provide valuable information regarding crop water requirements, irrigation scheduling, and drought management.<br/>Options 1, 2, and 3 (Rajasthan, Jammu and Kashmir, and Tripura) are covered by the Food Forecasting Stations, meaning that they have an FFS set up by the Central Water Commission. These stations help in assessing the water needs for agriculture and provide timely information for better management of water resources.<br/>However, option 4, Himachal Pradesh, is not covered by the Food Forecasting Stations. The reason for this exclusion is not explicitly mentioned, but it could be due to various factors such as the state&#39;s relatively smaller agricultural area or sufficient water availability compared to other states.",NA
Which one of the following statements about the National Green Tribunal is not correct?,NA,D,It was set up in the year 2010,It is involved in effective and expeditious disposal of cases relating to environmental protection and conservation of forests.,It may consider giving relief and compensation for damages to persons and property,"It is bound by the procedures laid down under the Code of Civil Procedure, 1908.",NA,NA,NA,NA,"Option 1 states that the National Green Tribunal (NGT) was set up in the year 2010. This statement is correct. The NGT was indeed established on October 18, 2010, under the National Green Tribunal Act of 2010.<br/>Option 2 states that the NGT is involved in the effective and expeditious disposal of cases related to environmental protection and conservation of forests. This statement is correct. One of the main objectives of the NGT is to provide a specialized forum for the resolution of environmental disputes and to ensure the protection and conservation of the environment.<br/>Option 3 states that the NGT may consider giving relief and compensation for damages to persons and property. This statement is correct. The NGT has the power to award compensation for damages to individuals and property caused by violations of environmental laws.<br/>Option 4 states that the NGT is bound by the procedures laid down under the Code of Civil Procedure, 1908. This statement is not correct. The NGT is not bound by the procedures laid down under the Code of Civil Procedure, 1908, but rather has its own procedures and rules, which are outlined in the NGT (Practice and Procedure) Rules of 2011.",NA
The Deccan Agriculturalists Relief Act of 1879 was enacted with which one of the following objectives?,NA,D,Restore lands to the dispossessed peasants,Ensure financial assistance to peasants during social and religious occasions,Restrict the sale of land for indebtedness to outsiders,Give legal aid to insolvent peasants,NA,NA,NA,NA,"The Deccan Agriculturalists Relief Act of 1879 was enacted with the objective of providing legal aid to insolvent peasants. This means that the act aimed to assist peasants who were unable to pay off their debts and were considered financially insolvent. The act provided legal support to these peasants, which likely included guidance and representation in legal matters related to their insolvency.<br/>Option 1, restoring lands to the dispossessed peasants, is not the primary objective of this act. While it is possible that some peasants may have lost their lands due to indebtedness, the act focuses on providing legal aid to insolvent peasants rather than restoring their lands.<br/>Option 2, ensuring financial assistance to peasants during social and religious occasions, is not mentioned as an objective of the act. The act specifically focuses on providing legal aid to insolvent peasants, rather than providing financial assistance for social and religious events.<br/>Option 3, restricting the sale of land for indebtedness to outsiders, is not the objective of the act. The act primarily aims to provide legal aid to insolvent peasants, rather than imposing restrictions on land sales.<br/><b>Therefore, option 4, giving legal aid to insolvent peasants, is the correct answer.</b>",NA
"When hot water is placed into an empty water bottle, the bottle keeps its shape and does not soften. What type of plastic is the water bottle made from?",NA,D,Thermoplastic,PVC,Polyurethane,Thermosetting,NA,NA,NA,NA," <b>correct answer is option 4, thermosetting plastic.</b><br/>When hot water is placed into an empty water bottle, the fact that the bottle keeps its shape and does not soften suggests that it is made from thermosetting plastic.<br/>Thermosetting plastics, also known as thermosets, are a type of polymer that undergoes a chemical reaction when heated and solidify into a permanent, rigid structure. This means that once they are set, they cannot be melted or reshaped. The process of heating thermosetting plastics causes cross-linking, which is the formation of strong chemical bonds between polymer chains.<br/>In contrast, thermoplastic plastics, like option 1, have a lower melting point and can be melted and reshaped multiple times without any chemical change. PVC (option 2) and polyurethane (option 3) are examples of thermoplastic materials.<br/><br/><b>Therefore, option 4, thermosetting plastic, is the correct answer because it explains why the hot water does not cause the water bottle to soften or lose its shape.</b>",NA
Which one of the following is not correct about Administrative Tribunals?,NA,C,The Parliament may by law constitute Administrative Tribunals both at the Union and State levels,Tribunals may look into disputes and complaints with respect to recruitment and conditions of service of persons appointed to public services.,Tribunals established by a law of the Parliament can exclude the jurisdiction of all Courts to allow for special leave to appeal.,The law establishing the Tribunals may provide for procedures including rules of evidence to be followed.,NA,NA,NA,NA,"Option 1 states that the Parliament has the authority to establish Administrative Tribunals at both the Union (central government) and State levels. This means that these tribunals can be created to deal with administrative and service-related disputes at different levels of government.<br/>Option 2 correctly states that Administrative Tribunals can handle disputes and complaints relating to the recruitment and conditions of service of individuals employed in public services. This includes matters such as appointments, promotions, transfers, and disciplinary actions.<br/>Option 3 states that Tribunals established by a law of the Parliament have the ability to exclude the jurisdiction of all Courts. This means that if a case falls under the jurisdiction of a specific Administrative Tribunal, then the normal courts would not have the authority to hear and decide on that case. This provision allows for a specialized forum for resolving administrative disputes.<br/>Option 4 states that the law establishing the Tribunals can also provide for the procedures to be followed, including the rules of evidence. This allows the Tribunals to have their own set of procedures and rules tailored to deal with administrative matters efficiently.<br/><br/><b>Therefore, option 3 is incorrect. It wrongly states that Tribunals can exclude the jurisdiction of all Courts to allow for special leave to appeal.</b>",NA
E.K. Janaki Ammal National Award on Taxonomy is administered by the,NA,D,Ministry of Agriculture and Farmers Welfare,Ministry of New and Renewable Energy,,,NA,NA,NA,NA,"<b>The E.K. Janaki Ammal National Award on Taxonomy is an award given for outstanding contributions in the field of taxonomy. The correct answer for the administering ministry of this award is the Ministry of Environment, Forest and Climate Change, which is option 4.</b><br/><br/>Option 1, the Ministry of Agriculture and Farmers Welfare, is not the correct answer. This ministry focuses on agricultural policies, rural development, and welfare of farmers.<br/>Option 2, the Ministry of New and Renewable Energy, is also not the correct answer. This ministry is responsible for formulating and implementing policies related to the development and promotion of renewable energy sources in India.<br/>Option 3, the Ministry of Health and Family Welfare, is not the correct answer either. This ministry is responsible for public health, healthcare infrastructure, and family welfare programs in the country.<br/><br/>Therefore, the correct answer is indeed option 4, the Ministry of Environment, Forest and Climate Change. This ministry is responsible for environmental policies and programs, conservation of forests, and addressing climate change issues in India.",NA
"For an ideal gas, which one of the following statements does not hold true?",NA,A,The speed of all gas molecules is same,The kinetic energies of all gas molecules are not same,The potential energy of the gas molecules is zero,There is no interactive force between the molecules.,NA,NA,NA,NA,"<b>For an ideal gas, the correct statement that does not hold true is option 1: <q>The speed of all gas molecules is the same.</q></b><br/><br/>In an ideal gas, the gas molecules are considered to be point particles with negligible volume and no intermolecular forces. However, the kinetic theory of gases states that gas molecules have a range of speeds. This means that the velocities of the gas molecules in an ideal gas are not all the same. Some gas molecules will have higher velocities, while others will have lower velocities. Consequently, the statement that the speed of all gas molecules is the same is not applicable to an ideal gas.<br/>Option 2 is correct because the kinetic energies of the gas molecules in an ideal gas are not all the same. Kinetic energy is directly proportional to the square of the velocity, so molecules with higher speeds will have higher kinetic energies.<br/>Option 3 is correct because the potential energy of gas molecules in an ideal gas is considered to be zero since there are no intermolecular forces.<br/>Option 4 is correct because ideal gases are assumed to have no interactive forces between the gas molecules.<br/>In summary, the statement that does not hold true for an ideal gas is that the speed of all gas molecules is the same.",NA
A market situation when firms sell similar but not identical products is termed as,NA,C,perfect competition,imperfect competition,monopolistic competition,oligopoly,NA,NA,NA,NA,"<b>The correct answer is option 3, monopolistic competition. In monopolistic competition, firms sell similar but not identical products. This means that products may have slight differences in terms of branding, quality, or other features.</b><br/><br/>Option 1, perfect competition, refers to a market situation where there are many small firms selling identical products. In perfect competition, there is no differentiation among products.<br/>Option 2, imperfect competition, is a broad term that encompasses various market structures where firms have some degree of market power but are not monopolies. This can include both monopolistic competition and oligopoly.<br/>Option 4, oligopoly, refers to a market situation where a small number of large firms dominate the market. These firms can have significant market power and may collude with each other to influence prices and market behavior.<br/><b>In summary, monopolistic competition best describes a market situation where firms sell similar but not identical products.</b>",NA
Which one of the following is the correct sequence of passage of light in a compound microscope?,NA,C,Condenser - Objective lens - Eye -piece - Body tube,Objective lens - Condenser - Body tube - Eye piece,Condenser - Objective lens - Body tube - Eyepiece,Eyepiece - Objective lens - Body tube - Mirror,NA,NA,NA,NA,"<b>Option 1: Condenser - Objective lens - Eyepiece - Body tube</b><br/>This option is incorrect. In a compound microscope, the light first passes through the condenser, then through the objective lens, and finally through the eyepiece. The body tube is the part that connects the objective lens and the eyepiece, so it should not come before the eyepiece in the sequence.<br/><b>Option 2: Objective lens - Condenser - Body tube - Eyepiece</b><br/>This option is not the correct sequence. The light first passes through the condenser before reaching the objective lens. So, the condenser should come before the objective lens in the sequence.<br/><b>Option 3: Condenser - Objective lens - Body tube - Eyepiece</b><br/>This is the correct sequence. The light passes through the condenser, then through the objective lens, and then through the body tube before reaching the eyepiece. This is the typical arrangement of the optical components in a compound microscope.<br/><b>Option 4: Eyepiece - Objective lens - Body tube - Mirror</b><br/>This option is incorrect. The mirror is used to reflect light into the microscope. The correct sequence would be mirror - condenser - objective lens - eyepiece. ",NA
Which one of the following is not correct about the Panchayats as laid down in Part IX of the Constitution of India?,NA,A,The Chairperson of a Panchayat needs to be directly by people in order to exercise the right to vote in the Panchayat meetings.,"The State Legislature has the right to decide whether or not offices of the Chairpersons in the Panchayats are reserved for SCs, STs or women.","Unless dissolved earlier, every Panchayat continues for a period of five years.",The State Legislature may by law make provisions for audit of accounts of the Panchayats.,NA,NA,NA,NA,"Option 2: The State Legislature has the right to decide whether or not offices of the Chairpersons in the Panchayats are reserved for SCs, STs, or women. This statement is correct. The State Legislature has the power to decide whether or not to reserve the office of the Chairperson in the Panchayats for Scheduled Castes, Scheduled Tribes, or women.",NA
Which one of the following is the most populated State in India as per Census 2011?,NA,C,Goa,Mizoram,Meghalaya,Sikkim,NA,NA,NA,NA,"<b>The correct answer is option 3, Meghalaya. According to the Census of India in 2011, Meghalaya is the most populated state in India.</b><br/><br/>
Let&#39;s dissect each option to understand why the correct answer is option 3 and not the others:<br/><br/>- Option 1: Goa. Goa is the smallest state in India with a relatively small population. It is not the most populated state.<br/>- Option 2: Mizoram. Mizoram is a northeastern state of India with a population of approximately 1.1 million. While it is not heavily populated compared to other states, it is not the most populated state either.<br/>- Option 3: Meghalaya. Meghalaya is a northeastern state of India with a population of approximately 3.2 million people. As per the Census of India in 2011, it is the most populated state among the given options.<br/>- Option 4: Sikkim. Sikkim is a small state in the Himalayas with a relatively low population compared to other states in India. It is not the most populated state.<br/><b>Therefore, based on the Census of India 2011 data, the correct answer is option 3, Meghalaya.</b>",NA
The 11th BRICS in 2019 will be hosted by,NA,C,China,Russia,Brazil,India,NA,NA,NA,NA,"<b>The correct answer is option 3: Brazil. The BRICS (Brazil, Russia, India, China, and South Africa) is an association of five major emerging economies. Each year, one of the member countries hosts the annual BRICS summit. In 2019, it was Brazil`s turn to host the summit, making option 3 the correct answer.</b><br/><br/>Option 1: China is incorrect because China hosted the BRICS summit in 2017.<br/>Option 2: Russia is incorrect because Russia hosted the BRICS summit in 2015.<br/>Option 4: India is incorrect because India hosted the BRICS summit in 2016.<br/><b>Therefore, the correct answer is option 3: Brazil. It is important to note the rotation system followed by the BRICS countries in hosting the summit, as this determines which country will host the event each year.</b>",NA
Which one of the following methods is not suitable for urban rainwater harvesting?,NA,C,Rooftop recharge pit,Recharge wells,Gully plug,Recharge trench,NA,NA,NA,NA,"Option 1: Rooftop recharge pit is a suitable method for urban rainwater harvesting. It involves collecting rainwater from rooftops and directing it into a pit or storage tank for recharge.<br/>Option 2: Recharge wells are also a suitable method for urban rainwater harvesting. They involve drilling a well and directing rainwater into it for groundwater recharge.<br/>Option 3: Gully plug. This method is not suitable for urban rainwater harvesting. A gully plug involves blocking a drainage gully or ditch with a barrier to collect rainwater. However, in urban areas, it may not be feasible or practical to block existing drainage systems as it can lead to flood risks and waterlogging.<br/>Option 4: Recharge trench is a suitable method for urban rainwater harvesting. It involves digging a trench and directing rainwater into it for infiltration into the ground.<br/><br/><b>In summary, Option 3 - the gully plug is not suitable for urban rainwater harvesting due to the potential complications it may cause in existing drainage systems. Alternative options such as rooftop recharge pits, recharge wells, and recharge trenches are preferred for effective rainwater harvesting in urban areas.</b>",NA
"Eight States have achieved more than 99% household electrification prior to the launch of <q>Saubhagya Scheme</q>.
Which one of the following is not among them?",NA,D,Kerala,Punjab,Himachal Pradesh,Madhya Pradesh,NA,NA,NA,NA,"<b>The correct answer is option 4, Madhya Pradesh. Before the launch of the <q>Saubhagya Scheme</q>, there were eight states in India that had achieved more than 99% household electrification.</b><br/><br/>Let&#39;s analyze each option to understand why they are or are not among those eight states:<br/>Option 1: Kerala - This option could be a potential candidate for the correct answer as it is one of the states mentioned in the question. However, without further information, we cannot conclude whether Kerala is indeed one of the eight states or not.<br/>Option 2: Punjab - This option could also be a potential candidate for the correct answer. Like Kerala, without additional information, it is unclear whether Punjab is among the eight states or not.<br/>Option 3: Himachal Pradesh - This option is also uncertain without more information. It is unknown whether Himachal Pradesh is part of the eight states or not.<br/>Option 4: Madhya Pradesh - As stated in the question, Madhya Pradesh is not among the eight states that achieved more than 99% household electrification before the launch of the <q>Saubhagya Scheme</q>.<br/><br/><b>Therefore, option 4, Madhya Pradesh, is the correct answer based on the information provided.</b>",NA
Which one of the following statements regarding haemoglobin is correct?,NA,B,Haemoglobin present in RBC can carry only oxygen but not carbon dioxide,Haemoglobin of RBC can carry both oxygen and carbon dioxide,Haemoglobin of RBC can carry only carbon dioxide,Haemoglobin is only used for blood clotting and not for carrying gases.,NA,NA,NA,NA,"Option 1: Haemoglobin present in RBC can carry only oxygen but not carbon dioxide.<br/>This option is incorrect. Haemoglobin in red blood cells can bind to both oxygen and carbon dioxide.<br/>Option 2: Haemoglobin of RBC can carry both oxygen and carbon dioxide.<br/>This option is correct. Haemoglobin in red blood cells has the ability to bind to both oxygen and carbon dioxide. In the lungs, haemoglobin binds with oxygen to form oxyhemoglobin, which is then transported to tissues throughout the body. In the tissues, haemoglobin releases oxygen and binds with carbon dioxide, forming carbaminohemoglobin. This carbaminohemoglobin is then carried back to the lungs to be exhaled.<br/>Option 3: Haemoglobin of RBC can carry only carbon dioxide.<br/>This option is incorrect. While haemoglobin does bind with carbon dioxide, it also carries oxygen.<br/>Option 4: Haemoglobin is only used for blood clotting and not for carrying gases.<br/>This option is incorrect. Haemoglobin is primarily responsible for carrying oxygen in the blood and assisting with the transportation of carbon dioxide. It is not involved in blood clotting, which is primarily mediated by other proteins called clotting factors.",NA
The Prime Minister&#39;s National Relief Fund is operated by which one of the following bodies?,NA,A,The Prime Minister&#39;s Office (PMO),The National Disaster Management Authority,The Ministry of Finance,The National Development Council (NDC),NA,NA,NA,NA,"<b>The Prime Minister&#39;s National Relief Fund is operated by the Prime Minister`s Office (PMO). This fund is a public charitable trust that was established in 1948 with the primary objective of providing financial assistance to individuals and institutions affected by natural disasters or other calamities, such as floods, earthquakes, cyclones, and epidemics.</b><br/><br/>Option 1 - The Prime Minister&#39;s Office (PMO): This is the correct answer. The PMO is responsible for operating and managing the Prime Minister`s National Relief Fund.<br/>Option 2 - The National Disaster Management Authority: This is not the correct answer. The National Disaster Management Authority (NDMA) is a different organization that is responsible for planning, coordinating, and implementing measures for disaster management in the country.<br/>Option 3 - The Ministry of Finance: This is not the correct answer. The Ministry of Finance is responsible for managing the government`s finances and formulating economic policies, but it is not involved in the operation of the Prime Minister`s National Relief Fund.<br/>Option 4 - The National Development Council (NDC): This is not the correct answer. The National Development Council (NDC) is a policy-making body that provides a platform for discussion and coordination between the central and state governments on matters related to economic and social development",NA
Which among the following countries of South America does the Tropic of Capricorn not pass through?,NA,B,Chile,Bolivia,Paraguay,Brazil,NA,NA,NA,NA,"<b>The Tropic of Capricorn is an imaginary line that runs across the southern hemisphere at approximately 23.5 degrees south of the equator. It marks the farthest point south where the sun can be directly overhead at noon on the winter solstice.</b><br/><br/>Option 1: Chile - The Tropic of Capricorn does pass through Chile. Therefore, this option is incorrect.<br/>Option 2: Bolivia - The correct answer. The Tropic of Capricorn does not pass through Bolivia.<br/>Option 3: Paraguay - The Tropic of Capricorn does pass through Paraguay. Therefore, this option is incorrect.<br/>Option 4: Brazil - The Tropic of Capricorn does pass through Brazil. Therefore, this option is incorrect.<br/>To summarize, out of the given options, the Tropic of Capricorn does not pass through Bolivia.",NA
