question_text,question_image,correct_answer,option_1_text,option_2_text,option_3_text,option_4_text,option_1_image,option_2_image,option_3_image,option_4_image,answer_explanation_text,answer_explanation_image
Which one of the following regarding the trade and commerce of pre-Gupta period is not correct?,NA,D,Roads were built and trade routes established; the famous trade routes being Northern and Southern highways,"Merchant vessels used to sail Sri Lanka, Burma and southern Arabia.",The appearance of a large number of coins (in the Ist to the 5th Century A.D.) was the beginning of the money economy.,The state in order to promote trade pursued the policy of protection in preference to free trade.,NA,NA,NA,NA,"The Incorrect statement is D.<br/>EXPLANATION:<br/>Statement A is correct. Roads were indeed built and trade routes were established during the pre-Gupta period. The Northern and Southern highways were famous trade routes during this time.<br/>Statement B is correct. Merchant vessels did sail to Sri Lanka, Burma, and southern Arabia for trade purposes during the pre-Gupta period.<br/> Statement C is correct. The appearance of a large number of coins during the 1st to the 5th century A.D. marked the beginning of the money economy in the pre-Gupta period.<br/>Statement D is incorrect. In fact, the state in the pre-Gupta period pursued the policy of free trade rather than protection in order to promote trade.<br/><br/>Therefore, the correct answer is D. Like artisans, merchants were also specialized in particular trades.",NA
Which one of the following cities was regarded as the best producer of silk?,NA,B,Ujjain,Varanasi,Kausambi,Taxila,NA,NA,NA,NA,"Best Producer of Silk was Answer B: Varanasi<br/>Explanation:<br/>- Silk production in India has a long history, and several cities have been known for their silk production.<br/>- Among these cities, Varanasi, also known as Banaras or Kashi, has been regarded as the best producer of silk.<br/>- Varanasi is located in the state of Uttar Pradesh in northern India.<br/>- The city has a rich tradition of silk weaving, with skilled artisans producing high-quality silk fabrics.<br/>- Varanasi silk, also known as Banarasi silk, is famous for its intricate designs and luxurious feel.<br/>- The silk weavers of Varanasi use traditional handloom techniques to create beautiful sarees, dupattas, and other silk products.<br/>- The city is known for its silk sarees, especially the Banarasi silk sarees, which are highly sought after in India and around the world.<br/>- The silk industry in Varanasi has flourished for centuries and continues to be a major economic activity in the region.<br/>- The city&#39;s silk products are known for their craftsmanship, quality, and timeless beauty.<br/>- Varanasi&#39;s reputation as the best producer of silk is a result of the city's rich textile heritage and the skill and dedication of its artisans.",NA
Which one of the following was perhaps the most advanced industry of the period?,NA,C,Metal-work,Jewellery,Textile,Pottery,NA,NA,NA,NA,"India has been well known for her textile goods since very ancient times. The cotton textile industry, however, made its real beginning in Bombay, in 1850s. The first cotton textile mill of Bombay was established in 1854 by a Parsi cotton merchant then engaged in overseas and internal trade.",NA
According to Fa-hien which one of the following was the most common medium of exchange during Gupta period?,NA,A,Courie,Coral,Couch,Shell,NA,NA,NA,NA,"According to Fa-hien, the most common medium of exchange during the Gupta period was the Courie.<br/>Here is a detailed explanation:<br/><b>Background:</b><br/>- Fa-hien was a Chinese Buddhist monk who traveled to India during the Gupta period (4th to 6th century CE).<br/>- He documented his travels and observations in his book <q>Records of the Western World</q>.<br/>- His writings provide valuable insights into the social, economic, and cultural aspects of ancient India.<br/><b>Medium of Exchange:<b/><br/>- During the Gupta period, the Courie was the most common medium of exchange.<br/>- Courie refers to small copper coins that were widely circulated and used in daily transactions.<br/>- These coins were minted by the Gupta rulers and bore inscriptions in Brahmi script.<br/><b>Evidence from Fa-hien:</b>- Fa-hien mentions the widespread use of Courie in his accounts.<br/>- He describes how people used Courie to buy goods and services in the marketplaces.<br/>- He also notes that merchants and traders accepted Courie as payment for their products.<br/><b>Importance of Courie:<b><br/>- The use of Courie as a medium of exchange facilitated trade and commerce during the Gupta period.<br/>- It provided a standardized form of currency that was widely accepted and recognized.<br/>- The availability of Courie coins also indicates a well-developed monetary system in Gupta society.<br/>In conclusion, according to Fa-hien, the most common medium of exchange during the Gupta period was the Courie. These small copper coins were widely circulated and used in daily transactions, facilitating trade and commerce in ancient India.",NA
What was regarded as an honest price of a commodity according to Katyayana?,NA,B,The price fixed by the state.,The price fixed by the knowledgeable and honest body of neighbours.,The price settled by means of haggling.,The price fixed by the trade guilds.,NA,NA,NA,NA,"B is the correct option. Katyayana also spelled as Katyayana was a Sanskrit grammarian, mathematician and Vedic priest who lived in ancient India. According to him an honest price of a commodity The price fixed by the knowledgeable and honest body of neighbours.",NA
The king who played the Veena?,NA,A,Samudragupta,Harsha,Ashoka,None of these,NA,NA,NA,NA,"Correct answer is A - Samudragupta.<br/>Veena is regarded as a <q>Divine Instrument</q>.<br/>Samudragupta period gold coins and inscriptions suggest that he was an accomplished poet, and also played music.<br/>He was also shown playing the veena on his coins.<br/>He was also known as the man of musical art.<br/>The depiction of king Samudragupta holding such an instrument on his gold coins testifies to the popularity of the instrument, and also of the interest in music and the arts of a king who was also one of the greatest military conquerors in Indian history.",http://abhigyanacademy.com/upload/gallery/1719044967.png
"Consider the following quotation: <q>A person turning fallow into arable land, or cultivating a field when the owner was unable to do the same, or was dead or was unheard of, is entitled to the enjoyment of its produce (less eight part) for a period of seven or eight years</q>. This law was enunciated during the period of",NA,D,Maurya,Sixth century B.C.,Reign of Samudragupta,Late Gupta and post-Gupta,NA,NA,NA,NA,The correct option is D.<br/>This law was enunciated during the period of Late Gupta and post-Gupta.,NA
Which one of the following was not a product of the Malaya mountain region?,NA,A,Safrron,Camphor,Pepper,Sandalwood,NA,NA,NA,NA,"A is the correct option. <br/>Currently in India, saffron crop is grown in pockets of Kashmir like Pampore and Kishtwar. Pampore is one of the few places in the world where saffron, the world&#39;s most expensive spice, grows.<br/>Whereas camphor, pepper, and sandalwood are a product of the Malaya mountain region. These mountains are believed to have formed the southernmost part (southwards starting from the Mangalore region) of the Western Ghats, modern day Kerala, while the Northern part of the same was called the Sahya Mountains. ",NA
"At the post-Gupta period, which one of the following social groups started competing with the Brahmins for power and position?",NA,C,Ranakas,Brahma Ksatra,Kayasthas,Gahapatis,NA,NA,NA,NA,"The correct option is C.<br/>Kayastha (also referred to as Kayasth or Kayeth) denotes a cluster of disparate communities broadly categorised by the regions of India in which they were traditionally located - the Chitragupta Vansh Kayasthas of North India, the Chandraseniya Kayastha Prabhus of Maharashtra and the Bengali Kayasthas of Bengal.",NA
Which of the following features can not be associated with the agrarian structure of the post-Gupta period?,NA,C,Sub-infeudation and sub-leasing of land.,Increase tenancy rights of the peasantry.,Increase in the mobility of artisans and peasants.,Imposition of forced labour.,NA,NA,NA,NA,"In the post-Gupta period, the agrarian structure was characterized by feudalism and the dominance of local landlords. This led to the exploitation of peasants and the consolidation of power among the landed elite, shaping the social hierarchy of the time.",NA
Which fact undermined the emergence of imperial powers in the post-Gupta period?,NA,A,Most of the feudatories and land grantees were given the authority to maintain law and order and dispense justice.,The feudatories were expected to maintain feudal levies.,"The feudatories were expected to supply levies to the king, whenever it was required as a matter of moral obligation.",Some of the feudatories were permitted to grant land without first obtaining permission of the king.,NA,NA,NA,NA,"The emergence of imperial powers in the post-Gupta period was undermined by the fact that most of the feudatories and land grantees were given the authority to maintain law and order and dispense justice. <br/>This decentralization of power weakened the central authority and allowed the feudatories to assert their own autonomy, hindering the consolidation of imperial rule.",NA
Land grants became frequent in India from the,NA,D,1st Century A.D.,3rd Century A.D.,4th Century A.D.,5th Century A.D.,NA,NA,NA,NA,"In the Gupta era, the number of land grants increased and expanded over the empire. Kings, chiefs, members of the royal family, and their feudatories frequently granted land to Brahmanas and religious institutions like temples and monasteries.<br/>Not only was the income of the donated lands transferred to the donees beginning in the fifth century but the mines and minerals in that region were also transferred. Soldiers and royal officials were forbidden from interfering with the donated land, village, or villages.<br/><br/>While kings were the main land donors, others also contributed. Records of land donations made to Brahmanas by private individuals, at their request, and by kings at the request of others can all be found in inscriptions from Bengal. For instance, it is written in the Gupta year 113 copper plate inscription from Dhanaidaha (432 - 33 CE) that a royal officer (ayuktaka) purchased some land and gave it to a Brahman named Varahasvamin.",NA
Which one of the following made the life of the peasant most miserable in the post-Gupta period?,NA,C,On occasions the peasants were made to provide free labour.,The feudatories even appropriated the common lands of the villages.,There was a proliferation of intermediaries between the king and the peasants.,"The peasants paid various taxes like temple tax, and tax on goods produced besides land revenue.",NA,NA,NA,NA,"The most miserable factor for the life of peasants in the post-Gupta period was the proliferation of intermediaries between the king and the peasants. Let&#39;s explore why this was the case.<br/>1. Intermediaries and exploitation: The presence of numerous intermediaries between the king and the peasants created a system of exploitation. <br/>1. Intermediaries and exploitation: The presence of numerous intermediaries between the king and the peasants created a system of exploitation. The peasants were burdened with multiple taxes, leaving them with little income for their own sustenance.<br/>3. Lack of accountability: The presence of intermediaries created a lack of accountability in the system. The peasants had no direct access to the king or any higher authority to address their grievances. The intermediaries often abused their power, extorted additional money, and subjected the peasants to various forms of exploitation without any fear of repercussions.<br/>4. Appropriation of common lands: Feudatories, who were powerful individuals or local chieftains, took advantage of the absence of a strong central authority and appropriated the common lands of the villages.<br/>5. Forced labor: In some instances, the peasants were subjected to forced labor. They were made to work on various projects, such as building infrastructure or serving in the military, without any remuneration. This added to their hardships and deprived them of their freedom and autonomy.",NA
The practice of land grants originated in the,NA,D,Later Vedic period,Mauryan period,Kushan period,Satavahana period,NA,NA,NA,NA,"The Satavahanas were a dynasty that ruled in the Deccan region of India from around 230 BCE to 220 CE. They were known for their patronage of Brahmanas and Buddhist monks, and they started the practice of granting tax-free villages to them. This practice was a form of land grant, where villages were given to Brahmanas and Buddhist monks as a way to support them and ensure their spiritual and intellectual contributions to society. This benefitted the rulers by gaining their support and goodwill. The Satavahanas` patronage of these religious communities helped to strengthen their rule and promote the spread of Brahmanical and Buddhist ideals in the region.",NA
Which fact relating to the Agrarian system in post-Gupta period caused misery both to the king and the peasant?,NA,A,The right of collecting revenue became proprietory and hereditary lending to the feudatories disposing of both revenue and land.,A large number of sub-feudatories came into existence.,"Although the feudatories were supposed to get revenue from land for life, they gradually appropriated proprietory rights.",Neither the king nor the feudatories invested money in crafts or trade.,NA,NA,NA,NA,The right of collecting revenue became proprietory and hereditary lending to the feudatories disposing of both revenue and land.,NA
The most important motive behind the grant of land to priests and officials in lieu of salaries and renumeration was,NA,C,To punish the recalcitrant peasants.,To weaken the power of the big landlords.,To meet the deep social crisis that affected the ancient social order in the 3rd-4th centuries A.D.,To ensure the regular flow of land revenue.,NA,NA,NA,NA,"The grant of land to priests and officials in lieu of salaries and remuneration was primarily motivated by the need to meet the deep social crisis that affected the ancient social order in the 3rd-4th centuries A.D. It aimed to provide stability, maintain economic and social order, and ensure the loyalty of influential individuals in a time of crisis.",NA
Which one of the following rights associated with the land grants is true?,NA,B,The donees paid only a fixed share of the revenue to the donor and kept the rest.,The donees were given the rights to collect the revenue as well as the right to maintain law and order in the donated land.,The donees could only collect land revenue.,The donees were only given the right to maintain law and order in the donated villages and the revenue was collected by officials.,NA,NA,NA,NA,"Cultivator-owned fields termed Kautambakshetra, individually owned as Sakta, and tilled by individuals as Prakrsta or Krsta. Free gifts of land categorized as aprada, sasana, chaturvaiayagrama, brahmadeya, etc.<br/>-Land charters created a class of landed magnates with rights to collect taxes and maintain law and order. <br/>-Free peasants retained significant land possession, paying revenues directly to the state. <br/>-Peasants faced various impositions such as udranga, upanikara, hiranya, and forced labor. Granaries, village headman duties, and contributions to royal troops and officials were compulsory for villagers.",NA
"In the post-Gupta period when villages were granted in the tribal areas, the agriculturists were placed under the control of",NA,D,Village headman,The tribal chief,Royal officials,The religious beneficiaries,NA,NA,NA,NA,"In the post-Gupta period, when villages were granted in the tribal areas, the agriculturists were placed under the control of the religious beneficiaries. This was a significant development in the history of Indian society and had a profound impact on the social and economic life of the people.<br/>The religious beneficiaries were the Brahmins and Buddhists who were given land grants by the kings and nobles. These grants were made in recognition of the services they had rendered to the state in the fields of religion, education, and culture. The beneficiaries were expected to use the land for the betterment of society and to promote the welfare of the people.<br/>The control of the religious beneficiaries over the agriculturists in the post-Gupta period was a significant development in the history of Indian society. It helped to promote the values of piety, charity, and righteousness, and contributed to the development of a more enlightened and progressive society.",NA
Which point relating to the agrarian system in the post-Gupta era is not correct?,NA,A,The whole land was held by feudatories.,The relationship between the land owner and the village authorities varied.,"For making assessment easy, village were grouped into units of 10 in the Deccan kingdoms and into 12 or 16 or multiples thereof in the Northern region.",The powers and duties of the royal officers vis-a-vis the feudatories were clearly defined and observed.,NA,NA,NA,NA,"Feudalism in India is characterized by a social order where a possessing class appropriates surplus produce from peasants by asserting superior rights over land. Its political essence lies in organizing the administrative structure around land, while its economic structure is based on the institution of serfdom.<br/>Political Aspect: The entire administrative structure in Indian feudalism revolves around land ownership. Landed intermediaries play a crucial role as buffers between the king and the actual tillers, asserting control over land and labor. <br/>Economic Aspect: Indian feudalism relies on the institution of serfdom, where peasants are bound to the land and obligated to provide surplus produce to the possessing class. Peasants are not directly subjected to the king but are tied to the land through intermediaries who extract surplus produce and maintain control over the peasant population.",NA
Which one of the following ruling dynasties made the largest grant of villages to temples and Brahmanas? ,NA,A,Guptas,Palas,Rastrakutas,Pratiharas,NA,NA,NA,NA,"The Guptas gave the largest grant of villages to temples and Brahmins. The practice of donating land to Brahmins was common during the Gupta period, which was a time of great cultural and intellectual flourishing in India.  The three types of land grants in the Gupta period were:<br/>a) Brahmadeya: Land given to a group of Brahmins.<br/>b) Devadana: Land given to the gods.<br/>c) Agrahara: A settlement of priests.<br/>The land was typically used for farming or other agricultural purposes. The income generated from the land was used to support the Brahmins and their families. The taxes from the villages were assigned to the Brahmana donees, who were also given the right to get the donated land cultivated.",NA
Which one of the following statements about the agrarian economy during the post-Gupta period is incorrect?,NA,D,The actual cultivation was entrusted to peasants or sharecorppers who were attached to the land but did not possess it,The actual cultivation was entrusted to peasants or sharecorppers who were attached to the land but did not possess it.,The landed beneficiaries could not collect revenue by themselves.,The Sudras cultivated land mainly as slaves and agricultural labourers,NA,NA,NA,NA,"From the Gupta period onward, the Sudras - who were regarded as the common slaves of the three higher varnas - became peasants, which was directly related to the socio-economic element of the feudal model in India.<br/>Sudra labourers appear to have been given land in the more established districts. By land concessions, a sizable portion of the tribal peasantry in the backward regions was integrated into the Brahmanical system and given the name Sudras.<br/>As a result, Hiuen Tsang characterises the Sudras as farmers, and around four centuries later, al-Beruni confirmed this.",NA
Which one of the following causes mentioned below regarding the rise of feudalism in the post-Gupta period is not correct?,NA,A,The legal authorities were not aware of this problem.,In the 3rd and 4th centuries A.D. the Puranas complained of varnas disregarding their functions.,To get over the aforesaid situation kings chose intermediaries including Brahamanas.,None of the above.,NA,NA,NA,NA,"Decline of Mauryan Empire in 2nd century BCE created a power vacuum and led to emergence of regional kingdoms.<br/> -Kingdoms competed with each other for territory and resources, developing semi-independent vassal states and subservient landlords.<br/> -Kings granted land to military generals and officials as a reward for services. These lands came with rights over peasant produce and labor.<br/> -Over time, large territorial control passed into hands of landlords rather than with kings. Peasants owed economic allegiance to landlords.<br/> -Land grants could be inherited, creating an aristocratic land-owning class. Landlords raised private armies and administered justice.<br/> -Gupta period witnessed flowering of feudal relations with vassal kingdoms pledging loyalty and tributes to imperial overlords.<br/> -Manorialism emerged with self-sufficient rural manors controlled by landlords who were accountable to kings.<br/> -Caste system legitimized social inequalities with priests and warriors having higher status than peasants and artisans.<br/> -Feudalism facilitated decentralized rule but reduced king&#39;s power over entire dominion. It structured much of rural Indian society till colonial period.",NA
Which one of the following statements about the land grants made by the Palas and Pratiharas is not true?,NA,C,The royal successors are asked to maintain the terms and conditions of the grant.,There is no evidence to suggest that the donor directed the donees not to harass the peasants of the donated villages.,The villagers could appeal to the king against the peasants of the donated villages.,The villagers were asked by the donors to pay all dues and carry out the donees.,NA,NA,NA,NA,"In the kingdoms of the Palas, the Pratiharas, and the Rashtrakutas, the number of such grants rapidly rose and their character essentially altered.<br/>During the time of the Palas and Pratiharas, land grants were made to various individuals or institutions. These grants were made by the kings or other powerful individuals, and they were given to individuals or institutions as a form of reward, compensation, or support. However, the land grants made by the Palas and Pratiharas came with certain terms and conditions that the recipients were expected to adhere to. These terms and conditions varied, but they typically included the following: <br/>1. Maintenance of Terms and Conditions: The royal successors were asked to maintain the terms and conditions of the grant. This meant that the recipients were expected to follow the rules and regulations set forth in the grant, including paying the dues and carrying out the duties associated with the land. <br/>2. Non-Harassment of Peasants: There is no evidence to suggest that the donor directed the donees not to harass the peasants of the donated villages. In fact, it was quite common for the peasants of the donated villages to face harassment from the recipients of the land grants. The recipients often tried to extract as much revenue as possible from the peasants, leading to their exploitation and suffering. <br/>3. Absence of Appeal to the King: The villagers could not appeal to the king against the peasants of the donated villages. The land grants were given to the recipients, and the villagers had no recourse to appeal or seek justice from the king if they were mistreated or oppressed by the recipients. <br/>Conclusion: In conclusion, the correct statement about the land grants made by the Palas and Pratiharas is that the villagers could not appeal to the king against the peasants of the donated villages. This lack of recourse for the villagers often resulted in their exploitation and suffering at the hands of the recipients of the land grants.",NA
Which one of the following statements about the land given as salary is not correct?,NA,B,The owner had a right to collect as much as a third or half of the produce.,The donee acquired complete rights over the land.,"In the early stages this grant was less frequent than the agrahara, but in later centuries it became usual.",It was not given for military services which was paid in terms of cash salaries.,NA,NA,NA,NA,"A distinct feature of Gupta administration was payment of grants in land instead of salaries. Only military personnel were given salaries in cash. Two kinds of grants were there, namely given to the Brahmans and it was tax free and second to the Secular officials either as salaries or rewards. These grants weakened the authority of the king.<br/>There were three varieties of land namely the waste land, crown land and the private land were there during this period. Land revenue and taxes were charged at various stages of the produce.",NA
