question_text,question_image,correct_answer,option_1_text,option_2_text,option_3_text,option_4_text,option_1_image,option_2_image,option_3_image,option_4_image,answer_explanation_text,answer_explanation_image
Which of the following Chinese pilgrims to India gives us some information about the first Gupta ruler?,NA,D,Fahien,Hiuen Tsang,Wang Hiuen Tse,I-tsing,NA,NA,NA,NA,"Yijing or I-tsing, was a Tang-era Chinese Buddhist monk famed as a traveler and translator. His account of his travels is an important source for the history of the medieval kingdoms along the sea route between China and India. He gave account of the first gupta ruler Srigupta.",NA
Which of the following Gupta inscriptions is said to contain the most decisive evidence in favour of the exclusive ownership of land by the state or the king?,NA,B,Bhitari Prasasti,Pahadpur Copper Plate,Junagadh Rock Inscriptions,Allahabad Prasasti,NA,NA,NA,NA,"Paharpur is in insignificant border hamlet about three miles West of Jamalgunj railway station, in Bogra district of Bangadesh on the main line of Bangladesh Eastern Railway.<br/>There are inscribed copper plate grants and stone inscriptions, which throw light on the history of the site. The earliest is Copper Plate, dated 159 of Gupta era (478 AD), of the Budha Gupta period, found from the monastery area. It records the purchase and grant of land by Brahman couple, for maintenance of Arhats and resting place at Vihara, presided over by Jaina teacher Gahanandin and his disciple, and disciple of disciples.",NA
Which of the following works tells us about the succession of Chandragupta I to the throne?,NA,A,Kaumudi Mahotsava,Mrichchakatika,Abhijnana Sakuntalam,Devichandraguptam,NA,NA,NA,NA,The correct option is A.<br/>Kaumudi Mahotsava tells us about the succession of Chandragupta I to the throne.,NA
Which of the following inscriptions belong to Samudragupta?<br/>I. Allahabad Pillar Inscription<br/>II. Mehrauli Pillar Inscription<br/>III. Nalanda Copper Plate<br/>IV. Gaya Copper Plate<br/>V Bhitari Pillar Inscription<br/>VI. Eran Pillar Inscription,NA,B,"I, II, III, IV","I, III, IV, V, VI","II, III, IV",All of the above,NA,NA,NA,NA,"The correct option is Option B. <br/>Samudragupta inscription. A later inscription, also known as the Prayag Prashasti, is attributed to the 4th century CE Gupta emperor Samudragupta, and follows immediately below the edicts of Ashoka. It is considered <q>the most important historical document of the classical Gupta age</q>.<br/>Two other records are attributed to Samudragupta&#39;s reign, but the genuineness of these records is disputed:<br/>Nalanda inscription, dated to the regnal year 5<br/>Gaya inscription, dated to the regnal year 9<br/>The Eran inscription of Samudragupta is of considerable historical and epigraphic interest.",NA
Arrange the following famous Ancient Indian astronomers and mathematicians in the chronological order:<br/>I. Aryabhatta<br/>II. Varahamihira<br/>III. Brahmagupta<br/>IV. Bhaskara,NA,A,"I, II, III, IV","II, III, I, IV","III, II, IV, I","I, IV, III, II",NA,NA,NA,NA,"Option A: I, II, III, IV is the correct answer.<br/>The correct chronological order of these famous Ancient Indian astronomers and mathematicians is I. Aryabhatta, II. Varahamihira, III. Brahmagupta, IV. Bhaskara.<br/><br/>Explanantion:<br/><b>Aryabhatta:</b> Aryabhatta was an ancient Indian mathematician and astronomer who lived during the 5th century. He is known for his work on mathematics, including the concept of zero and the decimal system.<br/><b>Varahamihira:</b> Varahamihira was an Indian astronomer and mathematician who lived during the 6th century. He made significant contributions to the field of astronomy, including the calculation of planetary positions and the prediction of eclipses.<br/><b>Brahmagupta:</b> Brahmagupta was an Indian mathematician and astronomer who lived during the 7th century. He is known for his work on mathematics, including the development of algebra and the study of quadratic equations.<br/><b>Bhaskara:</b> Bhaskara was an Indian mathematician and astronomer who lived during the 12th century. He made significant contributions to both mathematics and astronomy, including the development of trigonometry and the study of planetary motion.",NA
St. Thomas came to North Western India to propagate Christianity during the reign of which ruler?,NA,A,Gondopherner,Kanishka,Rudraman-I,Khadphises,NA,NA,NA,NA,"The correct option is A.<br/>St. Thomas came to India in the reign of Parthians.Gondophernes, also spelled Gondophares, (flourished 1st century ce), an Indo-Parthian king in the areas of Arachosia, Kabul, and Gandhara (present Afghanistan and Pakistan).",NA
A special feature of religion in the Gupta Age was the,NA,A,Worship of incarnations of Vishnu,Worhsip of the seated Buddha,Worship of incarnations of Siva,None of these,NA,NA,NA,NA,"An important feature of Vaishnavism in the Gupta Age was the popular worship of the avatars, i.e. descents or incarnations of Vishnu. Epigraphic and literary records of the period throw light on the evolution of the theory of avatara, the germ of which is, however, to be traced in the later Vedic literature.",NA
Which political event has no bearing on the growth of trade in the pre-gupta period?,NA,B,The occupation of North-Western India by non-Indian people.,Internecine warfare amongst the Indian kingdoms.,The construction of roads and a uniform system of administration by the Mauryas.,The establishment of Indian kingdoms in south-east Asia.,NA,NA,NA,NA,"B is the correct option. Unlike the age old and pre-Gupta gahapatis, Internecine wars amongst the Cholas, Pandyas and the Cheras, on between the 8th and 15th century which had no bearing, as such, before.",NA
Which of the following facts regarding India at the beginning of christian era is of great significance in the context of India&#39;s mercantile activity?,NA,D,"Tigers, snakes, tortoises, a monk and an armless capable of shooting arrows with his legs, are presented to the Roman emperor around 21 B.C.",Discovery of the monsoon winds,A large number of Roman coins have been found at Muziris in Kerala and at Arikamedu.,Pliny complained against the drain of wealth from the Roman empire.,NA,NA,NA,NA,The correct option is D.<br/>The lamentation of the Roman writer Pliny in the 1st century A.D. refers to heavy drain of Gold from Roman into India in payment of her imports from India. He writes that the drain of Gold is in return for unproductive luxuries.,NA
What was the most important factor which gave a fillip to trade and commerce in the pre-Gupta period?,NA,A,The need of the Roman empire.,The coming of banking system led to the emergence of financiers orsreshthins.,Introduction of superior coins.,Establishment of guild system.,NA,NA,NA,NA,"Factors that gave a fillip to trade and commerce in the pre-Gupta period:<br/>1. The need of the Roman empire:<br/>- The Roman empire had a high demand for Indian goods such as textiles, spices, precious stones, and metals.<br/>- This created a significant opportunity for trade and commerce as Indian merchants were able to cater to the needs of the Roman empire.<br/>2. The coming of banking system led to the emergence of financiers or sreshthins:<br/>- The emergence of a banking system facilitated the growth of trade and commerce.<br/>- Financiers, known as sreshthins, played a crucial role in financing trade transactions and providing credit to merchants.<br/>- They also acted as intermediaries between buyers and sellers, further promoting trade.<br/>3. Introduction of superior coins:<br/>- The introduction of superior coins, such as gold coins, by the Gupta rulers boosted trade and commerce.<br/>- These coins were widely accepted and facilitated smooth transactions, leading to increased trade activities.<br/>4. Establishment of guild system:<br/>- The establishment of guilds provided a structured framework for trade and commerce.<br/>- Guilds ensured fair practices, regulated prices, resolved disputes, and provided a platform for merchants to collaborate and protect their interests.<br/>- This system promoted trust and encouraged merchants to engage in trade more actively.<br/><br/>In conclusion, while all the factors mentioned above played a significant role in promoting trade and commerce in the pre-Gupta period, the need of the Roman empire stands out as the most important factor. The demand from the Roman empire created a thriving trade network and opened up opportunities for Indian merchants to expand their businesses.",NA
"What was the name of the man who discovered about 45 A.D. <q>the existence of the monsoon winds, blowing regularly across the Indian Ocean</q>?",NA,C,Seleucus,Strabo,Hippalus,Scylax,NA,NA,NA,NA,"A review is presented of the surviving primary evidence of Hippalus as the discoverer of the trade route that allowed sailing vessels to run before the wind from the mouth of the Arabian Sea to the southern ports of India during the summer, and return with the winter monsoon during the 1st century CE.",NA
The Sakas and Kushanas used two trade routes from north-western frontier to the western seacoast of India. Which of the following trading stations of these route was the most important?,NA,D,Ujjain,Mathura,Kausambi,Taxila,NA,NA,NA,NA,The correct option is D.<br/>The Sakas and Kushanas used two trade routes from north-western frontier to the western seacoast of India that was Taxila.,NA
Which statements on trade and commerce in the pre-Gupta period is not correct?,NA,A,The trade with south-east Asia was vigorously pursued by all the coastal areas of India.,The trade with south-east Asia was occasioned by the demand of Rome of more and more of spices.,"While the impact of Greeco-Roman ideas was more evident in the North, the South witnessed the impact of Roman trade.",Trade grew further when Indian traders settled in south-east Asia.,NA,NA,NA,NA,"The correct answer is A. The statement <q>The trade with south-east Asia was vigorously pursued by all the coastal areas of India</q> is not correct. It is important to note that the trade with southeast Asia was not vigorously pursued by all the coastal areas of India during the pre-Gupta period. <br/>The other statements are correct:<br/>- B: The trade with southeast Asia was indeed occasioned by the demand of Rome for more and more spices. The Romans had a high demand for spices, which led to increased trade with southeast Asia.<br/>- C: While the impact of Greeco-Roman ideas was more evident in the North, the South witnessed the impact of Roman trade. This statement is accurate, as the South of India experienced the influence of Roman trade.<br/>- D: Trade grew further when Indian traders settled in southeast Asia. This statement is correct, as Indian traders played a significant role in establishing trade networks and settlements in southeast Asia, leading to further growth in trade.<br/>In conclusion, the correct answer is A: The trade with southeast Asia was not vigorously pursued by all the coastal areas of India.",NA
"The book, the Periplus of the Erythrean Sea, mainly deals with the",NA,C,The ruling dynasties of south India.,Political history of Roman empire.,Indian exports to the Roman world.,Social life of south India.,NA,NA,NA,NA,"The Periplus of the Erythrean Sea is an ancient Greek manuscript that provides a detailed account of the maritime trade routes and commercial activities in the Indian Ocean during the 1st century CE. It was written by an anonymous author, commonly referred to as the <q>Periplus writer</q>. The book covers a wide range of topics related to trade, geography, and culture.<br/><br/>Main focus of the Periplus of the Erythrean Sea:<br/>The main focus of the Periplus of the Erythrean Sea is on the Indian exports to the Roman world. It provides valuable information about the trade networks, commodities, and trading ports along the coast of the Indian Ocean. The book describes the various goods and products that were exported from different regions of India to the Roman Empire, including spices, pearls, textiles, precious stones, and exotic animals.<br/>The Periplus of the Erythrean Sea primarily focuses on the Indian exports to the Roman world. It provides a comprehensive account of the trade routes, commodities, and trading ports along the coast of the Indian Ocean during the 1st century CE. However, it also covers various other topics related to geography, navigation, and local customs, making it a valuable source of information about the ancient maritime trade.",NA
The most significant Roman export to India in the early centuries of the christian era was a larger number of,NA,A,Gold coins,Silver coins,Horses,Red Wares,NA,NA,NA,NA,"The most significant Roman export to India in the early centuries of the Christian era was a larger number of:<br/>Gold coins: The Roman Empire was known for its abundant gold reserves and minted gold coins, which were highly valued in trade.<br/>Silver coins: The Romans also exported a considerable number of silver coins, which were widely accepted as a form of currency in India.<br/>Horses: The Romans traded horses with India, as they had well-bred and strong horses that were in demand in various parts of the world.<br/>Red wares: The Romans were renowned for their pottery, including red wares, which were exported to India and appreciated for their quality and craftsmanship.<br/><br/>Explanation:<br/>During the early centuries of the Christian era, the Roman Empire had extensive trade connections with India. The Romans exported a variety of goods to India, but the most significant export was a larger number of gold coins. These coins were highly valued in trade transactions and played a crucial role in facilitating economic exchanges between the Roman Empire and India. The Romans also exported silver coins, which were widely accepted as a form of currency in India. Additionally, the Romans traded horses with India, as they had well-bred and strong horses that were in demand. Furthermore, the Romans exported their renowned pottery, including red wares, to India, which were appreciated for their quality and craftsmanship.",NA
Which of the following Indian spices was in great demand in the Roman world?,NA,B,Cinnamon,Pepper,Tomato,Cardamom,NA,NA,NA,NA,"The trade in spices lessened after the fall of the Roman Empire, but demand for black pepper, cloves, cinnamon and nutmeg revived the trade in later centuries.<br/>The correct answer is <q>Pepper</q>.",NA
Trade and commerce witnessed a remarkable growth during the period 200 B.C. - 200 A.D.<br/>Which of the following works throws light on this aspect?,NA,D,Mahavamsa,The Arathsastra,Divyavadana,Milanda Panha,NA,NA,NA,NA,"The Milinda Panha is a Buddhist text which dates from sometime between 100 BCE and 200 CE. It purports to record a dialogue between the Buddhist sage Nagasena, and the Indo-Greek king Menander I of Bactria, who reigned in the 2nd century BCE.",NA
Which of the following item was exported to the Abyssinian ports and enjoyed great prestige in western Asia during the post-Mauryan period?,NA,A,Iron and Steel,Gold,Copper,Silver,NA,NA,NA,NA,"Answer:<br/>The item that was exported to the Abyssinian ports and enjoyed great prestige in western Asia during the post-Mauryan period was Iron and Steel.<br/>Here is a detailed explanation:<br/><br/>1. Background:<br/>- The post-Mauryan period refers to the time after the Mauryan Empire, which existed from 322 BCE to 185 BCE in ancient India.<br/>- During this period, trade and commerce flourished, and various goods were exported to different regions.<br/><br/>2. Abyssinian Ports:<br/>- Abyssinian ports were located in the region known as Abyssinia, which is present-day Ethiopia.<br/>- These ports were crucial for trade between India and western Asia.<br/><br/>3. Iron and Steel:<br/>- Iron and steel were highly valued commodities during the post-Mauryan period.<br/>- India had advanced techniques for iron and steel production, and its exports were in high demand in western Asia.<br/>- Iron and steel were used for various purposes, including weapons, tools, and construction materials.<br/><br/>4. Prestige in Western Asia:<br/>- The high quality and craftsmanship of Indian iron and steel products gained them great prestige in western Asia.<br/>- Indian steel was known for its strength and durability, making it highly sought after in the region.<br/>- The reputation of Indian iron and steel contributed to the growth of trade between India and western Asia.<br/><br/>Conclusion:<br/>During the post-Mauryan period, iron and steel were exported to Abyssinian ports and enjoyed great prestige in western Asia. The superior quality and craftsmanship of Indian iron and steel products made them highly valued commodities in the region.",NA
Which one amongst the following has nothing to do with India&#39;s trade and commercial contacts with the rest of the world?,NA,D,Ptolemy&#39;s geography,Pliny&#39;s natural history,Strabo&#39;s geography,Zoroasterv&#39;s end Avesta,NA,NA,NA,NA,The correct answer is D as Zoroasterv&#39;s end Avesta. has nothing to do with India&#39;s trade and commercial contacts with the rest of the world.,NA
Which statement on southern trade and commerce in the pre-Gupta period is not correct?,NA,D,The most profitable trade was with the Romans.,"A number of harbours, dock, lighthouses and custom houses came into existence.","According to Pliny, the largest Indian ship was of 75 tons.",No southern dynasty except the Pandyas had any share in carrying out the trade.,NA,NA,NA,NA,"The Incorrect Statementwill be <b>D</b>: <q>No southern dynasty except the Pandyas had any share in carrying out the trade.</q><br/><br/>EXPLANATION:<br/>The correct statement is that no southern dynasty except the Cholas had any share in carrying out the trade during the pre-Gupta period. The Pandyas were also involved in trade, but they were not the only southern dynasty involved.<br/>Here is a breakdown of each statement and its accuracy:<br/>- Statement A is correct. Trade with the Romans was indeed highly profitable during the pre-Gupta period.<br/>- Statement B is correct. The development of these infrastructures facilitated trade and commerce in the southern regions.<br/>- Statement C is correct. Pliny, a Roman author, recorded that the largest Indian ship during that period was around 75 tons.<br/>- Statement D is incorrect. The Cholas were also actively involved in trade during the pre-Gupta period, along with the Pandyas.<br/>Therefore, the correct answer is statement D.",NA
Which statement proves that India gained from the trade with the West during the pre-Gupta period?,NA,B,Most of the coins found at Arikamedu are of Augustus and Tiberius,Pliny complained that Indian trade was a serious drain of wealth of the Roman empire.,The early Tamil literature refers to a statement of the Yavanas at Kaveripattinam.,The excavations at Arikamedu had revealed a Roman settlement along the port.,NA,NA,NA,NA,"Answer Statement B: Pliny complained that Indian trade was a serious drain of wealth of the Roman empire.<br/>This statement proves that India gained from the trade with the West during the pre-Gupta period because:<br/>1. Pliny&#39;s complaint:<br/>- Pliny, a Roman author and natural philosopher, complained that Indian trade was draining the wealth of the Roman empire. This indicates that India was able to export valuable goods and commodities to the West, resulting in significant economic gains.<br/>2. Indian exports:<br/>- The complaint implies that India had valuable products that were in high demand in the West. This suggests that India had a thriving trade industry and was able to export goods that were profitable.<br/>3. Economic prosperity:<br/>- The fact that Pliny considered Indian trade as a drain on Roman wealth indicates that India was economically prosperous during the pre-Gupta period. This suggests that India gained wealth, power, and influence through its trade with the West.<br/>4. Long-distance trade:<br/>- Pliny&#39;s complaint also highlights the existence of long-distance trade routes between India and the West. The trade routes facilitated the exchange of goods, ideas, and cultural influences, further contributing to India&#39;s economic and cultural growth.<br/>In conclusion, Pliny&#39;s complaint about the drain of wealth from the Roman empire due to Indian trade provides evidence that India gained from its trade with the West during the pre-Gupta period. India's ability to export valuable goods, its economic prosperity, and the existence of long-distance trade routes all support this statement.",NA
Which one of the following regarding the crafts of this age is not true?,NA,D,"Varanasi, Ujjain, and Mathura were the biggest textile weaving centres and Gandhara was famous for woollens.","Crafts-guilds were known as shrenis. Craftmanship, particularly in weaving, metal working and jewellery, achieved a high level of perfection.?","There were special royal workshops for metal processing, metal craftsmen also had their own undertaking.",The state exercised absolutely no control over the activities of the guilds.,NA,NA,NA,NA,The correct answer is D as all the statements except option D are true regarding the craft of this age.,NA
Which one of the following was the first to establish trade/contacts with the Roman empire?,NA,A,Tamil kingdom,Western Saka,Kushans,Vakatakas,NA,NA,NA,NA,The first to establish trade/contacts with the Roman empire was Tamil kingdom.,NA
Which of the following is incorrect?,NA,D,The wholesale prices of articles were fixed by the superintendent of commerce.,During the pre-Gupta a trader was required to get a licence.,During the pre-Gupta period a foreign trader had to get a passport.,Strikes of workers to raise wages were allowed.,NA,NA,NA,NA,"Incorrect Statement: D. Strikes of workers to raise wages were allowed.<br/>Explanation:<br/>During the pre-Gupta period in ancient India, certain regulations and practices were implemented regarding trade and labor. Let&#39;s analyze each statement to identify the incorrect one:<br/><u>Statement A is correct.</u> During the pre-Gupta period, the superintendent of commerce had the authority to regulate and fix the wholesale prices of articles.<br/><u>Statement B is correct.</u> Traders during the pre-Gupta period were obligated to obtain a license to engage in commercial activities.<br/><u>Statement C is correct.</u> Foreign traders were required to obtain a passport or a permit to conduct trade activities in ancient India during the pre-Gupta period.<br/><u>Statement D is incorrect.</u> Strikes of workers to demand higher wages were not permitted during the pre-Gupta period. The laborers had limited bargaining power, and their wages were often fixed by the authorities.<br/>Therefore, option D is the incorrect statement.<br/><br/>Note: It is important to remember that historical contexts and practices can vary, and the information provided here specifically pertains to the pre-Gupta period in ancient India.",NA
During the Gupta period India did not traded with,NA,C,Sri Lanka,China,Greece,South east Asia,NA,NA,NA,NA,"During the Gupta period, India did not trade with Greece.<br/>During the Gupta period, which lasted from around 320 to 550 CE, India had extensive trade networks with various regions across the world. However, Greece was not one of the regions with which India traded. Here are some key points to explain in detail:<br/>1. Trade during the Gupta period:<br/>- The Gupta Empire was known for its prosperous economy and flourishing trade relations with different regions.<br/>- India had established trade links with several countries, including Sri Lanka, China, and Southeast Asia.<br/><br/>2. Trade with Sri Lanka:<br/>- India had a long history of trade with Sri Lanka during the Gupta period.<br/>- The trade between the two countries primarily involved the exchange of spices, pearls, textiles, and precious metals.<br/><br/>3. Trade with China:<br/>- India and China had significant trade connections during the Gupta period.<br/>- The trade between the two countries involved the exchange of silk, tea, spices, and other luxury goods.<br/><br/>4. Trade with Southeast Asia:<br/>- India had extensive trade links with various countries in Southeast Asia, such as Myanmar, Cambodia, and Indonesia.<br/>- The trade between India and Southeast Asia included the exchange of goods like spices, textiles, precious stones, and metals.<br/><br/>5. Lack of trade with Greece:<br/>- Although India had trade relations with many regions, Greece was not one of them during the Gupta period.<br/>- The distance between India and Greece, along with geopolitical factors, might have limited their trade interactions.<br/>In conclusion, while India had flourishing trade connections with Sri Lanka, China, and Southeast Asia during the Gupta period, there was no significant trade relationship with Greece.",NA
