question_text,question_image,correct_answer,option_1_text,option_2_text,option_3_text,option_4_text,option_1_image,option_2_image,option_3_image,option_4_image,answer_explanation_text,answer_explanation_image
Consider the following statements about the followers of Buddha. <br/>1. The Sangha was a body of disciples of Buddha to which women were never allowed as members. <br/>2. Chaityas were the shrines regarded as sacred by the Bhikkus where the prayers were made. <br/><br/>Which of the above is/are correct?,NA,B,1 only,2 only,Both,None,NA,NA,NA,NA,"Justification: <br/>Initially, only men were allowed into the Sangha, but later women were also admitted. According to Buddhist texts, this was made possible through the mediation of Ananda, one of Buddha&#39;s dearest disciples, who persuaded him to allow women into the Sangha. <br/>Buddha&#39;s foster mother, Mahapajapati Gotami, was the first woman to be ordained as a bhikkhuni.",NA
Mahayana refers to one of three routes to enlightenment. The other two routes are,NA,A,Hinayana and Vajrayana,Upayana and Vajrayana,Hinayana and Upayana,Azhaliism and Upayana,NA,NA,NA,NA,"Vajrayana subscribes to Buddhist tantric literature. <br/>Vajrayana can also be seen as the third of the three turnings of the wheel of dharma. <br/>In the first turning, Shakyamuni Buddha taught the Four Noble Truths at Varanasi. <br/>The Mahayana tradition claims a second turning in which the Perfection of Wisdom sutras was taught at Vulture Peak, which led to the Mahayana schools. <br/>According to the Vajrayana tradition, there was a third turning which took place. Dhanyakataka 16 years after the Buddha&#39;s enlightenment. <br/>However, some scholars assert that the first tantric (Vajrayana Buddhist) texts appeared only in the third century CE, and they continued to appear until the 12th century. <br/>In the Vajrayana, the practitioner takes his or her innate Buddha-nature as the means of practise towards enlightenment. The premise is that since we innately have an enlightened mind, practising seeing the world in terms of ultimate truth can help us to attain our full Buddha-nature.",NA
Which of the following pairs are correctly matched? <br/>1. Dhyana Mudra: supreme enlightenment <br/>2. Vitarka Mudra: fearlessness <br/>3. Dharmachakra Mudra: Turning the Wheel of the Dharma <br/><br/>Select the correct answer code:,NA,C,"1, 3","2, 3",3 only,"1, 2, 3",NA,NA,NA,NA,"Abhaya Mudra: It indicates fearlessness. <br/>Dharmachakra Mudra: It means <q>Turning the Wheel of the Dharma or Law</q>, i.e., setting into motion the wheel of Dharma. <br/>Uttarabodhi Mudra: It means supreme enlightenment. <br/>Dhyana Mudra: Indicates Meditation and is also called Samadhi or Yoga Mudra. <br/>Vitarka Mudra: It indicates teaching and discussion or intellectual debate",NA
"Consider the following statements: <br/>i)The Buddha gave his first sermon, the Dharma-chakra-pravartana, at Deer Park in Sarnath. <br/>ii)Buddhism recognizes the existence of the soul (atman) similar to Jainism. <br/>iii)The Three Jewels of Buddhism include Buddha, Dhamma, and Sangha. <br/><br/>How many of the statements given above are correct?",NA,B,Only one,Only two,All three,None,NA,NA,NA,NA,"Statement 1 is correct. The Buddha&#39;s first sermon after attaining enlightenment was indeed given at Deer Park in Sarnath and is known as the Dharma-chakra-pravartana or <q>Turning the Wheel of Law</q>. <br/>Statement 2 is incorrect. Buddhism, unlike Jainism, rejects the authenticity of the Vedas and the concept of the existence of the soul (atman). <br/>Statement 3 is correct. The Three Jewels of Buddhism, also known as Triratna, include Buddha (the enlightened one), Dhamma (the teachings of Buddha), and Sangha (the monastic order).",NA
Consider the following statements about the Noble Eightfold Path in Buddhism: <br/>Right Livelihood involves engaging in occupations that harm other beings. <br/>Right Effort is about cultivating positive states of mind and abandoning negative ones. <br/>Right Mindfulness involves a correct understanding of the nature of reality. <br/><br/>Which of the statements given above is/are correct?,NA,B,Only 1,Only 2,2 and 3,1 and 3,NA,NA,NA,NA,"Statement 1 is incorrect. Right Livelihood actually involves choosing occupations that do not harm other beings and are ethically positive. <br/>Statement 2 is correct. Right Effort in Buddhism is about making an active effort to cultivate beneficial qualities while preventing and eliminating harmful qualities. <br/>Statement 3 is incorrect as described. Right Mindfulness refers to being fully present and aware of our actions, thoughts, and feelings without distraction or judgment, while Right Understanding (or Right View) involves a correct understanding of the nature of reality, including the Four Noble Truths.",NA
Consider the following statements about the Bodhisattvas in Mahayana Buddhism: <br/>Avalokitesvara is known for embodying the compassion of all Buddhas and is depicted as a female in some traditions. <br/>Manjusri represents the wisdom of Buddha and is always depicted with a book. <br/>Samantabhadra is primarily associated with the practice of strict asceticism. <br/><br/>Which of the statements given above is/are correct?,NA,A,1 and 2 only,2 and 3 only,"1, 2, and 3",1 and 3 only,NA,NA,NA,NA,"Statement 1 is correct. Avalokitesvara, known for embodying the compassion of all Buddha&#39;s, is depicted in various forms, including female forms in certain traditions. <br/>Statement 2 is correct. Manjusri represents the wisdom of Buddha and is commonly depicted with a sword in one hand for cutting through ignorance, and a book, representing the Prajnaparamita sutra. <br/>Statement 3 is incorrect. Samantabhadra is not primarily associated with strict asceticism; rather, he is known for his practice of meditation and vows, symbolizing universal benevolence and meditation.",NA
"Consider the following statements about the Buddhist councils: <br/>The Fourth Buddhist Council was held under the patronage of King Kanishka, where Buddhism split into Hinayana and Mahayana sects. <br/>The First Buddhist Council compiled the Buddha's teachings into the Sutta Pitaka and Vinaya Pitaka. <br/>The Third Buddhist Council was convened by Emperor Ashoka to purify the Buddhist movement from schismatic tendencies. <br/>Which of the statements given above is/are correct?",NA,D,1 and 2,Only 2,2 and 3,All of the above,NA,NA,NA,NA,"Statement 1 is correct. The Fourth Buddhist Council is traditionally held under the patronage of King Kanishka, and it is associated with the formal split of Buddhism into the Hinayana and Mahayana sects. <br/>Statement 2 is correct. The First Buddhist Council was convened shortly after the Buddha&#39;s death, where his teachings were compiled into the Sutta Pitaka (the basket of discourses) and the Vinaya Pitaka (the basket of monastic discipline). <br/>Statement 3 is correct. The Third Buddhist Council was convened by Emperor Ashoka with the goal of purifying the sangha (monastic community) of schismatic and heretical views, reinforcing the orthodox teachings of Buddhism.",NA
"Assertion (A): The Middle Path in Buddhism rejects all forms of sensual pleasure. <br/>Reason (R): The Middle Path advocates for a balanced approach between severe asceticism and indulgence in sensual pleasures. <br/>Is the reason for the assertion correct, and is it the correct explanation?",NA,C,"Both A and R are true, and R is the correct explanation of A.","Both A and R are true, but R is not the correct explanation of A","A is false, but R is true.","A is true, but R is false.",NA,NA,NA,NA,"The assertion is false because the Middle Path does not outright reject all forms of sensual pleasure. Instead, it seeks a balance, avoiding both extreme denial and excessive indulgence. The reason is true as it correctly describes the Middle Path's balanced approach to spiritual practice.",NA
Consider the following statements about Navayana Buddhism: <br/>Navayana Buddhism was propounded by Dr. B.R. Ambedkar as a means to address social inequalities and castism in Hindu society. <br/>Navayana rejects traditional Buddhist practices such as meditation and enlightenment. <br/>Navayana Buddhism incorporates the worship of Hindu gods and goddesses. <br/>Which of the statements given above is/are correct?,NA,A,1 and 2,Only 1,"1, 2, and 3",1 and 3,NA,NA,NA,NA,"Statement 1 is correct. Dr. B.R. Ambedkar, a prominent Indian social reformer and leader, propounded Navayana Buddhism as a way to address and combat the social inequalities and castism prevalent in Hindu society. He aimed to reinterpret Buddhism to focus on social equality and justice. <br/>Statement 2 is correct. Navayana Buddhism discards traditional Buddhist concepts such as karma, rebirth, meditation, and the Four Noble Truths, focusing instead on a radical reinterpretation of Buddha&#39;s teachings as they pertain to social equality and the struggle against caste discrimination. <br/>Statement 3 is incorrect. Navayana Buddhism does not incorporate the worship of Hindu gods and goddesses. Instead, it is characterized by a rejection of Hindu social practices and deities, focusing on a rational, ethical, and egalitarian approach to social reform and spirituality.",NA
"Assertion (A): Mahayana Buddhism introduced the concept of the Bodhisattva, who seeks enlightenment for the sake of all sentient beings. <br/>Reason (R): Mahayana Buddhism emphasizes the altruistic goal of achieving Buddhahood for the benefit of others, distinguishing it from Theravada Buddhism&#39;s focus on individual enlightenment. <br/><br/>Is the reason for the assertion correct, and is it the correct explanation?",NA,A,"Both A and R are true, and R is the correct explanation of A.","Both A and R are true, but R is not the correct explanation of A.","A is true, but R is false.","A is false, but R is true",NA,NA,NA,NA,The assertion and reason are both correct and appropriately linked. Mahayana Buddhism indeed introduced the concept of the Bodhisattva as part of its broader emphasis on universal compassion and the altruistic goal of attaining enlightenment to help all beings. This stands in contrast to the more individualistic approach to enlightenment found in Theravada Buddhism.,NA
