question_text,question_image,correct_answer,option_1_text,option_2_text,option_3_text,option_4_text,option_1_image,option_2_image,option_3_image,option_4_image,answer_explanation_text,answer_explanation_image
"Consider the following statements about Jainism. <br/>1. Vardhamana, who came to be known as Mahavira, founded Jainism in the sixth century BC. <br/>2. According to Jain teachings, the cycle of birth and rebirth is shaped through karma. <br/>3. Jain scholars produced a wealth of literature in a variety of languages including Tamil.<br/><br/>Which of the above is/are correct?",NA,C,1 and 2 only,1 and 3 only,2 and 3 only ,All of the above,NA,NA,NA,NA,"The basic philosophy of Jains was already in existence in North India before the birth of Vardhamana, who came to be known as Mahavira, in the sixth century BC. <br/>Jain scholars produced a wealth of literature in a variety of languages - Prakrit, Sanskrit and Tamil. <br/>According to Jain teachings, the cycle of birth and rebirth is shaped through karma. Asceticism and penance are required to free oneself from the cycle of karma.",NA
This council held near Srinagar prepared an authoritative commentary on the Buddhist Tripitakas and gave the Mahayana doctrine a final shape. The council was convened by,NA,A,Kanishka,Samprati,Bindusara Amitraghata,Devvarman,NA,NA,NA,NA,"He convened this fourth Buddhist council that discussed issues relating to Buddhist doctrine and theology.<br/>Under the presidentship of Vasumitra, the fourth Buddhist council was held at the Kundalavana monastery near Srinagar in Kashmir. About 500 monks attended the council.<br/>Asvagosha was a great poet, philosopher and dramatist, and was particularly close to Kanishka. He became his religious advisor in his later years and composed Buddhacharita.<br/>Nagarjuna from South India was also in the court of Kanishka. He also patronized the famous physician of ancient India Charaka.",NA
"What was important about Shravasti in Buddhist history?<br/>1. It was ruled by Pasenadi, who was a disciple of Buddha.<br/>2. The famous Jetavana Vihara is situated here.<br/>3. It hosted the first sermon of Buddha.<br/><br/>Select the correct answer using the codes below.",NA,B,1 only,1 and 2 only,2 and 3 only,"1,2 and 3",NA,NA,NA,NA,"About 2500 years ago, it was one of India&#39;s six largest cities and served as the Kosala Kingdom&#39;s capital, and its king was called Pasenadi, who was a disciple of Buddha.<br/>Buddha spent the greater part of his monastic life in Shravasti.<br/>It was also a prominent trading centre at that time, and centre of religious activity by Buddha.<br/>According to Buddhism&#39;s history, Buddha first came to Shravasti at the urging of Sudatta, a rich merchant who met Buddha in Rajgir.<br/>Sudatta invited Buddha to Shravasti and began to look for a suitable place to build a vihara.",NA
"In the context of Buddhism, the term Bodhisattva can be used to refer to <br/>1. Gautama Buddha in his former lives <br/>2. Compassionate beings who accumulated merit through their efforts not to attain Nibbana but to help others <br/>3. Jataka storytellers who were appointed by the Sangha <br/>4. Bodhi masters who renounce their physical bodies for the benefit of sentient beings <br/><br/>Select the correct answer, using the codes below.",NA,A,1 and 2 only,"2, 3 and 4 only",1 and 4 only,"1, 2, 3 and 4",NA,NA,NA,NA,"Bodhisattva is the Sanskrit term for anyone who is motivated by great compassion, has generated Bodhicitta, which is a spontaneous wish, and a compassionate mind to attain Buddhahood for the benefit of all sentient beings.<br/>In early Indian Buddhism, Bodhisattva was primarily used to refer specifically to Gautama Buddha in his former life.<br/>The Jataka tales, which are the stories of Buddha&#39;s past lives, depict the various attempts of the Bodhisattva to embrace qualities like self-sacrifice and morality.<br/>According to the Jataka tales, the term <q>bodhisattva</q> originally referred to the pre enlightened practitioner of austerities.<br/>The worship of images of Buddha and Bodhisattvas became an important part of Mahayana tradition.",NA
"Consider the following regarding Faxian&#39;s account of India. <br/>1. During his visit, stupa veneration was not practised in India. <br/>2. He frequently mentions the name of Chandragupta-II in his works. <br/>3. As per him, Buddhism was established mainly in the Gangetic valley. <br/>4. He was looking for better copies of Buddhist books than were available in China at that time. <br/><br/>Select the correct answer using the codes below.",NA,B,2 and 3 only,4 only,3 only,"1, 2, 3 and 4",NA,NA,NA,NA,"Between 399 and 414 CE, the Chinese monk Faxian undertook a trip via Central Asia to India seeking better copies of Buddhist books than were currently available in China.<br/>Although Faxian&#39;s account is valuable in many respects, as far as the Gupta Empire is concerned, he did not mention Chandragupta-II&#39;s name. Faxian was not interested in political affairs, and his interest was primarily on religion.<br/>According to him, Buddhism was in a flourishing condition in northwestern India. In the Gangetic valley, it was in a state of neglect. He refers to the Gangetic valley as the <q>land of Brahmanism</q>. <br/>He indicates clearly the importance of the seven precious substances for Buddhist worship, the widespread practice of stupa veneration, and his acquaintance with several of the Jataka tales about the previous lives of Buddha Sakyamuni.",NA
Many Chinese Buddhist pilgrims visited the Indian subcontinent to visit places associated with Buddha&#39;s life. Who among the following is NOT one of them?,NA,D,Faxian,Xuanzang,I-Qing,Alan Chen,NA,NA,NA,NA,"Three such Chinese Buddhist pilgrims are best-known. <br/>Faxian, who came to the subcontinent about 1600 years ago, Xuanzang (who came around 1400 years ago) and I-Qing, who came about 50 years after Xuanzang, are the famous ones. <br/>They have documented previous socioeconomic, political and religious details of Indian life then.",NA
"Consider the following statements. <br/>1. Kanishka sent missionaries to Central Asia and China for the propagation of Mahayana Buddhism. <br/>2. Kanishka patronized Buddhist scholars like Vasumitra and patronized the famous physician of ancient India, Charaka. <br/><br/>Which of the above is/are correct?",NA,C,1 only,2 only,Both 1 and 2,None,NA,NA,NA,NA,"This is because Mahayana Buddhism came in vogue during Kanishka&#39;s rule. It was established in the Fourth Buddhist council convened by him where matters relating to Buddhist theology and doctrine were discussed. <br/>In Mahayana Buddhism, Buddha was worshipped with flowers, perfumes, garments and lamps. <br/>Asvagosha and Nagarjuna were other important scholars patronized by him.",NA
He was a staunch follower of Brahmanism. Buddhist sources often refer to him as a persecutor of Buddhism. He is?,NA,A,Pushyamitra,Menander,Somapura,Dharmaraksita,NA,NA,NA,NA,"He belonged to the Sunga dynasty. The Sungas defended the Gangetic valley from foreign invasions. <br/>In the cultural sphere, the Sungas revived Brahmanism and horse sacrifice. They also encouraged the growth of Vaishnavism and the Sanskrit language. <br/>Therefore we can say that <q>The Sunga rule was a brilliant anticipation of the golden age of the Guptas</q>.",NA
Who among the following is a pivotal figure in establishing Tibetan Buddhism and is often called the second Buddha?,NA,A,Padmasambhava,Lawapa,Shantarakshita,Nagarjuna,NA,NA,NA,NA,"The practice of tantric Buddhism was introduced to the people of Tibet by Padmasambhava, a founder of the Nyingma tradition, one of the oldest schools of the four major Tibetan Buddhism schools. <br/><br/>The tradition covers several distinct lineages that trace all their origins to Padmasambhava. He is regarded as the founder of Samye Gompa, the country&#39;s first monastery. <br/>Nyingma tradition was practised among a loose network of lay practitioners orally. Monasteries with celibate monks and nuns and the practice of the reincarnated spiritual leaders are later adoptions. Its lineage has been centred in Kham in eastern Tibet in modern times.",NA
"In Tibetan Buddhism, the word <q>Terma</q> means",NA,C,Bodhisattvas,Religious texts were written by monks and nuns,Various forms of hidden teachings,Life stories of Buddha,NA,NA,NA,NA,"These hidden teachings are key to Vajrayana or Tibetan Buddhist and Bon religious traditions. Termas are a part of tantric literature. <br/>The belief is that these teachings were originally esoterically hidden by various adepts such as Padmasambhava during the eighth century, for future discovery at auspicious times by other adepts. <br/>As such, Terma represents a tradition of continuous revelation in Vajrayana or Tibetan Buddhism. <br/>Termas are not always made public right away. The conditions may not. Be right; people may not yet be ready for them, and further instructions may need to be revealed to clarify their meaning.",NA
"Regarding Buddhist disciples, consider the following: <br/>1. Sariputta was a chief female disciple of Gautama Buddha. <br/>2. Khema, who joined the Buddhist Sangha, was one of the queens of king Bimbisara. <br/>3. Moggallana, a disciple of Buddha, was known for his psychic powers. <br/>4. King Ajatashatru of Magadha and king Prasenajit of Kosala became Buddha&#39;s disciples. <br/><br/>Select the correct answer using the codes below:",NA,C,1 and 2 only,3 and 4 only,"2, 3 and 4 only",1 and 3 only,NA,NA,NA,NA,"Sariputta was one of the two chief male disciples of Gautama Buddha and Moggallana, counterparts to the Bhikkhunis Khema and Uppalavanna, his two chief female disciples. They were to maintain the order of monks and nuns. <br/>The conversion of Khema was one of the rare cases where Buddha used his psychic powers to change another&#39s heart. <br/>Moggallana attained enlightenment shortly after joining the Sangha. As a teacher, he became known for his psychic powers, which he used extensively in his teaching methods. <br/>Those who accepted the doctrines of Buddha and became his disciples were the kings like Prasenajit of Kosala and Bimbisara and Ajatashatru of Magadha.",NA
"Vajrayana Buddhism <br/>1. includes various Buddhist traditions of Tantra <br/>2. developed parallelly with Mahayana Buddhism in India <br/>3. according to Vajrayana scriptures, it is the only vehicle to enlightenment among the three schools of Buddhism <br/><br/>Select the correct answer using the codes below.",NA,A,1 only,2 and 3 only,1 and 2 only,1 and 3 only,NA,NA,NA,NA,"Vajrayana, Mantrayana, Esoteric Buddhism and Tantric Buddhism refer to the various Buddhist traditions of Tantra and <q>Secret Mantra</q>, which are systems of beliefs and practices that developed in medieval India and spread to Tibet and East Asia under varying names and forms. <br/>It subscribes to the literature known as the Buddhist Tantras. It includes practices that use mantras, dharanis, mudras, mandalas, and the visualization of deities and Buddhas. <br/>According to its scriptures, Vajrayana refers to one of the three vehicles or routes to enlightenment, the other two being the Sravakayana (also known as the Hinayana) and Mahayana.",NA
"Which of the following Buddhist mudras signifies offering, welcome, charity, giving, compassion and sincerity?",NA,A,Varadamudra,Dharmachakra Mudra,Vitarka Mudra,Abhaya Mudra,NA,NA,NA,NA,"Justification: <br/>The Varadamudra generosity gesture signifies offering, welcome, charity, giving, compassion and sincerity. <br/>It is nearly always shown made with the left hand by a revered figure devoted to human salvation from greed, anger and delusion. <br/>It can be made with the arm crooked, and the palm offered slightly turned up or the arm facing down the palm presented with the fingers upright or slightly bent. <br/>The Varadamudra is rarely seen without another mudra used by the right hand, typically Abhaya mudra. It is often confused with vitarka mudra, which it closely resembles. <br/>In China and Japan during the Northern Wei and Asuka periods, respectively, the fingers are stiff and then gradually begin to loosen as it developed over time, eventually leading to the Tang dynasty standard where the fingers are naturally curved.",NA
"Which of the following Buddhist movements is characterized by a grandiose cosmology, often complex ritualism, paradoxical metaphysics and universal ethics?",NA,A,Mahayana,Hinayana,Theravada,Lamaism,NA,NA,NA,NA,"Mahayana (Sanskrit: Greater Vehicle) Movement arose within Indian Buddhism around the Common Era. By the ninth century, it became the dominant influence on the Buddhist cultures of Central and East Asia, which it remains today. <br/>It spread at one point also to Southeast Asia, including Myanmar (Burma) and Sri Lanka, but has not survived there. <br/>The movement is characterized by a grandiose cosmology, often complex ritualism, paradoxical metaphysics and universal ethics.",NA
Which of the following contains Buddha&#39;s sermons?,NA,B,Vinaya Pitaka,Sutta Pitaka,Abhidhamma Pitaka,All of the above,NA,NA,NA,NA,"Despite these vicissitudes, Buddhism did not abandon its basic principles. Instead, they were reinterpreted, rethought, and reformulated in a process that led to creating a great body of literature. <br/>This literature includes the Pali Tipitaka (Three Baskets)-the Sutta Pitaka (Basket of Discourse), which contains Buddha&#39;s sermons; the Vinaya Pitaka (Basket of Discipline), which contains the rule governing the monastic order; and the Abhidhamma Pitaka (Basket of Special [Further] Doctrine), which contains doctrinal systematization and summaries.",NA
"Consider the following statements: <br/>1. From the first sermon of Buddha at Samath to the most recent derivations, there is an indisputable continuity in Buddhist basic principles. <br/>2. Buddhist Tipitaka is written in the Pali language. <br/><br/>Which of the above statements is/are correct?",NA,C,1 only,2 only,Both 1 and 2,Neither 1 nor 2,NA,NA,NA,NA,"This literature includes the Pali Tipitaka (Three Baskets)-the Sutta Pitaka (Basket of Discourse), which contains Buddha&#39;s sermons; the Vinaya Pitaka (Basket of Discipline), which contains the rule governing the monastic order; and the Abhidhamma Pitaka (Basket of Doctrine), which contains doctrinal systematization and summaries. <br/>These Pali texts have served as the basis for a long and vibrant tradition of commentaries written and preserved by the Theravada community&#39;s adherents. <br/>The Mahayana and Vajrayana traditions have accepted Buddhavachana (the word of Buddha) many other Sutras and Tantras, along with extensive treatizes and commentaries based on these texts. <br/>Consequently, from the first sermon of Buddha at Samath to the most recent derivations, there is an indisputable continuity-a development or metamorphosis around a central nucleus-by virtue. Buddhism is differentiated from other religions.",NA
"The major form of Buddhism practised in Tibet, China, Korea and Japan is",NA,C,Theravada,Vajrayana,Mahayana,Hinayana,NA,NA,NA,NA,"Justification: <br/>The Mahayana tradition is the largest major Buddhism tradition existing today, with 53.2% practitioners, compared to 35.8% for Theravada and 5.7% for Vajrayana in 2010. <br/>Mahayana Buddhism spread from India to various South, East and Southeast Asian countries such as Bangladesh, Nepal, Bhutan, China, Taiwan, Mongolia, Korea, Japan, Vietnam, Indonesia, Malaysia and Singapore. <br/>Mahayana Buddhism also spread to other South and Southeast Asian countries, such as Afghanistan, Thailand, Cambodia, Laos, the Maldives, Pakistan, Sri Lanka, Burma, Iran and other Central Asian countries Theravada Buddhism or other religions.",NA
"Consider the following statements. <br/>1. Theravada Buddhism is strongest in Sri Lanka, Cambodia, Thailand, Laos and Myanmar. <br/>2. Theravada school of Buddhism believes that it has remained closest to the original teachings of Buddha. <br/><br/>Which of the above statements is/are correct?",NA,C,1 only,2 only,Both 1 and 2,Neither 1 nor 2,NA,NA,NA,NA,"Theravada Buddhism is strongest in Sri Lanka, Cambodia, Thailand, Laos and Burma (Myanmar). It is sometimes called Southern Buddhism. <br/>The name means the doctrine of the elders - the elders being the senior Buddhist monks. <br/>This school of Buddhism believes that it has remained closest to the original teachings of Buddha. However, it does not over-emphasize the status of these teachings in a fundamentalist way - these are seen as tools to help people understand the truth, not as having the merit of their own.",NA
"Why did Buddhism start declining in India in early medieval times? <br/>1. Vaishnavism, Shaivism and other Hindu traditions became increasingly popular, and Brahmins developed a new relationship with the state. <br/>2. The invading tribes from Central Asia till last Gupta king adopted Hinduism and persecuted Buddhists. <br/>3. The kings of the Gupta dynasty were strongly opposed to Buddhism. <br/>Which of the statements given above is/are correct?",NA,A,1 only,1 and 2 only,2 and 3 only,"1, 2 and 3",NA,NA,NA,NA,"With the Gupta dynasty (approximately fourth and sixth century), the growth in ritualistic Mahayana Buddhism, and Buddhist ideas into Hindu schools, Buddhism and Hinduism&#39;s differences blurred. <br/>Vaishnavism, Shaivism and other Hindu traditions became increasingly popular, and Brahmins developed a new relationship with the state. As the system grew, Buddhist monasteries gradually lost control of land revenue. <br/>In parallel, the Gupta kings built Buddhist temples such as the one at Kushinagar, and monastic universities such as those at Nalanda, as evidenced by records left by three Chinese visitors to India. <br/>According to Hazra, Buddhism declined because of the Brahmins&#39; rise and their influence in the socio-political process.",NA
The Vessantara Jataka is one of the most popular Apadanas of Theravada Buddhism. These Jatakas are carved on which of the following stupas?,NA,B,Kushinagar,Sanchi,Bodh Gaya,Anuradhapura,NA,NA,NA,NA,The Vessantara Jataka is carved on Sanchi Stupa.,NA
Which of the following can be attributed to Jainism and Buddhism&#39;s rise in the sixth century BC India? <br/>1. Rig Vedic practices became impractical and inexpensive for common people. <br/>2. Upanishads were not easily comprehensible. <br/>3. Rise in the economic status of trading communities. <br/><br/>Select the right code.,NA,C,2 only,1 and 3 only,2 and 3 only,None,NA,NA,NA,NA,"The common people did not accept the complex rituals and sacrifices advocated in the later Vedic period. The sacrificial ceremonies were too expensive. <br/>The people got confused with superstitious beliefs and mantras. <br/>By contrast, Rig Vedic practices were simple in the preceding period. <br/>The Upanishads were highly philosophical in nature and were not easily understood by all. <br/>Therefore, people wanted a simple, short and intelligible way to salvation. <br/>The language of religious teachings should also be known to them. The teachings of Buddha and Mahavira fulfilled this need. <br/>Certain privileges were enjoyed by higher classes, which were denied to the lower classes. The Kshatriyas had resented the domination of the priestly class. <br/>It should be noted that both Buddha and Mahavira belonged to Kshatriya origin. <br/>The economic conditions of the Vaishyas were improved due to trade growth. <br/>As a result, the common people wanted to enhance their social status, but the orthodox Varna system did not allow this. Therefore, they supported Buddhism and Jainism.",NA
Anicca&#39; in Buddhist philosophy refers to?,NA,B,The universe being soulless,The transience of the universe,The state of being without desire,The path of moderation between the severe extremes,NA,NA,NA,NA,"According to Buddhist philosophy, the world is transient (anicca) and constantly changing; it is also soulless (anatta), as there is nothing permanent or eternal. <br/>Within this transient world, sorrow (dukkha) is intrinsic to human existence. Human beings can rise above these worldly troubles by following the moderation path between severe penance and self-indulgence. <br/>In the earliest forms of Buddhism, whether or not God existed was irrelevant.",NA
The doctrine of Anatta in Buddhism means that <br/>1. There is no permanent and independent essence in a human being <br/>2. The sense of self as perceived by beings is illusory <br/><br/>Which of the above is/are correct?,NA,C,1 only,2 only,Both 1 and 2,Neither 1 nor 2,NA,NA,NA,NA,"Anatta, (Pali: non-self or substanceless) Sanskrit anatman, in Buddhism, the doctrine that there is in humans no permanent, underlying substance that can be called the soul. Instead, the individual is compounded of five factors (Pali khandha; Sanskrit skandha) that are constantly changing. <br/>Buddhism does not completely deny the existence of a personality in an empirical sense. Its non-existence, in a sense, is only attempted to be shown. <br/>The concept of anatta, or anatman, is a departure from the Hindu belief in atman (the self). The absence of a self, anicca (the impermanence of all being), and dukkha (suffering) are the three characteristics of all existence (ti-lakkhana). Recognition of these three doctrines - anatta, anicca, and dukkha - constitutes right understanding.",NA
Which of the following statements is/are correct? <br/>1. Yaksha worship was prevalent before the advent of Buddhism. <br/>2. It was later assimilated into Buddhism and Jainism. <br/>Select the correct answer using the codes below.,NA,C,Only 2,Only 1,Both 1 and 2,Neither 1 nor 2,NA,NA,NA,NA,"During the sixth century BCE, there was a beginning of new religious and social movements in the Gangetic valley in Buddhism and Jainism, parts of the Shramana tradition. <br/>Both religions became popular as they opposed the varna and jati systems of the Hindu religion. Magadha emerged as a powerful kingdom and consolidated its control over the other regions. <br/>By the fourth century BCE, the Mauryas established their power, and by the third century BCE, a large part of India was under Mauryan control. <br/>Ashoka emerged as the most powerful king of the Mauryan dynasty who patronized the Shramana tradition in the third century BCE. <br/>Religious practices had many dimensions and were not confined to just one particular mode of worship. Worship of Yakshas and mother-goddesses was prevalent during that time. So, multiple forms of worship existed. <br/>Nevertheless, Buddhism became the most popular social and religious movement. Yaksha worship was prevalent before and after Buddhism and was assimilated in Buddhism and Jainism.",NA
Consider the following statements about Buddha. <br/>1. The Stupa at Bodh Gaya was built to mark the place where Buddha first taught his message. <br/>2. Buddha taught that life is full of suffering and unhappiness. <br/><br/>Which of the above statement is/are correct?,NA,B,1 only,2 only,Both 1 and 2,None,NA,NA,NA,NA,The Stupa at Saranath was built to mark the place where Buddha first taught his message.,NA
"During the early phase of Buddhism, Buddha is depicted symbolically through footprints, stupas, lotus throne, chakra, etc. This was because the Mauryan rulers patronized ____________.",NA,A,Buddha had discouraged his representation in any human form,Buddhism was influenced by particular practices from Hinduism,These showed his Mahaparinirvana.,Construction of such symbols,NA,NA,NA,NA,"Buddha is depicted symbolically during the early phase of Buddhism through footprints, stupas, lotus throne, chakra, etc. <br/>This indicates either simple worship, or paying respect, or at times depicts historicization of life events. This was because Buddha said Digha Nikaya, i.e., discouraged his representation in human forms after his death. <br/>Gradually narrative became a part of the Buddhist tradition. Thus, events from Buddha&#39;s life, the Jataka tales, were depicted on the stupas&#39; railings and torans. <br/>Mainly synoptic narrative, continuous narrative and episodic narrative are used in the pictorial tradition. <br/>While Buddha&#39;s life became an important theme in all the Buddhist monuments, the Jataka stories also became equally important for sculptural decorations. <br/>The main events associated with Buddha&#39;s life which were frequently depicted were related to the birth, renunciation, enlightenment, dharmachakrapravartana and mahaparinibbana (death). <br/>Among the Jataka stories frequently depicted are Chhadanta Jataka, Vidurpundita Jataka, Ruru Jataka, Sibi Jataka, and Vessantara and Shama Jataka.",NA
"Bodhisattva images were added as a part of the personified representations of certain virtues or qualities, as propagated by the Buddhist religious principles for the welfare of the masses with the rise of",NA,B,Mahayana Buddhism,Vajrayana Buddhism,Gandhara School of art,Mathura school of art,NA,NA,NA,NA,"Along with Buddha&#39;s images, other Buddhist images of Bodhisattvas like Avalokiteshvara, Padmapani, Vajrapani, Amitabha, and Maitreya Buddha started getting sculpted. <br/>However, with Vajrayana Buddhism&#39;s rise, many Bodhisattva images were added as a part of the personified representations of certain virtues or qualities, as propagated by the Buddhist religious principles for the masses&#39; welfare.",NA
