question_text,question_image,correct_answer,option_1_text,option_2_text,option_3_text,option_4_text,option_1_image,option_2_image,option_3_image,option_4_image,answer_explanation_text,answer_explanation_image
"The cause of conflict between the Cheras, Cholas and Pandyas during the Sangam age was:",NA,A,The desire to control the fertile deltas.,The desire to control coastal region.,The need for a access to important trading and urban centres.,None of these,NA,NA,NA,NA,"Cause of Conflict between the Cheras, Cholas, and Pandyas during the Sangam Age:<br/><br/><u>Desire to Control the Fertile Deltas:</u> One of the main reasons for conflict between the Cheras, Cholas, and Pandyas was their desire to control the fertile deltas. These deltas were crucial for agriculture and provided a constant source of food and revenue. Each kingdom wanted to expand its territory to gain control over these fertile lands, leading to conflicts and battles.<br/><br/><u>Competition for Coastal Regions:</u> Another factor that fueled the conflict was the competition for control over coastal regions. The coastlines were important for trade, commerce, and naval power. All three kingdoms sought to dominate the coastal areas to enhance their economic and military strength, resulting in clashes between them.<br/><br/><u>Access to Trading and Urban Centers:</u> The need for access to important trading and urban centers also played a significant role in the conflicts. Cities and trading hubs were hubs of economic activity and cultural exchange. The Cheras, Cholas, and Pandyas vied for control over these centers to expand their influence and increase their wealth, leading to conflicts over territorial control.<br/><br/>Therefore, the cause of conflict between the Cheras, Cholas, and Pandyas during the Sangam Age can be attributed to their desire to control fertile deltas, coastal regions, and important trading and urban centers for economic, military, and strategic advantages.",NA
"The Pandya king of the Sangam age, who defeated the Chola and the Chera kings in the battle of Talaiyalanganam was",NA,B,Nediyon,Nedunjeliyan,Arivudai,Mudukudumip,NA,NA,NA,NA,"Identifying the Pandya king: The Pandya king of the Sangam age who defeated the Chola and the Chera kings in the battle of Talaiyalanganam was Nedunjeliyan.<br/><br/>Correct Answer: Option B - Nedunjeliyan<br/><br/>Therefore, the Pandya king of the Sangam age who defeated the Chola and the Chera kings in the battle of Talaiyalanganam was Nedunjeliyan.",NA
Which of the following Tamil works highlight the importance of Jaina philosophy?,NA,A,Jivak-Chintamani,Silappadikaram,Manimekalai,Pattupattu,NA,NA,NA,NA,"Explanation:<br/><br/><u>Jivak-Chintamani:</u> This Tamil work highlights the importance of Jaina philosophy through its content and themes. The text is known for its portrayal of Jain principles and teachings.<br/><u>Silappadikaram:</u> While Silappadikaram is a significant Tamil epic that explores various themes and moral values, it does not specifically focus on Jaina philosophy.<br/><u>Manimekalai:</u> Manimekalai is another Tamil work that does not primarily highlight Jaina philosophy. It revolves around Buddhist teachings and principles.<br/><u>Pattupattu:</u> Pattupattu is a collection of ten Tamil poetic works that primarily focus on love, nature, and other aspects of life, without emphasizing Jaina philosophy.<br/>Therefore, the correct answer is A: Jivak-Chintamani, as it is a Tamil work that specifically highlights the importance of Jaina philosophy in its content and themes.",NA
What was the important port of eastern coast in the Sangam age?,NA,A,Colchi,Tyndis,Muziris,Naura,NA,NA,NA,NA,"A is the correct option: Colchi.<br/>The Sangam period, or Sangam Age is the period of history of ancient Tamil Nadu and Kerala and parts of Sri Lanka (then known as Tamilakam) spanning from c. 6<sup>th</sup> century BCE to c. 3<sup>rd</sup> century CE.<br/>Erythraean Sea refers to Korkai as Colchis and Ptolemy, an Egyptian geographer calls it Kolkhai. Multiple classical works of the Sangam literature. ",NA
What was the important port on the western coast in the Sangam age?,NA,C,Poduca,Colchi,Balita,Sopatma,NA,NA,NA,NA,"Important Port on the Western Coast in the Sangam Age<br/><br/>Poduca: Poduca was not an important port on the western coast during the Sangam age.<br/>Colchi: Colchi was not a significant port in the Sangam age either.<br/>Balita: Balita was an important port on the western coast during the Sangam age. It served as a vital trading hub and facilitated trade with foreign countries.<br/>Sopatma: Sopatma was not a prominent port in the Sangam age.<br/>Therefore, the correct answer is Balita, as it was the significant port on the western coast during the Sangam age.",NA
On which of the following imports from India the Roman senate laid an embargo as it was a menace to the city&#39;s morals?,NA,D,Saffron,Wine,Pepper,Muslin,NA,NA,NA,NA,"Explanation:<br/><br/>Embargo on imports from India: The Roman senate laid an embargo on the import of Muslin from India as it was considered a menace to the city&#39;s morals.<br/>Reasoning behind the embargo: Muslin was a luxurious fabric that was highly sought after by the Roman elite. However, the sheer and delicate nature of Muslin was believed to be provocative and immoral.<br/>Impact on the city: The Roman senate believed that the availability of Muslin in the city would lead to moral decadence and corrupt the values of the citizens.<br/>Alternative imports: In order to maintain the moral integrity of the city, the Roman senate restricted the import of Muslin and looked for alternative fabrics that were deemed more appropriate for the society.",NA
"The existence of the monsoon winds, blowing across the Indian ocean was discovered by",NA,A,Hippalus in 45 A.D.,Plutarch in 78 A.D.,Strabo in 56 B.C.,Pliny in 58 A.D.,NA,NA,NA,NA,"Discovery of Monsoon Winds<br/><br/>Hippalus in 45 A.D.: Hippalus, a Greek navigator, is credited with the discovery of the monsoon winds in 45 A.D. He found a direct route from the Red Sea to India by making use of these seasonal winds.<br/><br/>Importance of Monsoon Winds: The discovery of the monsoon winds revolutionized trade and travel in the Indian Ocean region. It allowed for faster and more efficient maritime routes, leading to increased trade between regions.<br/><br/>Plutarch, Strabo, and Pliny: While Plutarch, Strabo, and Pliny were renowned scholars and geographers of their time, it was Hippalus who specifically identified and utilized the monsoon winds for navigation purposes.<br/>Therefore, the correct answer is A: Hippalus in 45 A.D.",NA
"Which of the following foreign authors say something about Sangam age?<br/>I. Pliny, the Elder<br/>II. Strabo<br/>III. Author of the Periplus of the Erythrean sea<br/>IV. Ptolemy",NA,D,"I, II, III","II, III","I, IV",All of the above,NA,NA,NA,NA,"<b>Foreign Authors and Sangam Age</b><br/><br/>Pliny, the Elder: Pliny, the Elder, was a Roman author who mentioned about the trade relations between the Roman Empire and the ancient Tamil country during the Sangam Age.<br/><br/>Strabo: Strabo, a Greek geographer, also wrote about the trade connections between the Roman Empire and the Tamil kingdoms during the Sangam Age.<br/><br/>Author of the Periplus of the Erythrean Sea: The anonymous author of the Periplus of the Erythrean Sea, an ancient Greek navigation guide, provided valuable information about the maritime trade activities in the Indian Ocean region, including the Sangam Age.<br/><br/>Ptolemy: Ptolemy, a Greco-Roman mathematician, astronomer, and geographer, also mentioned about the geography and trade routes of the Indian subcontinent during the Sangam Age.<br/><br/>Therefore, all of the foreign authors mentioned in the options - Pliny, the Elder, Strabo, the author of the Periplus of the Erythrean Sea, and Ptolemy - have contributed valuable insights about the Sangam Age and its trade connections with other parts of the world.",NA
"Which one of the following Tamil kings have sent the earliest embassy, (according to Strabo) which was met by Augustus at Athens about 20 B.C.?",NA,C,A Chola king,A Chera king,A Pandya king,A Pallava king,NA,NA,NA,NA,C is the correct option. Nicolaus of Damascus describes an embassy sent by the Indian king Porus (Pandya) to Caesar Augustus. The embassy traveled with a diplomatic letter on a skin in Greek. One of its members was a sramana who burned himself alive in Athens to demonstrate his faith.,NA
"Which of the following kings made a grand anicut on the Kaveri, the water of which is now-a-days drawn off through a new channel called Vennar?",NA,A,Karikala,Peruvaludi,Ilandiraiyan,Nendunjeliyan,NA,NA,NA,NA,"A is the correct option.In spite of being one of the glorious kings, <q>King Karikalan</q> is well known till this day for his monumental undertaking and completion of <q>Kaveri river - Kallanai dam (Grand Anicut) Irrigation project</q> that is fully functional till this day. River Kaveri is the greatest river of Chola Kingdom (Tamil Nadu).",NA
What were the <q>ma</q> and <q>vedi</q> in Sangam period?,NA,C,The taxes of the period,The coinage of the time,The measures of land,The words for love and war,NA,NA,NA,NA,"Explanation:<br/><br/><b>Ma and Vedi:</b> In the Sangam period, Ma and Vedi were measures of land used for taxation purposes.<br/><u>Ma:</u> Ma was a unit of land measurement equivalent to around 2.5 acres. It was used to assess the tax payable by farmers based on the extent of land they owned.<br/><u>Vedi:</u> Vedi was another unit of land measurement that was smaller than Ma. It was used to measure smaller plots of land for taxation purposes.<br/><u>Taxes:</u> The taxes collected based on Ma and Vedi were an essential source of revenue for the rulers during the Sangam period.<br/><br/><b>Importance:</b> Understanding these units of land measurement helps us comprehend the economic and administrative systems of the time, providing insights into the society&#39;s agricultural practices and taxation structure.",NA
"Which two of the Rock Edicts of Ashoka mention the Southern kingdoms Cholas, Pandyas, Satiyaputra, Keralaputra and Ceylon?",NA,B,Third and Tenth,Second and Thirteenth,Sixth and Nineth,Fourth and Fourteenth,NA,NA,NA,NA,"Explanation:<br/><br/><u>Rock Edicts of Ashoka:</u> These are a series of inscriptions on large rocks or pillars by the Mauryan Emperor Ashoka during his reign in the 3<sup>rd</sup> century BC.<br/><u>Southern Kingdoms mentioned:</u> Cholas, Pandyas, Satiyaputra, Keralaputra, and Ceylon are mentioned in the Rock Edicts of Ashoka.<br/><u>Identifying the correct Rock Edicts:</u> To determine which two Rock Edicts mention these Southern kingdoms, we need to refer to historical records and inscriptions.<br/><u>Second and Thirteenth Rock Edicts:</u> These two Rock Edicts of Ashoka mention the Southern kingdoms Cholas, Pandyas, Satiyaputra, Keralaputra, and Ceylon.<br/><br/>Therefore, the correct answer is B: Second and Thirteenth Rock Edicts of Ashoka mention the Southern kingdoms Cholas, Pandyas, Satiyaputra, Keralaputra, and Ceylon.",NA
"The Romans, trading with the Sangam kingdoms build a temple of Augustus at one of the following places. What is the name of that place?",NA,B,Arikamedu,Muziris,Nelcynda,Naura,NA,NA,NA,NA,"Temple of Augustus:<br/><br/>Location: The Romans, who were trading with the Sangam kingdoms, built a temple of Augustus at Muziris.<br/>Significance: Muziris was an ancient port city located in present-day Kerala, India. It was a major center for trade and attracted traders from various parts of the world, including the Romans.<br/>Historical Context: The temple of Augustus at Muziris is a testament to the cultural exchange and trade relations between the Romans and the Sangam kingdoms during that period.<br/>Archaeological Evidence: Archaeological excavations have revealed the presence of Roman artifacts and structures at Muziris, further confirming the historical significance of the site.",NA
In which year did Chola king Rajaraja I ascend the throne?,NA,B,988 C.E.,985 C.E.,983 C.E.,None of the above,NA,NA,NA,NA,"The correct answer is 985 C.E.<br/><br/><b>Key Points:</b><br/>Rajaraja I, a Chola emperor, ruled between 985 and 1014 CE.<br/>He is known for restoring the Chola hegemony and securing its dominance throughout the Indian Ocean during his time as the most powerful Tamil king in South India.<br/>He ruled over a sizable portion of northern Sri Lanka, the Chera country, and the Pandya country.<br/>Also, he bought Lakshadweep, the Thiladhunmadulu atoll, and a portion of the Maldives&#39; northernmost islands in the Indian Ocean.<br/><br/><b>Additional Information</b><br/><u>Pallava:</u><br/>??Around the fourth century AD, the South saw the rise of the Pallavas, who reached the pinnacle of their supremacy in the seventh century AD.<br/>For over 500 years, they were able to maintain their hegemony.<br/><u>Pandya:</u><br/>The Pandyan dynasty, commonly known as the Pandyas of Madurai, was one of the three major kingdoms of Tamilakam, or South India, together with the Chera and Chola dynasties.<br/><u>Chalukya:</u><br/>??During the sixth through the twelfth centuries, the Chalukya dynasty, a Classical Indian monarchy, ruled over a sizable portion of southern and central India.<br/>They held power as three interconnected but separate dynasties during this time.",NA
Administration of the Cholas was based on,NA,B,District administration,Local self-government,Panchayat System,None of the above,NA,NA,NA,NA,"The Cholas (850-1279 AD)<br/>The founder of the Chola dynasty was Vijayalaya who was at first a feudatory of Pallavas, known as Imperial Cholas of Tanjore.<br/>The greatest kings of Cholas were Rajaraja & his son Rajendra I.<br/><br/><b>Key Points</b><br/>Local self-government under Chola:<br/>-The most remarkable feature of the Chola administration was the organization of the local self-government.<br/>-This was organized on the Democratic lines. <br/>-Towns and villages had the primary assemblies and larger town had representative assemblies.<br/>-Uttiramerur Inscriptions gives a detailed account of the village administration.<br/>-There were two types of assemblies <i>Ur</i> and <i>Sabha</i>.<br/>Ur Nattam was a residential portion of the city.<br/>Ur was the general assembly of the village & Sabha was a gathering of adult men in the Brahmana village - Agrahara (rent-free villages with autonomy).<br/>- The main source of Income for the Chola Empire was land revenue, which was 1/6th of the produce.",NA
During the Chola period associations of traders were known as,NA,C,Gramam,Shrenis,Nagaram,None of the above,NA,NA,NA,NA,Trade and commerce flourished under the Cholas. Trade was carried on with West Asia and China and South-east Asia. Trade with China reached unprecedented volume during these centuries. Foreign trade provided an additional incentive to an already developing local market. There existed a brisk internal trade in several articles carried on by the organized mercantile corporations in various parts of the country. The metal industries and the jewelry art had reached a high degree of excellence. The manufacture of sea salt was carried on under government supervision and control.<br/>Trade was carried on by merchants organized in guilds. The guilds described sometimes by the terms nanadesis were a powerful autonomous corporation of merchants which visited different countries in the course of their trade.<br/>They had their own mercenary army for the protection of their merchandise. There were also local organizations of merchants called <q>nagaram</q> in big centers of trade like Kanchipuram and Mamallapuram.,NA
Who founded the Chola empire?,NA,D,Dantidurga,Singhavishnu,Upendrarai,Vijayalaya,NA,NA,NA,NA,"Key Points:<br/>Chola Empire was one of the longest-ruling dynasties in southern India, which existed from the 3rd century BCE to the 13th century CE.<br/>The Chola dynasty was known for its maritime trade, art, literature, and architecture.<br/>Vijayalaya Chola was the founder of the Chola Empire in 848 CE.<br/>Vijayalaya Chola was a Tamil ruler. <br/>He conquered the regions of Tanjore, Trichy, and parts of Pudukkottai and Tiruchirappalli, which formed the nucleus of the Chola Empire.<br/>The Chola Empire reached its zenith under the reign of Rajendra Chola I, who conquered territories up to the Ganges in the north and the Malay Peninsula in the south.<br/><br/>Additional Information<br/>Dantidurga was the founder of the Rashtrakuta Empire in the Deccan region.<br/>It existed from the 6th to the 10th century CE.<br/>Singhavishnu was a ruler of the Pallava dynasty.<br/>It existed in the southern part of India from the 3rd to the 9th century CE.<br/>Upendrarai is not a known historical figure or ruler in Indian history.",NA
What is ascending order of the following administrative units of Cholas?,NA,C,"Nadu, Valanadu, Mandalam, Kurrams","Mandalam, Nadu, Valanadu and Kurrams","Kurram, Nadu, Valanadu and Mandalams","Kurram, Mandalam, Valandu and Nadus",NA,NA,NA,NA,"The correct answer is Kurram, Nadu, Valanadu and Mandalams.<br/><br/>The administrative units of Cholas are as follow:<br/>The whole empire had been divided into nine provinces called mandalams.<br/>Each province was headed by a viceroy who received orders from the king.<br/>Each mandalam was divided into the number of Kottams or Valanadus which was further sub-divided into nadu.<br/>Each nadu was further divided into villages called Urs or Kurram.<br/><br/>Additional Information:<br/>The capital of the Cholas was Tanjore.<br/>The Chola Empire was divided into three major administrative units called Central Government, Provincial government, and local government.<br/>Uttaramerur inscriptions throws light on the administration of the Cholas.",NA
The Chola inscriptions describe land gifted for a school as _____.,NA,B,Tirunamattukkani,Shalabhoga,Pallichchhandam,Vellanvagai,NA,NA,NA,NA,"The correct answer is Shalabhoga.<br/><br/>Key Points:<br/>Shalabhoga stands with respect to revenue administration under the imperial Cholas is land donated for the maintenance of a school.<br/>The inscriptions of the Cholas who ruled in Tamil Nadu suggest that their kingdom used more than 400 terms for different kinds of taxes.<br/>Cholas were the most civilized race in the south Indian subcontinent.<br/><br/>Additional Information:<br/>The Chola Empire was one of the most famous empires in south India that came into prominence in the 9<sup>th</sup> century AD.<br/>Their kingdom was mainly concentrated in the Kaveri-fed delta called Cholamandalam.<br/>According to Chola inscriptions, there were five types of <q>land gifts</q> that Chola kings gave to their people.",NA
Who among the following was considered the most powerful Chola ruler?,NA,B,Rajendra I,Rajaraj I,Dantidurga,Vijayalaya,NA,NA,NA,NA,"Rajaraja Chola (985-1014 AD) is considered to be the greatest Chola ruler.<br/>He was one of the greatest kings of South India and was known as <q>Rajaraja the Great</q>.<br/>Under his rule, the Chola kingdom grew into an extensive and well-knit empire.",NA
