question_text,question_image,correct_answer,option_1_text,option_2_text,option_3_text,option_4_text,option_1_image,option_2_image,option_3_image,option_4_image,answer_explanation_text,answer_explanation_image
"Which one of the following Sangam towns was famous for its pearls and muslins, the latter being as thin as the skin of the snake?",NA,A,Uraiyur,Muziris,Arikamedu,Puhar,NA,NA,NA,NA,"Explanation:<br/><br/>Uraiyur: Uraiyur was known for its pearls and muslins, with the muslins being as thin as the skin of a snake.<br/>Muziris: Muziris was a bustling port town known for its trade and commerce.<br/>Arikamedu: Arikamedu was an ancient Roman trading center known for its trade relations with Rome.<br/>Puhar: Puhar was an ancient port city also known as Kaveripattinam, known for its trade and commerce.<br/>Therefore, the correct answer is Uraiyur, which was famous for its pearls and muslins, the latter being as thin as the skin of a snake.",NA
Identify the Chera monarch who was called Imayavaramban. <q>He who had the Himalaya for his boundary</q> and who carved the Chera emblem of the bow on the face of the great mountain?,NA,C,Kuttuvan,Udiyanjeral,Nedunjeral Adan,Senguttuvan,NA,NA,NA,NA,"Explanation:<br/><br/>Chera Monarch: The Chera monarch who was called Imayavaramban and carved the Chera emblem of the bow on the face of the great mountain is Nedunjeral Adan.<br/>Meaning of Imayavaramban: Imayavaramban means <q>He who had the Himalaya for his boundary</q>. <br/>Identification: Nedunjeral Adan, also known as Imayavaramban, was a powerful Chera monarch who had the Himalayas as his boundary and left his mark by carving the Chera emblem of the bow on the mountain.<br/>Other Chera Monarchs: While Kuttuvan, Udiyanjeral, and Senguttuvan were also prominent Chera monarchs, it was Nedunjeral Adan who was specifically known by the title Imayavaramban.",NA
The first historical reference to Tamils or Pandyas occurs in the work inscriptions of ,NA,A,Megasthenes,Periplus,Kautilya,Ashoka,NA,NA,NA,NA,"The Greek envoy, Megasthenes, mentions Madurai in his account of India in around 300 BC. It was in the period of the Roman empire, under the Pandya dynasty, that the city assumed its great importance, even sending embassies to Rome. Home to the ancient <q>Tamil Sangam</q>, (Academy of Tamil Learning), it became as important for its scholarship as for its religious heritage. One of the great Tamil literary epics <q>Silappadikaram</q> was written here in the Roman period.",NA
Which statement on Sangam history is incorrect?,NA,B,Vishnu worship with Tulsi was popular among the Sangam people.,"The Sangam people did not worship Siva, Balaram and Krishna.",Vedic religion of sacrifice was followed by the Sangam kings.,Buddhism and Jainism found a footing in the land of Sangam people.,NA,NA,NA,NA,"Incorrect Statement on Sangam History is B.<br/><b>The Sangam people did not worship Siva, Balaram and Krishna.</b> This statement is incorrect because the Sangam people worshipped various deities including Siva, Balaram, and Krishna.<br/><br/><b>Vishnu worship with Tulsi was popular among the Sangam people.</b>This statement is correct. Vishnu worship with Tulsi was indeed popular among the Sangam people.<br/><b>Vedic religion of sacrifice was followed by the Sangam kings.</b> This statement is correct. The Sangam kings followed the Vedic religion of sacrifice.<br/><b>Buddhism and Jainism found a footing in the land of Sangam people.</b> This statement is correct. Buddhism and Jainism did find acceptance among the people during the Sangam period.<br/>In conclusion, statement B is incorrect as the Sangam people did worship deities like Siva, Balaram, and Krishna.",NA
Which statement on Karikala is incorrect?,NA,D,"He defeated the Ceylonese and captured 12000 prisoners and put them to work at Puhar, a sea-port at the mouth of Kaveri.","He had the grand Ancient Srirangam built, thus controlling the waters of the Kaveri at the head of the delta.",He patronised brahmanical religion and Tamil literature.,He was defeated at the battle of Venni.,NA,NA,NA,NA,"Statement D is incorrect because Karikala was not defeated at the battle of Venni.<br/>In fact, Karikala was known for his military victories and strategic prowess. He successfully defeated the Ceylonese, built the grand Ancient Srirangam to control the waters of the Kaveri, and patronised brahmanical religion and Tamil literature.",NA
Which one of the following was the correct Tamil designation of the ministers during the Sangam age?,NA,B,Surram,Amaichchar,Mantri,Amatya,NA,NA,NA,NA,"Tamil Designation of Ministers during the Sangam Age<br/><br/><b>Amaichchar:</b> The correct Tamil designation of ministers during the Sangam age was <q>Amaichchar</q>. This term was used to refer to ministers who held important positions in the governing bodies of the Sangam period.<br/><br/><b>Surram:</b> <q>Surram</q> was not the correct Tamil designation of ministers during the Sangam age. It is not a term commonly used to refer to ministers in ancient Tamil literature.<br/><br/><b>Mantri:</b> <q>Mantri</q> is a Sanskrit term used to refer to ministers or advisors in Indian history. However, during the Sangam age, the term <q>Amaichchar</q> was more commonly used in Tamil literature.<br/><br/><b>Amatya:</b> Although <q>Amatya</q> is a term used in ancient Indian administration to refer to ministers or officers, it was not the specific Tamil designation used during the Sangam age.<br/><br/>Therefore, the correct Tamil designation of ministers during the Sangam age was <q>Amaichchar</q>. This term signifies the important role that ministers played in the governance and administration of the ancient Tamil society during the Sangam period.",NA
"After the death of which one of the following Roman kings, the trade was conducted more by barter than by coins on account of the financial difficulties of the Roman empire?",NA,C,Pius,Augustus,Nero,Claudium,NA,NA,NA,NA,"Financial Difficulties after the Death of Nero: After the death of Nero, the Roman Empire faced severe financial difficulties. This led to a decrease in the circulation of coins and an increase in barter trade. <br/><br/>Barter Trade: Barter trade is a system where goods and services are exchanged directly for other goods and services without using money. During times of financial crisis, like after Nero&#39;s death, barter trade becomes more common as people struggle to obtain coins for transactions.<br/><br/>Impact on Coinage:<br/>The decrease in coin circulation had a significant impact on the economy of the Roman Empire.<br/>Without enough coins in circulation, trade and commerce were disrupted, leading to further economic challenges.<br/><br/>Historical Context:<br/>Nero was the last of the Julio-Claudian dynasty, and his death marked the end of an era in Roman history. The financial difficulties that followed his reign had long-lasting effects on the Roman economy and society.",NA
Identify the great poet who was a contemporary of the Chola king Karikaral and the Chera King Senguttuvan.,NA,A,Paranar,Akkatiyar,Gajabahu,Kapilar,NA,NA,NA,NA,"Great Poet Contemporary of Chola King Karikaral and Chera King Senguttuvan was <br/>Paranar: The great poet Paranar was a contemporary of the Chola king Karikaral and the Chera King Senguttuvan. He was known for his contributions to Sangam literature and is considered one of the greatest Tamil poets of his time.<br/><br/>Paranar&#39;s works are highly regarded for their poetic excellence and deep insights into the human experience. His poems often explore themes of love, nature, and the passage of time, making him a beloved figure in Tamil literary history.",NA
What was the inland capital of the Sangam Cholas?,NA,D,Tanjore,Kaveripattanam,Tricharapalli,Uraiyur,NA,NA,NA,NA,"Explanation:<br/><br/><u>Tanjore:</u> Tanjore was the capital of the Chola dynasty but not specifically the Sangam Cholas.<br/><u>Kaveripattanam:</u> Kaveripattanam was an important port city but not the inland capital of the Sangam Cholas.<br/><u>Tricharapalli:</u> Tricharapalli was an important city during the Chola period but not the inland capital of the Sangam Cholas.<br/><u>Uraiyur:</u> Uraiyur was the inland capital of the Sangam Cholas. It was an important city located near present-day Tiruchirapalli in Tamil Nadu.<br/><br/>Therefore, the correct answer is D: Uraiyur, as it was the inland capital of the Sangam Cholas.",NA
What was the royal emblem for the Cheras?,NA,A,Bow,Elephant,Lion,Horse,NA,NA,NA,NA,"Royal Emblem of the Cheras was <b>A - Bow</b><br/><br/>Explanation:<br/>The royal emblem for the Cheras, an ancient dynasty in South India, was the bow.<br/>The Cheras were known for their military prowess and the bow was a symbol of strength and power in their culture.<br/>Using the bow as their royal emblem showcased their martial skills and leadership in battle.<br/>Other ancient Indian dynasties also used different symbols such as elephants, lions, and horses as their royal emblems.<br/>By understanding the significance of the bow as the royal emblem of the Cheras, we gain insight into their values and traditions as a warrior dynasty in ancient India.",NA
Tolkappium of the second Sangam deals with,NA,B,Poetry,Grammar,The heroic deeds of the Pandyas,The legend of Agastya,NA,NA,NA,NA,"Tolkappium of the second Sangam deals with <b>B - Grammar:</b> Another significant aspect dealt with in the Tolkappium is grammar. It provides insights into the rules and structures of the Tamil language, helping poets and writers enhance their literary skills.<br/><br/><u>Poetry:</u> The Tolkappium of the second Sangam primarily focuses on the art of poetry. It discusses various poetic forms, techniques, and themes that were prevalent during that period.<br/><u>The heroic deeds of the Pandyas:</u> The Tolkappium also highlights the heroic deeds of the Pandyas, a prominent dynasty in ancient Tamil Nadu. It glorifies their valor, achievements, and contributions to the society.<br/><u>The legend of Agastya:</u> Additionally, the Tolkappium delves into the legend of Agastya, a revered sage in Hindu mythology. It narrates his life, teachings, and influence on Tamil culture and literature.<br/><br/>By exploring these diverse topics, the Tolkappium of the second Sangam provides a comprehensive understanding of poetry, grammar, history, and mythology, enriching the literary landscape of ancient Tamil Nadu.",NA
Assertion A: In the Sangam period the Vellals were the biggest land-owning class and on account of their land ownership they enjoyed high position in the administration and government.<br/>Reason R: There are no references to <q>Serfs</q> but the status of agricultural labour was no better than that of serfs.,NA,B,If both A and R are true and R is the correct explanation of A.,If  both A and R are true but R is not the correct explanation of A.,If A is true and R is false.,If A is false and R is true.,NA,NA,NA,NA,"Analysis:<br/><br/>-The Vellals were indeed the largest land-owning class during the Sangam period, which allowed them to hold significant influence in the administration and government.<br/>-While the assertion talks about the Vellals' high position due to land ownership, the reason mentions the status of agricultural labor being similar to that of serfs without any direct reference to serfs.<br/>-However, the reason does not provide a direct explanation for why the Vellals held a high position, making it not the correct explanation for the assertion.<br/><br/>Conclusion: Therefore, both Assertion A and Reason R are true, but R is not the correct explanation of A.",NA
"Assertion A : Merchants sold their goods by openly announcing the profit they were aiming at.<br/>Reason R: Merchants functioned often in a body, which was known as <q>Vanikachattu</q>.",NA,B,If both A and R are true and R is the correct explanation of A.,If  both A and R are true but R is not the correct explanation of A.,If A is true and R is false.,If A is false and R is true.,NA,NA,NA,NA,"Explanation:<br/><br/>A is true and R is true: Merchants did indeed openly announce the profit they were aiming at while selling their goods. This was a common practice in ancient trading systems.<br/><br/>Correct explanation: The reason given is also true. Merchants often worked together in a body known as <q>Vanikachattu</q> to regulate trade practices, prices, and other aspects of commerce. This collective bargaining power allowed them to openly announce their profit margins.<br/><br/>Conclusion: Therefore, both Assertion A and Reason R are true, and Reason R provides a correct explanation for Assertion A. Hence, the correct answer is option B.",NA
"Assertion A : In the Sangam age, Variyilar was in charge of revenue collections.<br/>Reason R: Ayakkarar was the revenue accountant who moved place to place for the collection of trade and transit duties.",NA,B,If both A and R are true and R is the correct explanation of A.,If  both A and R are true but R is not the correct explanation of A.,If A is true and R is false.,If A is false and R is true.,NA,NA,NA,NA,"Evaluation:<br/><br/>-Both Assertion A and Reason R are true as per historical records.<br/>-Ayakkarar was indeed responsible for revenue collection, but Variyilar was the chief revenue officer who oversaw the entire revenue collection process.<br/>-While Ayakkarar moved from place to place for trade and transit duty collections, Variyilar was in charge of the overall revenue administration.<br/>-Therefore, Assertion A and Reason R are both true, but Reason R does not provide a correct explanation for Assertion A.<br/><br/>Hence, the correct answer is option B - Both A and R are true, but R is not the correct explanation of A.",NA
Assertion A : The unit of revenue yielding territory was known as <q>Variyam</q>.<br/>Reason R: Brahmins were totally exempted from the payment of land revenue or other taxes.,NA,C,If both A and R are true and R is the correct explanation of A.,If  both A and R are true but R is not the correct explanation of A.,If A is true and R is false.,If A is false and R is true.,NA,NA,NA,NA,"Analysis:<br/><br/>If both A and R are true, but R is false, then assertion A would still hold true as the unit of revenue yielding territory being known as <q>Variyam</q> is a factual statement.<br/><br/>However, the reason provided for this assertion, stating that Brahmins were totally exempted from the payment of land revenue or other taxes, is not correct. In reality, Brahmins were not totally exempt from paying taxes.<br/><br/>Conclusion:<br/>Hence, the correct answer is option C: If A is true and R is false. The unit of revenue yielding territory being known as <q>Variyam</q> is true, but the reason provided is false as Brahmins were not totally exempt from paying taxes.",NA
"Assertion A : There was an utter lack of local ad-ministrative institutions and, therefore, urban centres were badly neglected.<br/>Reason R: The revenue-free villages granted to Brahmins were called Brahmatyam.",NA,B,If both A and R are true and R is the correct explanation of A.,If  both A and R are true but R is not the correct explanation of A.,If A is true and R is false.,If A is false and R is true.,NA,NA,NA,NA,"<b>Evaluation of A and R:</b><br/><br/>A: The assertion is true because the lack of local administrative institutions led to urban centers being neglected.<br/>R: The reason states a fact about the revenue-free villages granted to Brahmins, which is not directly related to the assertion about the lack of local administrative institutions.<br/><br/>Option A: Both A and R are true, but R is not the correct explanation of A. Therefore, this option is incorrect.<br/>Option B: Both A and R are true, but R is not the correct explanation of A. Therefore, this option is correct.<br/>Option C: A is true, but R is false. This option is incorrect as both A and R are true.<br/>Option D: A is false, but R is true. This option is incorrect as A is true.<br/><br/>Therefore, the correct answer is option B, where both Assertion A and Reason R are true, but R is not the correct explanation of A.",NA
Which Tamil work throws light on India&#39;s flourishing trade with the Roman Empire?,NA,D,Ettutogai,Pattupattu,Manimekali,Silappadikaram,NA,NA,NA,NA,"Explanation:<br/><br/><b>Silappadikaram:</b> Silappadikaram is a Tamil epic that dates back to the 2nd century CE and is one of the five great epics of Tamil literature. It is a story of Kannagi, a chaste woman who seeks justice for her husband&#39;s false accusation and death.<br/><br/><b>Trade with the Roman Empire:</b> Silappadikaram throws light on India&#39;s flourishing trade with the Roman Empire. It portrays the economic and cultural exchanges between the Tamil regions and the Roman Empire during ancient times.<br/><br/><b>Portrayal of Trade:</b> The epic depicts the bustling port cities of Puhar (now known as Kaveripattinam) and Korkai, which were important centers of trade and commerce. It highlights the prosperity and cosmopolitan nature of these cities due to the trade connections with the Roman Empire.<br/><br/><b>Cultural Exchange:</b> Through the characters and events in Silappadikaram, the author showcases the interactions between Tamil society and the Roman traders. It provides insights into the cultural influences, goods exchanged, and the impact of trade on the local economy.<br/><br/><b>Historical Significance:</b> The portrayal of trade with the Roman Empire in Silappadikaram contributes to our understanding of ancient India&#39;s commercial relations with other civilizations. It sheds light on the maritime trade routes, mercantile activities, and the diverse cultural exchanges that took place during that period.",NA
What was the royal emblem for the Pandyas?,NA,D,Arrow,Bow,Tiger,Fish,NA,NA,NA,NA,Fish was the royal emblem of Pandya Kingdom. The Pandyas were also mentioned by Megasthanese who said that then kingdom was famous for pearls.,NA
Who was the chief deity of the Sangam age?,NA,A,Murugan,Siva,Indra,Vishnu,NA,NA,NA,NA,"Chief Deity of the Sangam Age: Murugan<br/><br/>Murugan: The chief deity of the Sangam age was Murugan, also known as Kartikeya or Skanda. He is a popular Hindu god, particularly worshipped in South India.<br/>Siva: While Siva is also a prominent deity in Hinduism, during the Sangam age, Murugan held the position of the chief deity.<br/>Indra: Indra is a deity in Hindu mythology, known as the king of gods. However, he was not considered the chief deity during the Sangam age.<br/>Vishnu: Vishnu is another important deity in Hinduism, known as the preserver of the universe. However, he was also not the chief deity during the Sangam age.<br/><br/>By studying the historical and cultural context of the Sangam age, it is evident that Murugan held the position of chief deity during that period.",NA
While Pandyan king is mentioned in the <q>Silappadikaram</q>?,NA,C,Senguttuvan,Karikala,Nedunjeliyan,Elara,NA,NA,NA,NA,"Explanation:<br/><br/>Pandyan Kingdom: The Pandyan Kingdom was one of the three oldest Tamil dynasties in South India. It was known for its patronage of Tamil literature and arts.<br/>Silappadikaram: Silappadikaram is one of the five great epics of Tamil literature. It was written by Ilango Adigal during the Sangam period.<br/>King Mentioned: In Silappadikaram, the Pandyan king mentioned is Nedunjeliyan.<br/>Nedunjeliyan: Nedunjeliyan was a legendary Pandyan king who ruled Madurai. He is known for his valor and generosity.<br/>By following these points, we can conclude that the Pandyan king mentioned in Silappadikaram is Nedunjeliyan.",NA
Assertion A: Uraiyur and Madurai were the leading centres of textile industry.<br/>Reason R: Untouchability was practised but slavery was unknown.,NA,B,If both A and R are true and R is the correct explanation of A.,If  both A and R are true but R is not the correct explanation of A.,If A is true and R is false.,If A is false and R is true.,NA,NA,NA,NA,"<b>Evaluation of A and R:</b><br/><br/>-If we look at the history of Uraiyur and Madurai, both cities were indeed known for their flourishing textile industry during ancient times. The textile industry was a major economic activity in these regions.<br/>-Untouchability was a prevalent practice in ancient India, including in regions like Uraiyur and Madurai. However, slavery was not commonly practiced in these regions.<br/>-While both A and R are true, it can be seen that the practice of untouchability and the absence of slavery are not directly related to the prominence of the textile industry in Uraiyur and Madurai.<br/>-Therefore, while both statements are true, the reason provided does not directly explain why Uraiyur and Madurai were leading centres of the textile industry. Hence, option B is the correct choice.<br/>-<b>Conclusion:</b><br/>Option B is the correct answer as both Assertion A and Reason R are true, but the reason is not the correct explanation of the assertion.",NA
"Assertion A : Women do not seem to have owned property, irrespective of whether they were queens or farm labourers.<br/>Reason R: Sati was known though not universal, but we find no instances of unwilling women being forced to it.",NA,B,If both A and R are true and R is the correct explanation of A.,If  both A and R are true but R is not the correct explanation of A.,If A is true and R is false.,If A is false and R is true.,NA,NA,NA,NA,"<b>Assertion A:</b> Women not owning property was a common practice in historical societies, where women&#39;s rights were limited and property ownership was mainly reserved for men. This was true for women across different social strata, including queens and farm labourers.<br/><br/><b>Reason R:</b> The practice of Sati, where a widow self-immolated on her husband's funeral pyre, was known in certain societies. However, it was not a universal practice and there were instances where women were not forced into it against their will.<br/><br/><u>Explanation:</u> While both Assertion A and Reason R are true, Reason R does not directly explain why women did not own property. The lack of property ownership by women was a result of societal norms and gender inequalities, whereas Sati was a specific cultural practice.<br/>Therefore, option B is the correct choice as both statements are true but Reason R is not the correct explanation of Assertion A.",NA
Korkai was the coastal capital of,NA,C,Cheras,Cholas,Pandyas,Pallavas,NA,NA,NA,NA,"Explanation:<br/><br/>Korkai was the coastal capital of Pandyas: Korkai was an ancient port city located in present-day Tamil Nadu, India. It was the capital of the Pandyan Kingdom, one of the four major Dravidian kingdoms mentioned in ancient Tamil literature.<br/><u>Cheras, Cholas, and Pallavas:</u> While Cheras, Cholas, and Pallavas were also prominent dynasties in South India, Korkai specifically served as the capital of the Pandyan Kingdom.<br/><br/><u>Importance of Korkai:</u> Korkai was known for its maritime trade and was a significant center for pearl fishing. The city&#39;s strategic location on the coast contributed to its prosperity and importance in ancient times.<br/><u>Archaeological significance:</u> Excavations in Korkai have revealed valuable information about the ancient Pandyan civilization, including artifacts, inscriptions, and structures that provide insights into the culture and history of the region.",NA
What was known as <q>Yavanapriya</q>?,NA,A,Pepper,Ginger,Cotton,Silk,NA,NA,NA,NA,"<u>Yavanapriya:</u> Yavanapriya is another name for pepper in ancient Indian texts and Ayurveda.<br/><br/><u>Pepper:</u> Pepper, also known as black gold, is one of the most popular spices used worldwide for its flavor and medicinal properties.<br/><br/><u>Usage:</u> Pepper was highly valued in ancient times and was considered a precious commodity due to its various uses in cooking, medicine, and preserving food.<br/><br/><u>Ayurveda:</u> In Ayurveda, pepper is believed to have digestive, antioxidant, and antibacterial properties, making it a valuable spice in traditional medicine.",NA
Uraiyur during the Sangam period was famous for,NA,B,Leather goods,Pearls and muslin,Gold,Ivory,NA,NA,NA,NA,"Reasons why Uraiyur was famous for pearls and muslin during the Sangam period:<br/><br/><u>Trade Routes:</u> Uraiyur was strategically located along trade routes that facilitated the exchange of goods, including pearls and muslin.<br/><u>Skilled Artisans:</u> The city was known for its skilled artisans who specialized in crafting pearls into jewelry and weaving muslin fabric.<br/><u>Royal Patronage:</u> The rulers of Uraiyur provided patronage to craftsmen and traders dealing in pearls and muslin, leading to the growth of these industries in the region.<br/><u>Natural Resources:</u> The proximity of Uraiyur to natural resources like pearls from the sea and cotton for muslin production further boosted these industries.<br/><u>Market Demand:</u> The demand for pearls and muslin was high among the elite and affluent classes, both locally and in trade with other regions, making Uraiyur a prominent center for these luxury goods.<br/>By considering these factors, it is evident that Uraiyur gained fame for pearls and muslin during the Sangam period due to a combination of strategic location, skilled artisans, royal patronage, natural resources, and market demand.",NA
