question_text,question_image,correct_answer,option_1_text,option_2_text,option_3_text,option_4_text,option_1_image,option_2_image,option_3_image,option_4_image,answer_explanation_text,answer_explanation_image
"With reference to Ocean Mean Temperature (OMT), which of the following statements is/are correct? <br/>1. OMT is measured up to a depth of 26 &deg;C isotherm which is 129 meters in the south-western Indian Ocean during January-March. <br/>2. OMT collected during January-March can be used in assessing whether the amount of rainfall in monsoon will be less or more than a certain long-term mean. <br/>Select the correct answer using the code given below:",NA,B,1 only,2 only,Both 1 and 2,Neither 1 nor 2,NA,NA,NA,NA,"The correct answer is 2 only.<br/><br/>Key Points:<br/>- The depth for the 26-degree isotherm is 50-100 meters, not 129 meters. Hence statement 1 is not correct.<br/>- During January-March, the mean 26 degrees isotherm depth in the Southwestern Indian Ocean is 59 meters. <br/>- Ocean mean temperature (OMT) is a better indicator of monsoon rainfall than sea surface temperature (SST) because it measures ocean thermal energy. Hence statement 2 is correct.",NA
Which of the following statements is incorrect?,NA,C,Isotherms are the lines joining places having equal temperature.,The isotherms deviate to the north over the Ocean and to the South Over the continent in January.,The isotherms are more or less parallel to the latitudes and the temperature variation is more gradual in the Northern hemisphere.,None of the above,NA,NA,NA,NA,"Option 3 is NOT correct.<br/><br/>Key Points:<br/>- Isotherms are the lines joining places having an equal temperature. <br/>- Latitude impacts temperature. <br/>- In January the isotherms deviate to the north over the Ocean and to the South over the continent. <br/>- The effect of the ocean is well pronounced in the southern hemisphere. <br/>- The isotherms are more or less parallel to the latitudes and the temperature variation is more gradual in the Southern hemisphere. Hence, option 3 is NOT correct.<br/><br/>In July the isotherms generally run parallel to the latitudes. <br/>The highest range of temperatures is more than 60 degrees Celsius over the North-Eastern part of the Eurasian continent, This is due to continentality. <br/>The least range of temperatures which is 3 degrees Celsius is found between 20 degrees south and 15 degrees north.",NA
"A new type of El Nino called El Nino Modoki appeared in the news. In this context, consider the following statements:<br/>1. Normal El Nino forms in the Central Pacific ocean whereas El Nino Modoki forms in the Eastern Pacific ocean. <br/>2. Normal El Nino results in diminished hurricanes in the Atlantic ocean but El Nino Modoki results in a greater number of hurricanes with greater frequency.<br/>Which of the statements given above is/are correct?",NA,B,1 only,2 only,Both 1 and 2,Neither 1 nor 2,NA,NA,NA,NA,"The correct answer is 2 only.<br/><br/>Key Points:<br/>El Nino Modoki:-<br/>- Modoki was a Japanese term that means The same thing but different.<br/>- El Nino Modoki was a new type of El Nino which formed in the Central Pacific, not in the Eastern Pacific Hence 1 is not correct.<br/>- It warmed the central pacific with a greater potential for making landfall along the gulf coast and coast of central America.<br/>- Normally El Nino results in diminished hurricanes in the Atlantic ocean but El Nino Modoki results in a greater number of hurricanes with greater frequency, Hence statement 2 is correct.",NA
Which of the following is the extension of the South Temperate Zone?,NA,A,From Tropic of Capricorn to the Antarctic Circle,From Equator to the Arctic Circle,From Equator to the Tropic of Cancer,From Tropic of Cancer to the Arctic Circle,NA,NA,NA,NA,"The temperate zone is the area or region between the Tropic of Cancer and the arctic circle or between the Tropic of Capricorn and the antarctic circle. <br/>-It also divided into several smaller climate zones, based on monthly temperatures, the coldest month, and rainfall.<br/>- It includes a humid subtropical climate, Mediterranean climate, oceanic, and continental climate.<br/><br/>Important Points:<br/>Let us look at the different temperate zones:<br/>- South Temperate Zone, between the Tropic of Capricorn at 23&deg; 27&#39; S and the Antarctic Circle at 66&deg; 33&#39; S, covers 25.99% of Earth&#39;s surface.<b/>- It includes Southern Australasia, southern South America, and Southern Africa. <br/>- The north temperate zone extends from (approximately 23.5&deg; North) to the Arctic Circle (approximately 66.5&deg; North latitude).<br/>- It includes Europe, Northern Asia, and North and Central America. <br/>- From the above, we can conclude that the South Temperate Zone extends from the Tropic of Capricorn to the Antarctic Circle.",NA
Consider the following statements:<br/>Statement-I: The temperature contrast between continents and oceans is greater during summer than in winter.<br/>Statement-II: The specific heat of water is more than that of land surface.<br/>Which one of the following is correct in respect of the above statements?,NA,D,Both Statement-I and Statement-II are correct and Statement-II is the correct explanation for Statement-l,Both Statement-I and Statement-II are correct and Statement-II is not the correct explanation for Statement-I,Statement-I is correct but Statement-II is incorrect,Statement-I is incorrect Statement-II is correct,NA,NA,NA,NA,"Statement-I: Explanation:<br/>The temperature contrast between continents and oceans is actually greater during winter than in summer. In winter, the land cools down much more quickly and to a greater extent than the oceans, leading to a larger temperature contrast. In summer, although the land heats up faster, the difference in temperature between land and sea is generally less extreme than in winter. Hence statement (I) is incorrect<br/><br/>Statement-II Explanation:<br/>The specific heat of water is more than that of the land surface.<br/>Specific heat is a measure of how much heat energy is needed to raise the temperature of a substance.<br/>In this case, water has a higher specific heat than land, meaning it takes more heat energy to raise the temperature of water than it does to raise the temperature of land.<br/>This means that, for the same amount of sunlight energy, water will heat up less than land. Similarly, it takes more loss of heat for water to cool down than it does for land. Hence statement (II) is correct. <br/><br/>Relation between the Statements:<br/>The higher specific heat of water means that water changes its temperature more slowly than land, which leads to a greater temperature contrast between continents and oceans during the summer.<br/>So, the correct answer is Option 4",NA
The heat energy absorbed by a known area in a fixed time is determined with the help of an instrument called,NA,B,Psychrometer,Pyrheliometer,Thermometric well,Any instrument,NA,NA,NA,NA,"A <b>pyrheliometer</b> is a device that measures solar irradiance coming directly from the sun. The SI units of irradiance are watts per square metre (W/m<sup>2</sup>). Traditionally pyrheliometers were mainly used for climatological research and weather monitoring purposes, however recent worldwide interest in solar energy has also led to an increased interest in pyrheliometers.<br/><br/>The <b>psychrometer</b> is a combination digital hygrometer and digital thermometer used to measure relative humidity or air humidity as well as air temperature, dew point temperature and wet-bulb temperature.<br/><br/><b>Thermometric well</b> is used to measure the temperature of gas flowing through a pipeline. A small tube called thermometric well is welded radially into the pipeline. The well is partially filled with some liquid and the thermometer is immersed into this liquid. When the temperature of the gas flowing through the pipeline is higher than the ambient temperature, the heat flows from the hot gases towards the tube walls along the well.",NA
Higher latitudes are not permanently frozen because of,NA,C,Presence of warm and cold currents,Very less insolation,Redistribution of surplus heat energy pole wards from tropics,Local aspects,NA,NA,NA,NA,The answer is C: <q>Redistribution of surplus heat energy pole wards from tropics.</q><br/>The surplus heat energy from the tropics is redistributed pole wards and as a result the tropics do not get progressively heated up due to the accumulation of excess heat or the high latitudes get permanently frozen due to excess deficit.,NA
