question_text,question_image,correct_answer,option_1_text,option_2_text,option_3_text,option_4_text,option_1_image,option_2_image,option_3_image,option_4_image,answer_explanation_text,answer_explanation_image
The recognition of Caliph&#39;s authority by the Delhi sultans at the most meant,NA,D,That the Sultan was a vassal of the Caliph,That the Sultan was not the real ruler,Subordination of the Sultan&#39;s sovereignty to that of the Caliph,That the Sultan was the supreme judicial authority subject only to the tenets of the Shariat,NA,NA,NA,NA,"Explanation: <br/>Caliph&#39;s authority: The recognition of the Caliph&#39;s authority by the Delhi sultans indicated that they acknowledged the Caliph as the supreme leader of the Islamic world. <br/><br/>Supreme judicial authority: This recognition did not mean that the Sultan was a vassal or subordinate to the Caliph, but rather that the Sultan was the supreme judicial authority subject only to the principles of the Shariat. <br/><br/>Independence of rule: The Delhi sultans were independent rulers in their own right, but they respected the spiritual and symbolic authority of the Caliph as the leader of the Islamic community. <br/><br/>Religious legitimacy: By recognizing the Caliph&#39;s authority, the Delhi sultans sought to legitimize their rule in the eyes of their subjects who were devout Muslims. <br/><br/>Political implications: While the recognition of the Caliph&#39;s authority did not undermine the Sultan&#39;s sovereignty, it did establish a religious and symbolic connection between the Delhi sultans and the Caliphate.",NA
Which of the following is not correct?,NA,D,At the time of his accession Qutab-ud-din Aibak had to deal with the Turkish rivals like Tajuddin Yilduz and Nasiruddin Qubacha,At the time of his accession Qutab-ud-din had to deal with the Gahadwals who had regained most of their power in Farrukhabad and Badaun.,At the time of his accession Qutab-ud-din had to deal with the Chauhans who had conquered Delhi in 1206 A.D.,At the time of his accession Qutab-ud-Aibak had to deal with the Chandelas who had recovered Kalinjar in 1206 A.D,NA,NA,NA,NA,The correct answer is C as all the given statements are true except At the time of his accession Qutab-ud-din had to deal with the Chauhans who had conquered Delhi in 1206 A.D,NA
Who was known as <q>Lakh Buksh</q>?,NA,A,Aibak,Iltutmish,Balban,Raziya,NA,NA,NA,NA,"The correct answer is Option A: Aibak. <br/>Explanation: Option A: Aibak <br/>Qutb-ud-din Aibak, the founder of the Delhi Sultanate, was known as <q>Lakh Buksh</q>. <br/><br/>Option B: Iltutmish<br/>Iltutmish was the third ruler of the Delhi Sultanate and known for his administrative reforms. <br/><br/>Option C: Balban<br/>Balban was a powerful ruler of the Delhi Sultanate known for his strong and authoritarian rule. <br/><br/>Option D: Raziya<br/>Raziya Sultana was the only female ruler of the Delhi Sultanate and known for her courage and administrative abilities.",NA
Which of the following statements is incorrect in connection with the political situation obtaining at the time of the accession of Iltutmish to the throne of Delhi ?,NA,B,"The Punjab was hostile to Iltutmish, Qubacha had seized Lahore.",Yilduz alone was supporting Iltutmish.,Bengal and Bihar had served their connection with Delhi,The Rajput rulers who has been defeated by Muhammad of Gaur had repudiated their allegiance to Delhi.,NA,NA,NA,NA,"Detailed Explanation: <br/>Statement A: This statement is correct as the Punjab was indeed hostile to Iltutmish, and Qubacha had seized Lahore.<br/>Statement B: This statement is incorrect as Yilduz was not the only one supporting Iltutmish. There were other allies as well who supported him during his accession to the throne.<br/>Statement C: This statement is correct as Bengal and Bihar had indeed severed their connection with Delhi at that time.<br/>Statement D: This statement is correct as the Rajput rulers who were defeated by Muhammad of Gaur had repudiated their allegiance to Delhi. <br/>Therefore, the incorrect statement in connection with the political situation at the time of Iltutmish&#39;s accession to the throne of Delhi is Statement B, as Yilduz was not the only supporter of Iltutmish.",NA
Which of the following is incorrect?,NA,B,The victory of Iltutmish against Tajuddin Yilduz made the Sultanate of Delhi a sovereign state in fact though not in theory.,Iltutmish saved the Delhi Sultanate from the menace of the Mongols by ceding to them the Punjab,Iltutmish made a vigorous assault on Bhakkar which so much terrified Qubacha that he threw himself in the Indus and was drowned,Iltutmish saved the Delhi Sultanate from the menace of Mongols by refusing to give shelter to Jalal-ud-din Mangbarni of Khwarism who was being pursued by the Mongols.,NA,NA,NA,NA,"Option B is incorrect as Iltutmish did not save the Delhi Sultanate by ceding Punjab to the Mongols, but actually saved it by refusing to give shelter to a Mongol pursuer.",NA
The only Indian Muslim to sit on the throne of Delhi during the Sultanate period was,NA,C,Mubarak Khalji,Raihan,Nasiruddin Khusrau Shah,Muhammad Khebru,NA,NA,NA,NA,"Mubarak Khalji: Mubarak Khalji was a ruler of the Khalji dynasty in Delhi Sultanate, but he was not the only Indian Muslim to sit on the throne of Delhi during the Sultanate period. <br/><br/>Raihan: Raihan is not a known ruler of Delhi Sultanate, so he is not the correct answer. <br/><br/>Nasiruddin Khusrau Shah: Nasiruddin Khusrau Shah was the only Indian Muslim to sit on the throne of Delhi during the Sultanate period. He was the last ruler of the Khilji dynasty. <br/><br/>Muhammad Khebru: Muhammad Khebru was not a ruler of Delhi Sultanate, so he is not the correct answer. <br/><br/>Therefore, the correct answer is Nasiruddin Khusrau Shah.",NA
What was the name of the Sultan who ascended the throne of Delhi after the death of Balban?,NA,A,Jalaluddin Khalji,Nasir-ud-din Mahmud,Aram Shah,Mubarak Shah,NA,NA,NA,NA,"After Balban&#39;s death in 1287, Delhi's kotwal Malik al-Umara Fakhruddin enthroned Balban&#39;s teenage grandson Muiz ud din Qaiqabad (or Kayqubad) with the title Muizzuddin. Qaiqabad was a weak ruler, and the administration was actually run by his officer Malik Nizamuddin. After Nizamuddin was poisoned by some rival officers, Qaiqabad summoned Jalal-ud-din from Samana to Delhi, gave him the title <q>Shaista Khan</q>, appointed him as the ariz-i-mumalik, and made him the governor of Baran. <br/><br/>By this time, Qaiqabad&#39;s health had deteriorated, and two rival factions of nobles vied for the power in Delhi. One faction, led by Malik Aytemur Surkha, sought to maintain the power of the old Turkic nobility, and wanted to retain Balban&#39;s family on the throne. The other faction, led by Jalal-ud-din, supported the rise of the new nobility.",NA
What the word <q>Khalji Revolution</q> stands for?,NA,D,Change in the racial composition of the rulers.,Dynastic change from Ilbaris to the Khaljis.,Creation of heterogenous nobility and revolutionary administrative changes,All of the above.,NA,NA,NA,NA,"Explanation:<br/><br/>Khalji Revolution: The Khalji Revolution refers to a series of changes that took place during the Khalji dynasty&#39;s rule in India (1290-1320).<br/><br/>Change in the racial composition of the rulers: The Khaljis were of Turkish origin, which marked a shift in the racial composition of the rulers from the previous Ilbaris dynasty.<br/><br/>Dynastic change from Ilbaris to the Khaljis: The Khalji Revolution involved a dynastic change from the Ilbaris to the Khaljis, signifying a change in ruling power and authority.<br/><br/>Creation of heterogeneous nobility and revolutionary administrative changes: The Khalji Revolution also led to the creation of a heterogeneous nobility, consisting of people from different backgrounds, and brought about revolutionary administrative changes in the governance system. <br/><br/>All of the above: Therefore, the Khalji Revolution encompasses all of the mentioned aspects, including the change in rulers' racial composition, dynastic shift, and administrative reforms.",NA
"Dr. Ishwari Prasad writes, <q>He always behaved like a well bred oriental monarch. His sense of kingly dignity was so great that he never ap-peared but in full dress ever before his private servants. He never laughed aloud nor joked in his durbar nor did he permit any one to indulge in laughter or amusement in his presence</q>. Who is that king?",NA,A,Balban,Ala-ud-din Khalji,Muhammad-bin-Tughlaq,Mubarak Shah,NA,NA,NA,NA,"Identifying the King: <br/>Behavior: The king in question always behaved like a well-bred oriental monarch, displaying a sense of kingly dignity.<br/><br/>Dress Code: He never appeared before his private servants without being in full dress, emphasizing his regal demeanor.<br/><br/>Attitude: The king did not indulge in laughter or amusement in his durbar, maintaining a serious and dignified demeanor at all times. <br/><br/>Conclusion: <br/>Based on the description provided by Dr. Ishwari Prasad, the king being referred to is Balban. Balban was known for his strict and authoritative rule, emphasizing his royal status through his behavior and interactions with others.",NA
What was the name of the south Indian ruler who defeated the army of Ala-ud-din Khalji in 1303?,NA,A,Pratap Rudra II,Raja Karan,Maladeva,Raja Rama Chandra,NA,NA,NA,NA,"Pratap Rudra, also known as Rudradeva II, was the last ruler of the Kakatiya dynasty of India. He ruled the eastern part of Deccan, with his capital at Warangal. Prataparudra succeeded his grandmother Rudramadevi as the Kakatiya monarch. He defeated the first invasion of the army of Ala uddin Khilji in 1303. It was in Karimnagar district. But later in 1310 or so Khilji defeated the kakatiyas - Prataprudra surrendered and made a pact to pay heavy ransoms.",NA
